/* DDL */
-- error
CREATE TABLE t0_create_table(c1 INTEGER NOT NULL);
ERROR:  This database is for Tsurugi, so CREATE TABLE is not supported
--
CREATE FOREIGN TABLE t1_create_table(c1 INTEGER NOT NULL) SERVER tsurugidb;
CREATE FOREIGN TABLE t2_create_table(c1 INTEGER NOT NULL, c2 BIGINT, c3 DOUBLE PRECISION) SERVER tsurugidb;
/* DML */
SELECT * FROM t1_create_table;
 c1 
----
(0 rows)

INSERT INTO t1_create_table (c1) VALUES (1);
SELECT * FROM t1_create_table;
 c1 
----
  1
(1 row)

SELECT * FROM t2_create_table;
 c1 | c2 | c3 
----+----+----
(0 rows)

INSERT INTO t2_create_table (c1, c2, c3) VALUES (1, 100, 1.1);
INSERT INTO t2_create_table (c1, c2, c3) VALUES (2, 200, 2.2);
SELECT * FROM t2_create_table;
 c1 | c2  | c3  
----+-----+-----
  1 | 100 | 1.1
  2 | 200 | 2.2
(2 rows)

SELECT * FROM t1_create_table;
 c1 
----
  1
(1 row)

INSERT INTO t1_create_table (c1) VALUES (10);
INSERT INTO t1_create_table (c1) VALUES (100);
SELECT * FROM t1_create_table;
 c1  
-----
   1
  10
 100
(3 rows)

SELECT * FROM t2_create_table;
 c1 | c2  | c3  
----+-----+-----
  1 | 100 | 1.1
  2 | 200 | 2.2
(2 rows)

UPDATE t2_create_table SET c2 = c2+10;
UPDATE t2_create_table SET c3 = c3+1.1 WHERE c2 = 110;
SELECT * FROM t2_create_table;
 c1 | c2  | c3  
----+-----+-----
  1 | 110 | 2.2
  2 | 210 | 2.2
(2 rows)

SELECT * FROM t1_create_table;
 c1  
-----
   1
  10
 100
(3 rows)

DELETE FROM t1_create_table WHERE c1 = 10;
SELECT * FROM t1_create_table;
 c1  
-----
   1
 100
(2 rows)

/* Fix tsurugi-issues#568 */
INSERT INTO public.t1_create_table (c1) VALUES (1000);
INSERT INTO PuBlIc.t1_create_table (c1) VALUES (2000);
INSERT INTO PUBLIC.t1_create_table (c1) VALUES (3000);
INSERT INTO "public"."t1_create_table" (c1) VALUES (4000);
SELECT * FROM public.t1_create_table;
  c1  
------
    1
  100
 1000
 2000
 3000
 4000
(6 rows)

UPDATE public.t1_create_table SET c1 = c1+100;
UPDATE PuBlIc.t1_create_table SET c1 = c1+100 WHERE c1 > 1000;
UPDATE public.t1_create_table SET c1 = c1+100 WHERE c1 > 2000;
UPDATE "public"."t1_create_table" SET c1 = c1+100 WHERE c1 > 3000;
SELECT * FROM "public"."t1_create_table";
  c1  
------
  101
  200
 1200
 2300
 3400
 4400
(6 rows)

DELETE FROM public.t1_create_table WHERE c1 = 200;
DELETE FROM "public"."t1_create_table" WHERE c1 > 1000;
SELECT * FROM Public.t1_create_table;
 c1  
-----
 101
(1 row)

INSERT INTO "puBlIc"."t1_create_table" (c1) VALUES (999); -- error
ERROR:  relation "puBlIc.t1_create_table" does not exist
LINE 1: INSERT INTO "puBlIc"."t1_create_table" (c1) VALUES (999);
                    ^
UPDATE "PUBLIC"."t1_create_table" SET c1 = c1+100; -- error
ERROR:  relation "PUBLIC.t1_create_table" does not exist
LINE 1: UPDATE "PUBLIC"."t1_create_table" SET c1 = c1+100;
               ^
DELETE FROM "Public"."t1_create_table" WHERE c1 > 1000; -- error
ERROR:  relation "Public.t1_create_table" does not exist
LINE 1: DELETE FROM "Public"."t1_create_table" WHERE c1 > 1000;
                    ^
/* DDL */
DROP FOREIGN TABLE t1_create_table;
DROP FOREIGN TABLE t2_create_table;
