/* Test case: happy path - Supported data types */
-- Numeric Types - integer
--- Test setup: DDL of the Tsurugi
SELECT tg_execute_ddl('
  CREATE TABLE fdw_type_int (c INT)
', 'tsurugidb');
 tg_execute_ddl 
----------------
 CREATE TABLE
(1 row)

--- Test setup: DDL of the PostgreSQL
CREATE FOREIGN TABLE fdw_type_int (
  c integer
) SERVER tsurugidb;
--- Test
INSERT INTO fdw_type_int VALUES (12345);
INSERT INTO fdw_type_int VALUES (-12345);
INSERT INTO fdw_type_int VALUES (NULL);
INSERT INTO fdw_type_int VALUES (2147483644);  --max-3
INSERT INTO fdw_type_int VALUES (2147483645);  --max-2
INSERT INTO fdw_type_int VALUES (2147483646);  --max-1
INSERT INTO fdw_type_int VALUES (2147483647);  --max
INSERT INTO fdw_type_int VALUES (-2147483645);  --min+3
INSERT INTO fdw_type_int VALUES (-2147483646);  --min+2
INSERT INTO fdw_type_int VALUES (-2147483647);  --min+1
INSERT INTO fdw_type_int VALUES (-2147483648);  --min
INSERT INTO fdw_type_int VALUES (CAST(1.1 AS int));
INSERT INTO fdw_type_int VALUES (2.1);  -- see tsurugi-issues#736
INSERT INTO fdw_type_int VALUES (3.1);  -- see tsurugi-issues#736
INSERT INTO fdw_type_int VALUES (cast(0.1 as int));
SELECT * FROM fdw_type_int ORDER BY c;
      c      
-------------
            
 -2147483648
 -2147483647
 -2147483646
 -2147483645
      -12345
           0
           1
           2
           3
       12345
  2147483644
  2147483645
  2147483646
  2147483647
(15 rows)

SELECT * FROM fdw_type_int WHERE c = 2147483647 ORDER BY c;
     c      
------------
 2147483647
(1 row)

SELECT * FROM fdw_type_int WHERE c = -2147483648 ORDER BY c;
      c      
-------------
 -2147483648
(1 row)

UPDATE fdw_type_int SET c = 2147483647 WHERE c = -2147483648;
SELECT * FROM fdw_type_int WHERE c = 2147483647 ORDER BY c;
     c      
------------
 2147483647
 2147483647
(2 rows)

UPDATE fdw_type_int SET c = -2147483648 WHERE c = 2147483647;
SELECT * FROM fdw_type_int WHERE c = -2147483648 ORDER BY c;
      c      
-------------
 -2147483648
 -2147483648
(2 rows)

DELETE FROM fdw_type_int WHERE c = -2147483648;
SELECT * FROM fdw_type_int ORDER BY c;
      c      
-------------
            
 -2147483647
 -2147483646
 -2147483645
      -12345
           0
           1
           2
           3
       12345
  2147483644
  2147483645
  2147483646
(13 rows)

UPDATE fdw_type_int SET c = 2147483647 WHERE c IS NULL;
DELETE FROM fdw_type_int WHERE c = 2147483647;
SELECT * FROM fdw_type_int ORDER BY c;
      c      
-------------
 -2147483647
 -2147483646
 -2147483645
      -12345
           0
           1
           2
           3
       12345
  2147483644
  2147483645
  2147483646
(12 rows)

--- Test teardown: DDL of the PostgreSQL
DROP FOREIGN TABLE fdw_type_int;
--- Test teardown: DDL of the Tsurugi
SELECT tg_execute_ddl('DROP TABLE fdw_type_int', 'tsurugidb');
 tg_execute_ddl 
----------------
 DROP TABLE
(1 row)

-- Numeric Types - bigint
--- Test setup: DDL of the Tsurugi
SELECT tg_execute_ddl('
  CREATE TABLE fdw_type_bigint (c BIGINT)
', 'tsurugidb');
 tg_execute_ddl 
----------------
 CREATE TABLE
(1 row)

--- Test setup: DDL of the PostgreSQL
CREATE FOREIGN TABLE fdw_type_bigint (
  c bigint
) SERVER tsurugidb;
--- Test
INSERT INTO fdw_type_bigint VALUES (12345);
INSERT INTO fdw_type_bigint VALUES (-12345);
INSERT INTO fdw_type_bigint VALUES (NULL);
INSERT INTO fdw_type_bigint VALUES (9223372036854775804);  --max-3
INSERT INTO fdw_type_bigint VALUES (9223372036854775805);  --max-2
INSERT INTO fdw_type_bigint VALUES (9223372036854775806);  --max-1
INSERT INTO fdw_type_bigint VALUES (9223372036854775807);  --max
INSERT INTO fdw_type_bigint VALUES (-9223372036854775805);  --min+3
INSERT INTO fdw_type_bigint VALUES (-9223372036854775806);  --min+2
INSERT INTO fdw_type_bigint VALUES (-9223372036854775807);  --min+1
INSERT INTO fdw_type_bigint VALUES (-9223372036854775808);  --min
INSERT INTO fdw_type_bigint VALUES (CAST(1.1 AS bigint));
INSERT INTO fdw_type_bigint VALUES (2.1);  -- see tsurugi-issues#736
INSERT INTO fdw_type_bigint VALUES (3.1);  -- see tsurugi-issues#736
INSERT INTO fdw_type_bigint VALUES (cast(0.1 as bigint));
SELECT * FROM fdw_type_bigint ORDER BY c;
          c           
----------------------
                     
 -9223372036854775808
 -9223372036854775807
 -9223372036854775806
 -9223372036854775805
               -12345
                    0
                    1
                    2
                    3
                12345
  9223372036854775804
  9223372036854775805
  9223372036854775806
  9223372036854775807
(15 rows)

SELECT * FROM fdw_type_bigint WHERE c = 9223372036854775807 ORDER BY c;
          c          
---------------------
 9223372036854775807
(1 row)

SELECT * FROM fdw_type_bigint WHERE c = -9223372036854775808 ORDER BY c;
          c           
----------------------
 -9223372036854775808
(1 row)

UPDATE fdw_type_bigint
  SET c = 9223372036854775807
  WHERE c = -9223372036854775808;
SELECT * FROM fdw_type_bigint WHERE c = 9223372036854775807 ORDER BY c;
          c          
---------------------
 9223372036854775807
 9223372036854775807
(2 rows)

UPDATE fdw_type_bigint
  SET c = -9223372036854775808
  WHERE c = 9223372036854775807;
DELETE FROM fdw_type_bigint WHERE c = -9223372036854775808;
SELECT * FROM fdw_type_bigint ORDER BY c;
          c           
----------------------
                     
 -9223372036854775807
 -9223372036854775806
 -9223372036854775805
               -12345
                    0
                    1
                    2
                    3
                12345
  9223372036854775804
  9223372036854775805
  9223372036854775806
(13 rows)

UPDATE fdw_type_bigint SET c = 9223372036854775807 WHERE c IS NULL;
DELETE FROM fdw_type_bigint WHERE c = 9223372036854775807;
SELECT * FROM fdw_type_bigint ORDER BY c;
          c           
----------------------
 -9223372036854775807
 -9223372036854775806
 -9223372036854775805
               -12345
                    0
                    1
                    2
                    3
                12345
  9223372036854775804
  9223372036854775805
  9223372036854775806
(12 rows)

--- Test teardown: DDL of the PostgreSQL
DROP FOREIGN TABLE fdw_type_bigint;
--- Test teardown: DDL of the Tsurugi
SELECT tg_execute_ddl('DROP TABLE fdw_type_bigint', 'tsurugidb');
 tg_execute_ddl 
----------------
 DROP TABLE
(1 row)

-- Numeric Types - decimal
--- Test setup: DDL of the Tsurugi
SELECT tg_execute_ddl('
  CREATE TABLE fdw_type_decimal (c DECIMAL)
', 'tsurugidb');
 tg_execute_ddl 
----------------
 CREATE TABLE
(1 row)

--- Test setup: DDL of the PostgreSQL
CREATE FOREIGN TABLE fdw_type_decimal (
  c decimal
) SERVER tsurugidb;
--- Test
INSERT INTO fdw_type_decimal VALUES (12345);
INSERT INTO fdw_type_decimal VALUES (-12345);
INSERT INTO fdw_type_decimal VALUES (NULL);
SELECT * FROM fdw_type_decimal ORDER BY c DESC;
   c    
--------
  12345
 -12345
       
(3 rows)

UPDATE fdw_type_decimal SET c = 987654 WHERE c IS NULL;
SELECT * FROM fdw_type_decimal ORDER BY c;
   c    
--------
 -12345
  12345
 987654
(3 rows)

UPDATE fdw_type_decimal SET c = c * -1 WHERE c = 987654;
SELECT * FROM fdw_type_decimal ORDER BY c DESC;
    c    
---------
   12345
  -12345
 -987654
(3 rows)

DELETE FROM fdw_type_decimal WHERE c = -987654;
SELECT * FROM fdw_type_decimal ORDER BY c;
   c    
--------
 -12345
  12345
(2 rows)

--- Test teardown: DDL of the PostgreSQL
DROP FOREIGN TABLE fdw_type_decimal;
--- Test teardown: DDL of the Tsurugi
SELECT tg_execute_ddl('DROP TABLE fdw_type_decimal', 'tsurugidb');
 tg_execute_ddl 
----------------
 DROP TABLE
(1 row)

-- Numeric Types - decimal(5)
--- Test setup: DDL of the Tsurugi
SELECT tg_execute_ddl('
  CREATE TABLE fdw_type_decimal_p (c DECIMAL(5))
', 'tsurugidb');
 tg_execute_ddl 
----------------
 CREATE TABLE
(1 row)

--- Test setup: DDL of the PostgreSQL
CREATE FOREIGN TABLE fdw_type_decimal_p (
  c decimal(5)
) SERVER tsurugidb;
--- Test
INSERT INTO fdw_type_decimal_p VALUES (12345);
INSERT INTO fdw_type_decimal_p VALUES (-12345);
INSERT INTO fdw_type_decimal_p VALUES (NULL);
SELECT * FROM fdw_type_decimal_p ORDER BY c DESC;
   c    
--------
  12345
 -12345
       
(3 rows)

UPDATE fdw_type_decimal_p SET c = 98765 WHERE c IS NULL;
SELECT * FROM fdw_type_decimal_p ORDER BY c;
   c    
--------
 -12345
  12345
  98765
(3 rows)

UPDATE fdw_type_decimal_p SET c = c * -1 WHERE c = 98765;
SELECT * FROM fdw_type_decimal_p ORDER BY c DESC;
   c    
--------
  12345
 -12345
 -98765
(3 rows)

DELETE FROM fdw_type_decimal_p WHERE c = -98765;
SELECT * FROM fdw_type_decimal_p ORDER BY c;
   c    
--------
 -12345
  12345
(2 rows)

--- Test teardown: DDL of the PostgreSQL
DROP FOREIGN TABLE fdw_type_decimal_p;
--- Test teardown: DDL of the Tsurugi
SELECT tg_execute_ddl('DROP TABLE fdw_type_decimal_p', 'tsurugidb');
 tg_execute_ddl 
----------------
 DROP TABLE
(1 row)

-- Numeric Types - decimal(5, 2)
--- Test setup: DDL of the Tsurugi
SELECT tg_execute_ddl('
  CREATE TABLE fdw_type_decimal_ps (c DECIMAL(5, 2))
', 'tsurugidb');
 tg_execute_ddl 
----------------
 CREATE TABLE
(1 row)

--- Test setup: DDL of the PostgreSQL
CREATE FOREIGN TABLE fdw_type_decimal_ps (
  c decimal(5, 2)
) SERVER tsurugidb;
--- Test
INSERT INTO fdw_type_decimal_ps VALUES (123.45);
INSERT INTO fdw_type_decimal_ps VALUES (-123.45);
INSERT INTO fdw_type_decimal_ps VALUES (123.567);
INSERT INTO fdw_type_decimal_ps VALUES (NULL);
SELECT * FROM fdw_type_decimal_ps ORDER BY c DESC;
    c    
---------
  123.57
  123.45
 -123.45
        
(4 rows)

UPDATE fdw_type_decimal_ps SET c = 987.65 WHERE c IS NULL;
SELECT * FROM fdw_type_decimal_ps ORDER BY c;
    c    
---------
 -123.45
  123.45
  123.57
  987.65
(4 rows)

UPDATE fdw_type_decimal_ps SET c = c * -1 WHERE c = 987.65;
SELECT * FROM fdw_type_decimal_ps ORDER BY c DESC;
    c    
---------
  123.57
  123.45
 -123.45
 -987.65
(4 rows)

DELETE FROM fdw_type_decimal_ps WHERE c = -987.65;
SELECT * FROM fdw_type_decimal_ps ORDER BY c;
    c    
---------
 -123.45
  123.45
  123.57
(3 rows)

INSERT INTO fdw_type_decimal_ps VALUES (abs(-17.4));
INSERT INTO fdw_type_decimal_ps VALUES (ceil(-42.8));
INSERT INTO fdw_type_decimal_ps VALUES (floor(-42.8));
INSERT INTO fdw_type_decimal_ps VALUES (mod(9, 4));
INSERT INTO fdw_type_decimal_ps VALUES (round(42.4));
INSERT INTO fdw_type_decimal_ps VALUES (round(42.4382, 2));
SELECT * FROM fdw_type_decimal_ps ORDER BY c;
    c    
---------
 -123.45
  -43.00
  -42.00
    1.00
   17.40
   42.00
   42.44
  123.45
  123.57
(9 rows)

--- Test teardown: DDL of the PostgreSQL
DROP FOREIGN TABLE fdw_type_decimal_ps;
--- Test teardown: DDL of the Tsurugi
SELECT tg_execute_ddl('DROP TABLE fdw_type_decimal_ps', 'tsurugidb');
 tg_execute_ddl 
----------------
 DROP TABLE
(1 row)

-- Numeric Types - decimal(38, 0)
--- Test setup: DDL of the Tsurugi
SELECT tg_execute_ddl('
  CREATE TABLE fdw_type_decimal_ps0 (c DECIMAL(38, 0))
', 'tsurugidb');
 tg_execute_ddl 
----------------
 CREATE TABLE
(1 row)

--- Test setup: DDL of the PostgreSQL
CREATE FOREIGN TABLE fdw_type_decimal_ps0 (
  c decimal(38, 0)
) SERVER tsurugidb;
--- Test
INSERT INTO fdw_type_decimal_ps0 VALUES (0);
INSERT INTO fdw_type_decimal_ps0 VALUES (1);
INSERT INTO fdw_type_decimal_ps0 VALUES (18446744073709551615);
INSERT INTO fdw_type_decimal_ps0 VALUES (18446744073709551616);
INSERT INTO fdw_type_decimal_ps0
  VALUES (99999999999999999999999999999999999999);
INSERT INTO fdw_type_decimal_ps0 VALUES (-1);
INSERT INTO fdw_type_decimal_ps0 VALUES (-18446744073709551615);
INSERT INTO fdw_type_decimal_ps0 VALUES (-18446744073709551616);
INSERT INTO fdw_type_decimal_ps0
  VALUES (-99999999999999999999999999999999999999);
SELECT * FROM fdw_type_decimal_ps0 ORDER BY c;
                    c                    
-----------------------------------------
 -99999999999999999999999999999999999999
                   -18446744073709551616
                   -18446744073709551615
                                      -1
                                       0
                                       1
                    18446744073709551615
                    18446744073709551616
  99999999999999999999999999999999999999
(9 rows)

--- Test teardown: DDL of the PostgreSQL
DROP FOREIGN TABLE fdw_type_decimal_ps0;
--- Test teardown: DDL of the Tsurugi
SELECT tg_execute_ddl('DROP TABLE fdw_type_decimal_ps0', 'tsurugidb');
 tg_execute_ddl 
----------------
 DROP TABLE
(1 row)

-- Numeric Types - decimal(38, 38)
--- Test setup: DDL of the Tsurugi
SELECT tg_execute_ddl('
  CREATE TABLE fdw_type_decimal_ps38 (c DECIMAL(38, 38))
', 'tsurugidb');
 tg_execute_ddl 
----------------
 CREATE TABLE
(1 row)

--- Test setup: DDL of the PostgreSQL
CREATE FOREIGN TABLE fdw_type_decimal_ps38 (
  c decimal(38, 38)
) SERVER tsurugidb;
--- Test
INSERT INTO fdw_type_decimal_ps38 VALUES (0);
INSERT INTO fdw_type_decimal_ps38
  VALUES (0.00000000000000000000000000000000000001);
INSERT INTO fdw_type_decimal_ps38
  VALUES (0.00000000000000000018446744073709551615);
INSERT INTO fdw_type_decimal_ps38
  VALUES (0.00000000000000000018446744073709551616);
INSERT INTO fdw_type_decimal_ps38
  VALUES (0.99999999999999999999999999999999999999);
INSERT INTO fdw_type_decimal_ps38
  VALUES (-0.00000000000000000000000000000000000001);
INSERT INTO fdw_type_decimal_ps38
  VALUES (-0.00000000000000000018446744073709551615);
INSERT INTO fdw_type_decimal_ps38
  VALUES (-0.00000000000000000018446744073709551616);
INSERT INTO fdw_type_decimal_ps38
  VALUES (-0.99999999999999999999999999999999999999);
INSERT INTO fdw_type_decimal_ps38
  VALUES (0.000000000000000000000000000000000000001);
INSERT INTO fdw_type_decimal_ps38
  VALUES (0.340282366920938463463374607431768211455);
INSERT INTO fdw_type_decimal_ps38
  VALUES (0.340282366920938463463374607431768211456);
SELECT * FROM fdw_type_decimal_ps38 ORDER BY c;
                     c                     
-------------------------------------------
 -0.99999999999999999999999999999999999999
 -0.00000000000000000018446744073709551616
 -0.00000000000000000018446744073709551615
 -0.00000000000000000000000000000000000001
  0.00000000000000000000000000000000000000
  0.00000000000000000000000000000000000000
  0.00000000000000000000000000000000000001
  0.00000000000000000018446744073709551615
  0.00000000000000000018446744073709551616
  0.34028236692093846346337460743176821146
  0.34028236692093846346337460743176821146
  0.99999999999999999999999999999999999999
(12 rows)

--- Test teardown: DDL of the PostgreSQL
DROP FOREIGN TABLE fdw_type_decimal_ps38;
--- Test teardown: DDL of the Tsurugi
SELECT tg_execute_ddl('DROP TABLE fdw_type_decimal_ps38', 'tsurugidb');
 tg_execute_ddl 
----------------
 DROP TABLE
(1 row)

-- Numeric Types - numeric
--- Test setup: DDL of the Tsurugi
SELECT tg_execute_ddl('
  CREATE TABLE fdw_type_numeric (c NUMERIC)
', 'tsurugidb');
 tg_execute_ddl 
----------------
 CREATE TABLE
(1 row)

--- Test setup: DDL of the PostgreSQL
CREATE FOREIGN TABLE fdw_type_numeric (
  c numeric
) SERVER tsurugidb;
--- Test
INSERT INTO fdw_type_numeric VALUES (12345);
INSERT INTO fdw_type_numeric VALUES (-12345);
INSERT INTO fdw_type_numeric VALUES (NULL);
SELECT * FROM fdw_type_numeric ORDER BY c DESC;
   c    
--------
  12345
 -12345
       
(3 rows)

UPDATE fdw_type_numeric SET c = 987654 WHERE c IS NULL;
SELECT * FROM fdw_type_numeric ORDER BY c;
   c    
--------
 -12345
  12345
 987654
(3 rows)

UPDATE fdw_type_numeric SET c = c * -1 WHERE c = 987654;
SELECT * FROM fdw_type_numeric ORDER BY c DESC;
    c    
---------
   12345
  -12345
 -987654
(3 rows)

DELETE FROM fdw_type_numeric WHERE c = -987654;
SELECT * FROM fdw_type_numeric ORDER BY c;
   c    
--------
 -12345
  12345
(2 rows)

--- Test teardown: DDL of the PostgreSQL
DROP FOREIGN TABLE fdw_type_numeric;
--- Test teardown: DDL of the Tsurugi
SELECT tg_execute_ddl('DROP TABLE fdw_type_numeric', 'tsurugidb');
 tg_execute_ddl 
----------------
 DROP TABLE
(1 row)

-- Numeric Types - numeric(5)
--- Test setup: DDL of the Tsurugi
SELECT tg_execute_ddl('
  CREATE TABLE fdw_type_numeric_p (c NUMERIC(5))
', 'tsurugidb');
 tg_execute_ddl 
----------------
 CREATE TABLE
(1 row)

--- Test setup: DDL of the PostgreSQL
CREATE FOREIGN TABLE fdw_type_numeric_p (
  c numeric(5)
) SERVER tsurugidb;
--- Test
INSERT INTO fdw_type_numeric_p VALUES (12345);
INSERT INTO fdw_type_numeric_p VALUES (-12345);
INSERT INTO fdw_type_numeric_p VALUES (NULL);
SELECT * FROM fdw_type_numeric_p ORDER BY c DESC;
   c    
--------
  12345
 -12345
       
(3 rows)

UPDATE fdw_type_numeric_p SET c = 98765 WHERE c IS NULL;
SELECT * FROM fdw_type_numeric_p ORDER BY c;
   c    
--------
 -12345
  12345
  98765
(3 rows)

UPDATE fdw_type_numeric_p SET c = c * -1 WHERE c = 98765;
SELECT * FROM fdw_type_numeric_p ORDER BY c DESC;
   c    
--------
  12345
 -12345
 -98765
(3 rows)

DELETE FROM fdw_type_numeric_p WHERE c = -98765;
SELECT * FROM fdw_type_numeric_p ORDER BY c;
   c    
--------
 -12345
  12345
(2 rows)

--- Test teardown: DDL of the PostgreSQL
DROP FOREIGN TABLE fdw_type_numeric_p;
--- Test teardown: DDL of the Tsurugi
SELECT tg_execute_ddl('DROP TABLE fdw_type_numeric_p', 'tsurugidb');
 tg_execute_ddl 
----------------
 DROP TABLE
(1 row)

-- Numeric Types - numeric(5, 2)
--- Test setup: DDL of the Tsurugi
SELECT tg_execute_ddl('
  CREATE TABLE fdw_type_numeric_ps (c NUMERIC(5, 2))
', 'tsurugidb');
 tg_execute_ddl 
----------------
 CREATE TABLE
(1 row)

--- Test setup: DDL of the PostgreSQL
CREATE FOREIGN TABLE fdw_type_numeric_ps (
  c numeric(5, 2)
) SERVER tsurugidb;
--- Test
INSERT INTO fdw_type_numeric_ps VALUES (123.45);
INSERT INTO fdw_type_numeric_ps VALUES (-123.45);
INSERT INTO fdw_type_numeric_ps VALUES (123.567);
INSERT INTO fdw_type_numeric_ps VALUES (NULL);
SELECT * FROM fdw_type_numeric_ps ORDER BY c DESC;
    c    
---------
  123.57
  123.45
 -123.45
        
(4 rows)

UPDATE fdw_type_numeric_ps SET c = 987.65 WHERE c IS NULL;
SELECT * FROM fdw_type_numeric_ps ORDER BY c;
    c    
---------
 -123.45
  123.45
  123.57
  987.65
(4 rows)

UPDATE fdw_type_numeric_ps SET c = c * -1 WHERE c = 987.65;
SELECT * FROM fdw_type_numeric_ps ORDER BY c DESC;
    c    
---------
  123.57
  123.45
 -123.45
 -987.65
(4 rows)

DELETE FROM fdw_type_numeric_ps WHERE c = -987.65;
SELECT * FROM fdw_type_numeric_ps ORDER BY c;
    c    
---------
 -123.45
  123.45
  123.57
(3 rows)

INSERT INTO fdw_type_numeric_ps VALUES (abs(-17.4));
INSERT INTO fdw_type_numeric_ps VALUES (ceil(-42.8));
INSERT INTO fdw_type_numeric_ps VALUES (ceiling(-95.3));
INSERT INTO fdw_type_numeric_ps VALUES (CAST(cbrt(27.0) AS DECIMAL(5, 2)));
INSERT INTO fdw_type_numeric_ps VALUES (CAST(degrees(0.5) AS DECIMAL(5, 2)));
INSERT INTO fdw_type_numeric_ps VALUES (div(9,4));
INSERT INTO fdw_type_numeric_ps VALUES (CAST(exp(1.0) AS DECIMAL(5, 2)));
INSERT INTO fdw_type_numeric_ps VALUES (factorial(5));
INSERT INTO fdw_type_numeric_ps VALUES (floor(-42.8));
INSERT INTO fdw_type_numeric_ps VALUES (CAST(ln(2.0) AS DECIMAL(5, 2)));
INSERT INTO fdw_type_numeric_ps VALUES (log(100.0));
INSERT INTO fdw_type_numeric_ps VALUES (log10(100.0));
INSERT INTO fdw_type_numeric_ps VALUES (log(2.0, 64.0));
INSERT INTO fdw_type_numeric_ps VALUES (mod(9, 4));
INSERT INTO fdw_type_numeric_ps VALUES (CAST(pi() AS DECIMAL(5, 2)));
INSERT INTO fdw_type_numeric_ps VALUES (power(9.0, 3.0));
INSERT INTO fdw_type_numeric_ps VALUES (CAST(radians(45.0) AS DECIMAL(5, 2)));
INSERT INTO fdw_type_numeric_ps VALUES (round(42.4));
INSERT INTO fdw_type_numeric_ps VALUES (round(42.4382, 2));
INSERT INTO fdw_type_numeric_ps VALUES (sign(-8.4));
INSERT INTO fdw_type_numeric_ps VALUES (CAST(scale(8.41) AS DECIMAL(5, 2)));
INSERT INTO fdw_type_numeric_ps VALUES (CAST(sqrt(2.0) AS DECIMAL(5, 2)));
INSERT INTO fdw_type_numeric_ps VALUES (trunc(42.8));
INSERT INTO fdw_type_numeric_ps VALUES (trunc(42.4382, 2));
SELECT * FROM fdw_type_numeric_ps ORDER BY c DESC;
    c    
---------
  729.00
  123.57
  123.45
  120.00
   42.44
   42.43
   42.00
   42.00
   28.65
   17.40
    6.00
    3.14
    3.00
    2.72
    2.00
    2.00
    2.00
    2.00
    1.41
    1.00
    0.79
    0.69
   -1.00
  -42.00
  -43.00
  -95.00
 -123.45
(27 rows)

--- Test teardown: DDL of the PostgreSQL
DROP FOREIGN TABLE fdw_type_numeric_ps;
--- Test teardown: DDL of the Tsurugi
SELECT tg_execute_ddl('DROP TABLE fdw_type_numeric_ps', 'tsurugidb');
 tg_execute_ddl 
----------------
 DROP TABLE
(1 row)

-- Numeric Types - numeric(38, 0)
--- Test setup: DDL of the Tsurugi
SELECT tg_execute_ddl('
  CREATE TABLE fdw_type_numeric_ps0 (c NUMERIC(38, 0))
', 'tsurugidb');
 tg_execute_ddl 
----------------
 CREATE TABLE
(1 row)

--- Test setup: DDL of the PostgreSQL
CREATE FOREIGN TABLE fdw_type_numeric_ps0 (
  c numeric(38, 0)
) SERVER tsurugidb;
--- Test
INSERT INTO fdw_type_numeric_ps0 VALUES (0);
INSERT INTO fdw_type_numeric_ps0 VALUES (1);
INSERT INTO fdw_type_numeric_ps0 VALUES (18446744073709551615);
INSERT INTO fdw_type_numeric_ps0 VALUES (18446744073709551616);
INSERT INTO fdw_type_numeric_ps0 VALUES (99999999999999999999999999999999999999);
INSERT INTO fdw_type_numeric_ps0 VALUES (-1);
INSERT INTO fdw_type_numeric_ps0 VALUES (-18446744073709551615);
INSERT INTO fdw_type_numeric_ps0 VALUES (-18446744073709551616);
INSERT INTO fdw_type_numeric_ps0 VALUES (-99999999999999999999999999999999999999);
SELECT * FROM fdw_type_numeric_ps0 ORDER BY c DESC;
                    c                    
-----------------------------------------
  99999999999999999999999999999999999999
                    18446744073709551616
                    18446744073709551615
                                       1
                                       0
                                      -1
                   -18446744073709551615
                   -18446744073709551616
 -99999999999999999999999999999999999999
(9 rows)

--- Test teardown: DDL of the PostgreSQL
DROP FOREIGN TABLE fdw_type_numeric_ps0;
--- Test teardown: DDL of the Tsurugi
SELECT tg_execute_ddl('DROP TABLE fdw_type_numeric_ps0', 'tsurugidb');
 tg_execute_ddl 
----------------
 DROP TABLE
(1 row)

-- Numeric Types - numeric(38, 38)
--- Test setup: DDL of the Tsurugi
SELECT tg_execute_ddl('
  CREATE TABLE fdw_type_numeric_ps38 (c NUMERIC(38, 38))
', 'tsurugidb');
 tg_execute_ddl 
----------------
 CREATE TABLE
(1 row)

--- Test setup: DDL of the PostgreSQL
CREATE FOREIGN TABLE fdw_type_numeric_ps38 (
  c numeric(38, 38)
) SERVER tsurugidb;
--- Test
INSERT INTO fdw_type_numeric_ps38 VALUES (0);  -- see tsurugi-issues#736
INSERT INTO fdw_type_numeric_ps38
  VALUES (0.00000000000000000000000000000000000001);
INSERT INTO fdw_type_numeric_ps38
  VALUES (0.00000000000000000018446744073709551615);
INSERT INTO fdw_type_numeric_ps38
  VALUES (0.00000000000000000018446744073709551616);
INSERT INTO fdw_type_numeric_ps38
  VALUES (0.99999999999999999999999999999999999999);
INSERT INTO fdw_type_numeric_ps38
  VALUES (-0.00000000000000000000000000000000000001);
INSERT INTO fdw_type_numeric_ps38
  VALUES (-0.00000000000000000018446744073709551615);
INSERT INTO fdw_type_numeric_ps38
  VALUES (-0.00000000000000000018446744073709551616);
INSERT INTO fdw_type_numeric_ps38
  VALUES (-0.99999999999999999999999999999999999999);
INSERT INTO fdw_type_numeric_ps38
  VALUES (0.000000000000000000000000000000000000001);
INSERT INTO fdw_type_numeric_ps38
  VALUES (0.340282366920938463463374607431768211455);
INSERT INTO fdw_type_numeric_ps38
  VALUES (0.340282366920938463463374607431768211456);
SELECT * FROM fdw_type_numeric_ps38 ORDER BY c DESC;
                     c                     
-------------------------------------------
  0.99999999999999999999999999999999999999
  0.34028236692093846346337460743176821146
  0.34028236692093846346337460743176821146
  0.00000000000000000018446744073709551616
  0.00000000000000000018446744073709551615
  0.00000000000000000000000000000000000001
  0.00000000000000000000000000000000000000
  0.00000000000000000000000000000000000000
 -0.00000000000000000000000000000000000001
 -0.00000000000000000018446744073709551615
 -0.00000000000000000018446744073709551616
 -0.99999999999999999999999999999999999999
(12 rows)

--- Test teardown: DDL of the PostgreSQL
DROP FOREIGN TABLE fdw_type_numeric_ps38;
--- Test teardown: DDL of the Tsurugi
SELECT tg_execute_ddl('DROP TABLE fdw_type_numeric_ps38', 'tsurugidb');
 tg_execute_ddl 
----------------
 DROP TABLE
(1 row)

-- Numeric Types - real
--- Test setup: DDL of the Tsurugi
SELECT tg_execute_ddl('
  CREATE TABLE fdw_type_real (c REAL)
', 'tsurugidb');
 tg_execute_ddl 
----------------
 CREATE TABLE
(1 row)

--- Test setup: DDL of the PostgreSQL
CREATE FOREIGN TABLE fdw_type_real (
  c real
) SERVER tsurugidb;
--- Test
INSERT INTO fdw_type_real VALUES (0.1);
INSERT INTO fdw_type_real VALUES (1.1);
INSERT INTO fdw_type_real VALUES (1.2345);
INSERT INTO fdw_type_real VALUES (-1.2345);
INSERT INTO fdw_type_real VALUES (NULL);
INSERT INTO fdw_type_real VALUES (12.345678901234567890); --20 digits
SELECT * FROM fdw_type_real ORDER BY c;
     c     
-----------
          
   -1.2345
       0.1
       1.1
    1.2345
 12.345679
(6 rows)

UPDATE fdw_type_real SET c = 9.87654 WHERE c IS NULL;
SELECT * FROM fdw_type_real ORDER BY c;
     c     
-----------
   -1.2345
       0.1
       1.1
    1.2345
   9.87654
 12.345679
(6 rows)

UPDATE fdw_type_real SET c = c * -1 WHERE c = 9.87654::real;
SELECT * FROM fdw_type_real ORDER BY c DESC;
     c     
-----------
 12.345679
    1.2345
       1.1
       0.1
   -1.2345
  -9.87654
(6 rows)

DELETE FROM fdw_type_real WHERE c = CAST(-9.87654 AS real);
SELECT * FROM fdw_type_real ORDER BY c;
     c     
-----------
   -1.2345
       0.1
       1.1
    1.2345
 12.345679
(5 rows)

--- Test teardown: DDL of the PostgreSQL
DROP FOREIGN TABLE fdw_type_real;
--- Test teardown: DDL of the Tsurugi
SELECT tg_execute_ddl('DROP TABLE fdw_type_real', 'tsurugidb');
 tg_execute_ddl 
----------------
 DROP TABLE
(1 row)

-- Numeric Types - double precision
--- Test setup: DDL of the Tsurugi
SELECT tg_execute_ddl('
  CREATE TABLE fdw_type_double (c DOUBLE)
', 'tsurugidb');
 tg_execute_ddl 
----------------
 CREATE TABLE
(1 row)

--- Test setup: DDL of the PostgreSQL
CREATE FOREIGN TABLE fdw_type_double (
  c double precision
) SERVER tsurugidb;
--- Test
INSERT INTO fdw_type_double VALUES (0.1);
INSERT INTO fdw_type_double VALUES (1.1);
INSERT INTO fdw_type_double VALUES (1.2345);
INSERT INTO fdw_type_double VALUES (-1.2345);
INSERT INTO fdw_type_double VALUES (NULL);
INSERT INTO fdw_type_double VALUES (12.345678901234567890); --20 digits
SELECT * FROM fdw_type_double ORDER BY c;
         c          
--------------------
                   
            -1.2345
                0.1
                1.1
             1.2345
 12.345678901234567
(6 rows)

UPDATE fdw_type_double SET c = 9.87654 WHERE c IS NULL;
SELECT * FROM fdw_type_double ORDER BY c;
         c          
--------------------
            -1.2345
                0.1
                1.1
             1.2345
            9.87654
 12.345678901234567
(6 rows)

UPDATE fdw_type_double SET c = c * -1 WHERE c = 9.87654::double precision;
SELECT * FROM fdw_type_double ORDER BY c DESC;
         c          
--------------------
 12.345678901234567
             1.2345
                1.1
                0.1
            -1.2345
           -9.87654
(6 rows)

DELETE FROM fdw_type_double WHERE c = CAST(-9.87654 AS double precision);
SELECT * FROM fdw_type_double ORDER BY c;
         c          
--------------------
            -1.2345
                0.1
                1.1
             1.2345
 12.345678901234567
(5 rows)

--- Test teardown: DDL of the PostgreSQL
DROP FOREIGN TABLE fdw_type_double;
--- Test teardown: DDL of the Tsurugi
SELECT tg_execute_ddl('DROP TABLE fdw_type_double', 'tsurugidb');
 tg_execute_ddl 
----------------
 DROP TABLE
(1 row)

-- Numeric Types - serial
--- Test setup: DDL of the Tsurugi
SELECT tg_execute_ddl('
  CREATE TABLE fdw_type_serial (
    id INTEGER PRIMARY KEY,
    name VARCHAR)
', 'tsurugidb');
 tg_execute_ddl 
----------------
 CREATE TABLE
(1 row)

--- Test setup: DDL of the PostgreSQL
CREATE FOREIGN TABLE fdw_type_serial (
    id serial,
    name text
) SERVER tsurugidb;
--- Test
INSERT INTO fdw_type_serial (name) VALUES ('name-1'), ('name-2'), ('name-3');
INSERT INTO fdw_type_serial (id, name) VALUES (100, 'name-100');
INSERT INTO fdw_type_serial (name) VALUES ('name-4');
SELECT * FROM fdw_type_serial ORDER BY id;
 id  |   name   
-----+----------
   1 | name-1
   2 | name-2
   3 | name-3
   4 | name-4
 100 | name-100
(5 rows)

SELECT last_value FROM fdw_type_serial_id_seq;
 last_value 
------------
          4
(1 row)

--- Test teardown: DDL of the PostgreSQL
DROP FOREIGN TABLE fdw_type_serial;
--- Test teardown: DDL of the Tsurugi
SELECT tg_execute_ddl('DROP TABLE fdw_type_serial', 'tsurugidb');
 tg_execute_ddl 
----------------
 DROP TABLE
(1 row)

-- Numeric Types - bigserial
--- Test setup: DDL of the Tsurugi
SELECT tg_execute_ddl('
  CREATE TABLE fdw_type_bigserial (
    id BIGINT PRIMARY KEY,
    name VARCHAR)
', 'tsurugidb');
 tg_execute_ddl 
----------------
 CREATE TABLE
(1 row)

--- Test setup: DDL of the PostgreSQL
CREATE FOREIGN TABLE fdw_type_bigserial (
    id bigserial,
    name text
) SERVER tsurugidb;
-- Test
INSERT INTO fdw_type_bigserial (name) VALUES ('name-1'), ('name-2'), ('name-3');
INSERT INTO fdw_type_bigserial (id, name) VALUES (100, 'name-100');
INSERT INTO fdw_type_bigserial (name) VALUES ('name-4');
SELECT * FROM fdw_type_bigserial ORDER BY id;
 id  |   name   
-----+----------
   1 | name-1
   2 | name-2
   3 | name-3
   4 | name-4
 100 | name-100
(5 rows)

SELECT last_value FROM fdw_type_bigserial_id_seq;
 last_value 
------------
          4
(1 row)

--- Test teardown: DDL of the PostgreSQL
DROP FOREIGN TABLE fdw_type_bigserial;
--- Test teardown: DDL of the Tsurugi
SELECT tg_execute_ddl('DROP TABLE fdw_type_bigserial', 'tsurugidb');
 tg_execute_ddl 
----------------
 DROP TABLE
(1 row)

-- Character Types - char
--- Test setup: DDL of the Tsurugi
SELECT tg_execute_ddl('
  CREATE TABLE fdw_type_char (c CHAR)
', 'tsurugidb');
 tg_execute_ddl 
----------------
 CREATE TABLE
(1 row)

--- Test setup: DDL of the PostgreSQL
CREATE FOREIGN TABLE fdw_type_char (
  c char
) SERVER tsurugidb;
--- Test
INSERT INTO fdw_type_char VALUES ('a');
INSERT INTO fdw_type_char VALUES ('');
INSERT INTO fdw_type_char VALUES (NULL);
INSERT INTO fdw_type_char VALUES (1);  -- auto-cast
SELECT * FROM fdw_type_char ORDER BY c;
 c 
---
 
  
 1
 a
(4 rows)

UPDATE fdw_type_char SET c = 'X' WHERE c IS NULL;
SELECT * FROM fdw_type_char ORDER BY c;
 c 
---
  
 1
 X
 a
(4 rows)

UPDATE fdw_type_char SET c = 'z' WHERE c = 'X';
SELECT * FROM fdw_type_char ORDER BY c DESC;
 c 
---
 z
 a
 1
  
(4 rows)

DELETE FROM fdw_type_char WHERE c = 'z';
SELECT * FROM fdw_type_char ORDER BY c;
 c 
---
  
 1
 a
(3 rows)

--- Test teardown: DDL of the PostgreSQL
DROP FOREIGN TABLE fdw_type_char;
--- Test teardown: DDL of the Tsurugi
SELECT tg_execute_ddl('DROP TABLE fdw_type_char', 'tsurugidb');
 tg_execute_ddl 
----------------
 DROP TABLE
(1 row)

-- Character Types - char(length)
--- Test setup: DDL of the Tsurugi
SELECT tg_execute_ddl('
  CREATE TABLE fdw_type_char_l (c CHAR(10))
', 'tsurugidb');
 tg_execute_ddl 
----------------
 CREATE TABLE
(1 row)

--- Test setup: DDL of the PostgreSQL
CREATE FOREIGN TABLE fdw_type_char_l (
  c char(10)
) SERVER tsurugidb;
--- Test
INSERT INTO fdw_type_char_l VALUES ('abcdef');
INSERT INTO fdw_type_char_l VALUES ('PostgreSQL');
INSERT INTO fdw_type_char_l VALUES ('');
INSERT INTO fdw_type_char_l VALUES (NULL);
INSERT INTO fdw_type_char_l VALUES (12345);  -- auto-cast
SELECT * FROM fdw_type_char_l ORDER BY c;
     c      
------------
 
           
 12345     
 PostgreSQL
 abcdef    
(5 rows)

UPDATE fdw_type_char_l SET c = 'NULL' WHERE c IS NULL;
SELECT * FROM fdw_type_char_l ORDER BY c;
     c      
------------
           
 12345     
 NULL      
 PostgreSQL
 abcdef    
(5 rows)

UPDATE fdw_type_char_l SET c = 'update' WHERE c = CAST('NULL' AS char(10));
SELECT * FROM fdw_type_char_l ORDER BY c DESC;
     c      
------------
 update    
 abcdef    
 PostgreSQL
 12345     
           
(5 rows)

DELETE FROM fdw_type_char_l WHERE c = 'update'::char(10);
SELECT * FROM fdw_type_char_l ORDER BY c;
     c      
------------
           
 12345     
 PostgreSQL
 abcdef    
(4 rows)

--- Test teardown: DDL of the PostgreSQL
DROP FOREIGN TABLE fdw_type_char_l;
--- Test teardown: DDL of the Tsurugi
SELECT tg_execute_ddl('DROP TABLE fdw_type_char_l', 'tsurugidb');
 tg_execute_ddl 
----------------
 DROP TABLE
(1 row)

-- Character Types - varchar
--- Test setup: DDL of the Tsurugi
SELECT tg_execute_ddl('
  CREATE TABLE fdw_type_varchar (c VARCHAR)
', 'tsurugidb');
 tg_execute_ddl 
----------------
 CREATE TABLE
(1 row)

--- Test setup: DDL of the PostgreSQL
CREATE FOREIGN TABLE fdw_type_varchar (
  c varchar
) SERVER tsurugidb;
--- Test
INSERT INTO fdw_type_varchar VALUES ('abcdef');
INSERT INTO fdw_type_varchar VALUES ('');
INSERT INTO fdw_type_varchar VALUES (NULL);
INSERT INTO fdw_type_varchar VALUES (12345);  -- auto-cast
SELECT * FROM fdw_type_varchar ORDER BY c;
   c    
--------
 
 
 12345
 abcdef
(4 rows)

UPDATE fdw_type_varchar SET c = 'NULL' WHERE c IS NULL;
SELECT * FROM fdw_type_varchar ORDER BY c;
   c    
--------
 
 12345
 NULL
 abcdef
(4 rows)

UPDATE fdw_type_varchar SET c = c || '_updated' WHERE c = 'NULL';
SELECT * FROM fdw_type_varchar ORDER BY c DESC;
      c       
--------------
 abcdef
 NULL_updated
 12345
 
(4 rows)

DELETE FROM fdw_type_varchar WHERE c = 'NULL_updated';
SELECT * FROM fdw_type_varchar ORDER BY c;
   c    
--------
 
 12345
 abcdef
(3 rows)

--- Test teardown: DDL of the PostgreSQL
DROP FOREIGN TABLE fdw_type_varchar;
--- Test teardown: DDL of the Tsurugi
SELECT tg_execute_ddl('DROP TABLE fdw_type_varchar', 'tsurugidb');
 tg_execute_ddl 
----------------
 DROP TABLE
(1 row)

-- Character Types - varchar(length)
--- Test setup: DDL of the Tsurugi
SELECT tg_execute_ddl('
  CREATE TABLE fdw_type_varchar_l (c VARCHAR(10))
', 'tsurugidb');
 tg_execute_ddl 
----------------
 CREATE TABLE
(1 row)

--- Test setup: DDL of the PostgreSQL
CREATE FOREIGN TABLE fdw_type_varchar_l (
  c varchar(10)
) SERVER tsurugidb;
--- Test
INSERT INTO fdw_type_varchar_l VALUES ('abcdef');
INSERT INTO fdw_type_varchar_l VALUES ('PostgreSQL');
INSERT INTO fdw_type_varchar_l VALUES ('');
INSERT INTO fdw_type_varchar_l VALUES (NULL);
INSERT INTO fdw_type_varchar_l VALUES (12345);  -- auto-cast
SELECT * FROM fdw_type_varchar_l ORDER BY c;
     c      
------------
 
 
 12345
 PostgreSQL
 abcdef
(5 rows)

UPDATE fdw_type_varchar_l SET c = 'NULL' WHERE c IS NULL;
SELECT * FROM fdw_type_varchar_l ORDER BY c;
     c      
------------
 
 12345
 NULL
 PostgreSQL
 abcdef
(5 rows)

UPDATE fdw_type_varchar_l SET c = 'update' WHERE c = 'NULL';
SELECT * FROM fdw_type_varchar_l ORDER BY c DESC;
     c      
------------
 update
 abcdef
 PostgreSQL
 12345
 
(5 rows)

DELETE FROM fdw_type_varchar_l WHERE c = 'update';
SELECT * FROM fdw_type_varchar_l ORDER BY c;
     c      
------------
 
 12345
 PostgreSQL
 abcdef
(4 rows)

--- Test teardown: DDL of the PostgreSQL
DROP FOREIGN TABLE fdw_type_varchar_l;
--- Test teardown: DDL of the Tsurugi
SELECT tg_execute_ddl('DROP TABLE fdw_type_varchar_l', 'tsurugidb');
 tg_execute_ddl 
----------------
 DROP TABLE
(1 row)

-- Character Types - text
--- Test setup: DDL of the Tsurugi
SELECT tg_execute_ddl('
  CREATE TABLE fdw_type_text (c VARCHAR)
', 'tsurugidb');
 tg_execute_ddl 
----------------
 CREATE TABLE
(1 row)

--- Test setup: DDL of the PostgreSQL
CREATE FOREIGN TABLE fdw_type_text (
  c text
) SERVER tsurugidb;
--- Test
INSERT INTO fdw_type_text VALUES ('abcdef');
INSERT INTO fdw_type_text VALUES ('');
INSERT INTO fdw_type_text VALUES (NULL);
INSERT INTO fdw_type_text VALUES (12345);  -- auto-cast
SELECT * FROM fdw_type_text ORDER BY c;
   c    
--------
 
 
 12345
 abcdef
(4 rows)

UPDATE fdw_type_text SET c = 'NULL' WHERE c IS NULL;
SELECT * FROM fdw_type_text ORDER BY c;
   c    
--------
 
 12345
 NULL
 abcdef
(4 rows)

UPDATE fdw_type_text SET c = c || '_updated' WHERE c = 'NULL';
SELECT * FROM fdw_type_text ORDER BY c DESC;
      c       
--------------
 abcdef
 NULL_updated
 12345
 
(4 rows)

DELETE FROM fdw_type_text WHERE c = 'NULL_updated';
SELECT * FROM fdw_type_text ORDER BY c;
   c    
--------
 
 12345
 abcdef
(3 rows)

--- Test teardown: DDL of the PostgreSQL
DROP FOREIGN TABLE fdw_type_text;
--- Test teardown: DDL of the Tsurugi
SELECT tg_execute_ddl('DROP TABLE fdw_type_text', 'tsurugidb');
 tg_execute_ddl 
----------------
 DROP TABLE
(1 row)

-- Date/Time Types - Test setup: PostgreSQL environment
SET TIMEZONE TO 'UTC';
SET DATESTYLE TO ISO, YMD;
-- Date/Time Types - date
--- Test setup: DDL of the Tsurugi
SELECT tg_execute_ddl('
  CREATE TABLE fdw_type_date (c DATE)
', 'tsurugidb');
 tg_execute_ddl 
----------------
 CREATE TABLE
(1 row)

--- Test setup: DDL of the PostgreSQL
CREATE FOREIGN TABLE fdw_type_date (
  c date
) SERVER tsurugidb;
--- Test
INSERT INTO fdw_type_date VALUES (date '2025-01-01');
INSERT INTO fdw_type_date VALUES ('2025-01-02'::date);
INSERT INTO fdw_type_date VALUES (CAST('2025-01-03' AS date));
INSERT INTO fdw_type_date VALUES (date '0001-01-01');
INSERT INTO fdw_type_date VALUES (date '9999-12-31');
INSERT INTO fdw_type_date VALUES (NULL);
INSERT INTO fdw_type_date VALUES ('2024-12-31');  -- auto cast (tsurugi-issues#896)
SELECT * FROM fdw_type_date ORDER BY c;
     c      
------------
 
 0001-01-01
 2024-12-31
 2025-01-01
 2025-01-02
 2025-01-03
 9999-12-31
(7 rows)

UPDATE fdw_type_date SET c = '2025-02-01' WHERE c IS NULL;
SELECT * FROM fdw_type_date ORDER BY c;
     c      
------------
 0001-01-01
 2024-12-31
 2025-01-01
 2025-01-02
 2025-01-03
 2025-02-01
 9999-12-31
(7 rows)

UPDATE fdw_type_date SET c = '2025-03-10'::date WHERE c = date '2025-02-01';
SELECT * FROM fdw_type_date ORDER BY c DESC;
     c      
------------
 9999-12-31
 2025-03-10
 2025-01-03
 2025-01-02
 2025-01-01
 2024-12-31
 0001-01-01
(7 rows)

DELETE FROM fdw_type_date WHERE c = CAST('2025-03-10' AS date);
SELECT * FROM fdw_type_date ORDER BY c;
     c      
------------
 0001-01-01
 2024-12-31
 2025-01-01
 2025-01-02
 2025-01-03
 9999-12-31
(6 rows)

--- Test teardown: DDL of the PostgreSQL
DROP FOREIGN TABLE fdw_type_date;
--- Test teardown: DDL of the Tsurugi
SELECT tg_execute_ddl('DROP TABLE fdw_type_date', 'tsurugidb');
 tg_execute_ddl 
----------------
 DROP TABLE
(1 row)

-- Date/Time Types - time
--- Test setup: DDL of the Tsurugi
SELECT tg_execute_ddl('
  CREATE TABLE fdw_type_time (c TIME)
', 'tsurugidb');
 tg_execute_ddl 
----------------
 CREATE TABLE
(1 row)

--- Test setup: DDL of the PostgreSQL
CREATE FOREIGN TABLE fdw_type_time (
  c time
) SERVER tsurugidb;
--- Test
INSERT INTO fdw_type_time VALUES (time '01:02:03.456');
INSERT INTO fdw_type_time VALUES ('03:02:01.456'::time);
INSERT INTO fdw_type_time VALUES (CAST('02:01:03.456' AS time));
INSERT INTO fdw_type_time VALUES (time '01:02:03.456789012');
INSERT INTO fdw_type_time VALUES (time '00:00:00');
INSERT INTO fdw_type_time VALUES (time '23:59:59.999999');
INSERT INTO fdw_type_time VALUES (time '050607.890123456');
INSERT INTO fdw_type_time VALUES (NULL);
INSERT INTO fdw_type_time VALUES ('04:05:06.789');  -- auto cast (tsurugi-issues#896)
SELECT * FROM fdw_type_time ORDER BY c;
        c        
-----------------
 
 00:00:00
 01:02:03.456
 01:02:03.456789
 02:01:03.456
 03:02:01.456
 04:05:06.789
 05:06:07.890123
 23:59:59.999999
(9 rows)

UPDATE fdw_type_time SET c = '00:00:00.001' WHERE c IS NULL;
SELECT * FROM fdw_type_time ORDER BY c;
        c        
-----------------
 00:00:00
 00:00:00.001
 01:02:03.456
 01:02:03.456789
 02:01:03.456
 03:02:01.456
 04:05:06.789
 05:06:07.890123
 23:59:59.999999
(9 rows)

UPDATE fdw_type_time SET c = '06:07:12.345'::time WHERE c = time '00:00:00.001';
SELECT * FROM fdw_type_time ORDER BY c DESC;
        c        
-----------------
 23:59:59.999999
 06:07:12.345
 05:06:07.890123
 04:05:06.789
 03:02:01.456
 02:01:03.456
 01:02:03.456789
 01:02:03.456
 00:00:00
(9 rows)

DELETE FROM fdw_type_time WHERE c = CAST('06:07:12.345' AS time);
SELECT * FROM fdw_type_time ORDER BY c;
        c        
-----------------
 00:00:00
 01:02:03.456
 01:02:03.456789
 02:01:03.456
 03:02:01.456
 04:05:06.789
 05:06:07.890123
 23:59:59.999999
(8 rows)

--- Test teardown: DDL of the PostgreSQL
DROP FOREIGN TABLE fdw_type_time;
--- Test teardown: DDL of the Tsurugi
SELECT tg_execute_ddl('DROP TABLE fdw_type_time', 'tsurugidb');
 tg_execute_ddl 
----------------
 DROP TABLE
(1 row)

-- Date/Time Types - timestamp
--- Test setup: DDL of the Tsurugi
SELECT tg_execute_ddl('
  CREATE TABLE fdw_type_timestamp (c TIMESTAMP)
', 'tsurugidb');
 tg_execute_ddl 
----------------
 CREATE TABLE
(1 row)

--- Test setup: DDL of the PostgreSQL
CREATE FOREIGN TABLE fdw_type_timestamp (
  c timestamp
) SERVER tsurugidb;
--- Test
INSERT INTO fdw_type_timestamp VALUES (timestamp '2025-01-01 00:00:00');
INSERT INTO fdw_type_timestamp VALUES ('2025-01-02 00:00:00'::timestamp);
INSERT INTO fdw_type_timestamp VALUES (CAST('2025-01-03 00:00:00' AS timestamp));
INSERT INTO fdw_type_timestamp VALUES (timestamp '1887-12-31 15:00:00');
INSERT INTO fdw_type_timestamp VALUES (timestamp '9999-12-31 23:59:59.999999');
INSERT INTO fdw_type_timestamp VALUES (timestamp '2025/01/01');
INSERT INTO fdw_type_timestamp VALUES (timestamp '2025/01/01 12:00');
INSERT INTO fdw_type_timestamp VALUES (NULL);
INSERT INTO fdw_type_timestamp VALUES ('2024-08-30 04:05:06.789');  -- auto cast (tsurugi-issues#896)
SELECT * FROM fdw_type_timestamp ORDER BY c;
             c              
----------------------------
 
 1887-12-31 15:00:00
 2024-08-30 04:05:06.789
 2025-01-01 00:00:00
 2025-01-01 00:00:00
 2025-01-01 12:00:00
 2025-01-02 00:00:00
 2025-01-03 00:00:00
 9999-12-31 23:59:59.999999
(9 rows)

UPDATE fdw_type_timestamp SET c = '2025-01-01 00:00:00.001' WHERE c IS NULL;
SELECT * FROM fdw_type_timestamp ORDER BY c;
             c              
----------------------------
 1887-12-31 15:00:00
 2024-08-30 04:05:06.789
 2025-01-01 00:00:00
 2025-01-01 00:00:00
 2025-01-01 00:00:00.001
 2025-01-01 12:00:00
 2025-01-02 00:00:00
 2025-01-03 00:00:00
 9999-12-31 23:59:59.999999
(9 rows)

UPDATE fdw_type_timestamp
  SET c = '2025-03-02 06:07:12.345'::timestamp
  WHERE c = timestamp '2025-01-01 00:00:00.001';
SELECT * FROM fdw_type_timestamp ORDER BY c DESC;
             c              
----------------------------
 9999-12-31 23:59:59.999999
 2025-03-02 06:07:12.345
 2025-01-03 00:00:00
 2025-01-02 00:00:00
 2025-01-01 12:00:00
 2025-01-01 00:00:00
 2025-01-01 00:00:00
 2024-08-30 04:05:06.789
 1887-12-31 15:00:00
(9 rows)

DELETE
  FROM fdw_type_timestamp
  WHERE c = CAST('2025-03-02 06:07:12.345' AS timestamp);
SELECT * FROM fdw_type_timestamp ORDER BY c;
             c              
----------------------------
 1887-12-31 15:00:00
 2024-08-30 04:05:06.789
 2025-01-01 00:00:00
 2025-01-01 00:00:00
 2025-01-01 12:00:00
 2025-01-02 00:00:00
 2025-01-03 00:00:00
 9999-12-31 23:59:59.999999
(8 rows)

--- Test teardown: DDL of the PostgreSQL
DROP FOREIGN TABLE fdw_type_timestamp;
--- Test teardown: DDL of the Tsurugi
SELECT tg_execute_ddl('DROP TABLE fdw_type_timestamp', 'tsurugidb');
 tg_execute_ddl 
----------------
 DROP TABLE
(1 row)

-- Date/Time Types - timestamp without time zone
--- Test setup: DDL of the Tsurugi
SELECT tg_execute_ddl('
  CREATE TABLE fdw_type_timestamp_wo_tz (c TIMESTAMP WITHOUT TIME ZONE)
', 'tsurugidb');
 tg_execute_ddl 
----------------
 CREATE TABLE
(1 row)

--- Test setup: DDL of the PostgreSQL
CREATE FOREIGN TABLE fdw_type_timestamp_wo_tz (
  c timestamp without time zone
) SERVER tsurugidb;
--- Test
INSERT INTO fdw_type_timestamp_wo_tz
  VALUES (timestamp without time zone '2025-01-01 00:00:00');
INSERT INTO fdw_type_timestamp_wo_tz
  VALUES ('2025-01-02 00:00:00'::timestamp without time zone);
INSERT INTO fdw_type_timestamp_wo_tz
  VALUES (CAST('2025-01-03 00:00:00' AS timestamp without time zone));
INSERT INTO fdw_type_timestamp_wo_tz
  VALUES (timestamp without time zone '1887-12-31 15:00:00');
INSERT INTO fdw_type_timestamp_wo_tz
  VALUES (timestamp without time zone '9999-12-31 23:59:59.999999');
INSERT INTO fdw_type_timestamp_wo_tz
  VALUES (timestamp without time zone '2025/01/01');
INSERT INTO fdw_type_timestamp_wo_tz
  VALUES (timestamp without time zone '2025/01/01 12:00');
INSERT INTO fdw_type_timestamp_wo_tz VALUES (NULL);
INSERT INTO fdw_type_timestamp_wo_tz VALUES ('2024-08-30 04:05:06.789');
SELECT * FROM fdw_type_timestamp_wo_tz ORDER BY c;
             c              
----------------------------
 
 1887-12-31 15:00:00
 2024-08-30 04:05:06.789
 2025-01-01 00:00:00
 2025-01-01 00:00:00
 2025-01-01 12:00:00
 2025-01-02 00:00:00
 2025-01-03 00:00:00
 9999-12-31 23:59:59.999999
(9 rows)

UPDATE fdw_type_timestamp_wo_tz
  SET c = '2025-01-01 00:00:00.001'
  WHERE c IS NULL;
SELECT * FROM fdw_type_timestamp_wo_tz ORDER BY c;
             c              
----------------------------
 1887-12-31 15:00:00
 2024-08-30 04:05:06.789
 2025-01-01 00:00:00
 2025-01-01 00:00:00
 2025-01-01 00:00:00.001
 2025-01-01 12:00:00
 2025-01-02 00:00:00
 2025-01-03 00:00:00
 9999-12-31 23:59:59.999999
(9 rows)

UPDATE fdw_type_timestamp_wo_tz
  SET c = '2025-03-02 05:06:12.345'::timestamp without time zone
  WHERE c = '2025-01-01 00:00:00.001'::timestamp without time zone;
SELECT * FROM fdw_type_timestamp_wo_tz ORDER BY c DESC;
             c              
----------------------------
 9999-12-31 23:59:59.999999
 2025-03-02 05:06:12.345
 2025-01-03 00:00:00
 2025-01-02 00:00:00
 2025-01-01 12:00:00
 2025-01-01 00:00:00
 2025-01-01 00:00:00
 2024-08-30 04:05:06.789
 1887-12-31 15:00:00
(9 rows)

DELETE FROM fdw_type_timestamp_wo_tz
  WHERE c = CAST('2025-03-02 05:06:12.345' AS timestamp without time zone);
SELECT * FROM fdw_type_timestamp_wo_tz ORDER BY c;
             c              
----------------------------
 1887-12-31 15:00:00
 2024-08-30 04:05:06.789
 2025-01-01 00:00:00
 2025-01-01 00:00:00
 2025-01-01 12:00:00
 2025-01-02 00:00:00
 2025-01-03 00:00:00
 9999-12-31 23:59:59.999999
(8 rows)

--- Test teardown: DDL of the PostgreSQL
DROP FOREIGN TABLE fdw_type_timestamp_wo_tz;
--- Test teardown: DDL of the Tsurugi
SELECT tg_execute_ddl('DROP TABLE fdw_type_timestamp_wo_tz', 'tsurugidb');
 tg_execute_ddl 
----------------
 DROP TABLE
(1 row)

-- Date/Time Types - timestamp with time zone
--- Test setup: DDL of the Tsurugi
SELECT tg_execute_ddl('
  CREATE TABLE fdw_type_timestamp_tz (c TIMESTAMP WITH TIME ZONE)
', 'tsurugidb');
 tg_execute_ddl 
----------------
 CREATE TABLE
(1 row)

--- Test setup: DDL of the PostgreSQL
CREATE FOREIGN TABLE fdw_type_timestamp_tz (
  c timestamp with time zone
) SERVER tsurugidb;
--- Test
INSERT INTO fdw_type_timestamp_tz
  VALUES
  (timestamp with time zone '2025-01-01 12:01:02.34567+9:00');
INSERT INTO fdw_type_timestamp_tz
  VALUES
  ('2025-01-02 12:01:02.34567+9:00'::timestamp with time zone);
INSERT INTO fdw_type_timestamp_tz
  VALUES
  (CAST('2025-01-03 12:01:02.34567+9:00' AS timestamp with time zone));
INSERT INTO fdw_type_timestamp_tz
  VALUES
  (timestamp with time zone '2025-01-01 12:01:02.34567+900');
INSERT INTO fdw_type_timestamp_tz
  VALUES
  (timestamp with time zone '2025-01-01 12:01:02.34567+9');
INSERT INTO fdw_type_timestamp_tz
  VALUES
  (timestamp with time zone '2025-01-01 12:01:02.34567Z');
INSERT INTO fdw_type_timestamp_tz
  VALUES
  (timestamp with time zone '2025-01-01T12:01:02.34567Z');
INSERT INTO fdw_type_timestamp_tz
  VALUES
  (timestamp with time zone '1887-12-31 15:00:00+00');
INSERT INTO fdw_type_timestamp_tz
  VALUES
  (timestamp with time zone '9999-12-31 23:59:59.999999+14');
INSERT INTO fdw_type_timestamp_tz
  VALUES (timestamp with time zone '2025-01-01 12:01:02.34567 UTC');
INSERT INTO fdw_type_timestamp_tz
  VALUES (timestamp with time zone '2025-01-01 12:01:02.34567 Universal');
INSERT INTO fdw_type_timestamp_tz
  VALUES (timestamp with time zone '2025-01-01 12:00');
INSERT INTO fdw_type_timestamp_tz VALUES (NULL);
INSERT INTO fdw_type_timestamp_tz VALUES ('2024-08-30 04:05:06.789+9:00');
SET SESSION TIMEZONE TO 'UTC';  -- check time zone in UTC
SELECT * FROM fdw_type_timestamp_tz ORDER BY c;
               c               
-------------------------------
 
 1887-12-31 15:00:00+00
 2024-08-29 19:05:06.789+00
 2025-01-01 03:01:02.34567+00
 2025-01-01 03:01:02.34567+00
 2025-01-01 03:01:02.34567+00
 2025-01-01 12:00:00+00
 2025-01-01 12:01:02.34567+00
 2025-01-01 12:01:02.34567+00
 2025-01-01 12:01:02.34567+00
 2025-01-01 12:01:02.34567+00
 2025-01-02 03:01:02.34567+00
 2025-01-03 03:01:02.34567+00
 9999-12-31 09:59:59.999999+00
(14 rows)

SET SESSION TIMEZONE TO 'Asia/Tokyo';  -- check time zone in Asia/Tokyo
SELECT * FROM fdw_type_timestamp_tz ORDER BY c;
               c               
-------------------------------
 
 1888-01-01 00:00:00+09
 2024-08-30 04:05:06.789+09
 2025-01-01 12:01:02.34567+09
 2025-01-01 12:01:02.34567+09
 2025-01-01 12:01:02.34567+09
 2025-01-01 21:00:00+09
 2025-01-01 21:01:02.34567+09
 2025-01-01 21:01:02.34567+09
 2025-01-01 21:01:02.34567+09
 2025-01-01 21:01:02.34567+09
 2025-01-02 12:01:02.34567+09
 2025-01-03 12:01:02.34567+09
 9999-12-31 18:59:59.999999+09
(14 rows)

UPDATE fdw_type_timestamp_tz SET c = '2025-01-01 00:00:00.001+900' WHERE c IS NULL;
SELECT * FROM fdw_type_timestamp_tz ORDER BY c;
               c               
-------------------------------
 1888-01-01 00:00:00+09
 2024-08-30 04:05:06.789+09
 2025-01-01 00:00:00.001+09
 2025-01-01 12:01:02.34567+09
 2025-01-01 12:01:02.34567+09
 2025-01-01 12:01:02.34567+09
 2025-01-01 21:00:00+09
 2025-01-01 21:01:02.34567+09
 2025-01-01 21:01:02.34567+09
 2025-01-01 21:01:02.34567+09
 2025-01-01 21:01:02.34567+09
 2025-01-02 12:01:02.34567+09
 2025-01-03 12:01:02.34567+09
 9999-12-31 18:59:59.999999+09
(14 rows)

UPDATE fdw_type_timestamp_tz
  SET c = '2025-03-02 05:06:12.345+900'::timestamp with time zone
  WHERE c = '2025-01-01 00:00:00.001+900'::timestamp with time zone;
SELECT * FROM fdw_type_timestamp_tz ORDER BY c DESC;
               c               
-------------------------------
 9999-12-31 18:59:59.999999+09
 2025-03-02 05:06:12.345+09
 2025-01-03 12:01:02.34567+09
 2025-01-02 12:01:02.34567+09
 2025-01-01 21:01:02.34567+09
 2025-01-01 21:01:02.34567+09
 2025-01-01 21:01:02.34567+09
 2025-01-01 21:01:02.34567+09
 2025-01-01 21:00:00+09
 2025-01-01 12:01:02.34567+09
 2025-01-01 12:01:02.34567+09
 2025-01-01 12:01:02.34567+09
 2024-08-30 04:05:06.789+09
 1888-01-01 00:00:00+09
(14 rows)

DELETE FROM fdw_type_timestamp_tz
  WHERE c = CAST('2025-03-02 05:06:12.345+900' AS timestamp with time zone);
SELECT * FROM fdw_type_timestamp_tz ORDER BY c;
               c               
-------------------------------
 1888-01-01 00:00:00+09
 2024-08-30 04:05:06.789+09
 2025-01-01 12:01:02.34567+09
 2025-01-01 12:01:02.34567+09
 2025-01-01 12:01:02.34567+09
 2025-01-01 21:00:00+09
 2025-01-01 21:01:02.34567+09
 2025-01-01 21:01:02.34567+09
 2025-01-01 21:01:02.34567+09
 2025-01-01 21:01:02.34567+09
 2025-01-02 12:01:02.34567+09
 2025-01-03 12:01:02.34567+09
 9999-12-31 18:59:59.999999+09
(13 rows)

--- Test teardown: DDL of the PostgreSQL
DROP FOREIGN TABLE fdw_type_timestamp_tz;
--- Test teardown: DDL of the Tsurugi
SELECT tg_execute_ddl('DROP TABLE fdw_type_timestamp_tz', 'tsurugidb');
 tg_execute_ddl 
----------------
 DROP TABLE
(1 row)

-- Date/Time Types - Test teardown: PostgreSQL environment
SET TIMEZONE TO 'UTC';
SET DATESTYLE TO 'default';
