/* Test case: unhappy path - Unsupported DML statement patterns - PostgreSQL 12-16 */
/* Test case: unhappy path - Unsupported SELECT statement patterns */
-- Test setup: DDL of the Tsurugi
SELECT tg_execute_ddl('
  CREATE TABLE fdw_sel_unsupported_test (
    id INTEGER PRIMARY KEY,
    name VARCHAR(100) NOT NULL,
    value NUMERIC(10,2) NOT NULL,
    ref_id INT,
    manager_id INT
  )
', 'tsurugidb');
  tg_execute_ddl   
-------------------
 execute succeeded
(1 row)

-- Test setup: DDL of the PostgreSQL
CREATE FOREIGN TABLE fdw_sel_unsupported_test (
  id INTEGER,
  name TEXT,
  value NUMERIC,
  ref_id INT,
  manager_id INT
) SERVER tsurugidb;
-- LIMIT OFFSET
SELECT * FROM fdw_sel_unsupported_test LIMIT 2 OFFSET 1;
ERROR:  tsurugi_fdw: Failed to execute remote SQL.
HINT:  Failed to execute the query on Tsurugi. error: SERVER_ERROR(13)
Tsurugi Error: SYNTAX_EXCEPTION (SQL-03001: compile failed with message:"appeared unexpected token: "OFFSET", expected one of {<END_OF_FILE>, %, *, +, -, ...}" region:"region(begin=81, end=87)")
CONTEXT:  SQL query: SELECT id, name, value, ref_id, manager_id FROM fdw_sel_unsupported_test LIMIT 2 OFFSET 1
-- OFFSET FETCH FIRST ... ONLY
SELECT * FROM fdw_sel_unsupported_test ORDER BY value
  OFFSET 1 FETCH FIRST 2 ROWS ONLY;
ERROR:  tsurugi_fdw: Failed to execute remote SQL.
HINT:  Failed to execute the query on Tsurugi. error: SERVER_ERROR(13)
Tsurugi Error: SYNTAX_EXCEPTION (SQL-03001: compile failed with message:"appeared unexpected token: "OFFSET", expected one of {<END_OF_FILE>, %, *, +, -, ...}" region:"region(begin=100, end=106)")
CONTEXT:  SQL query: SELECT id, name, value, ref_id, manager_id FROM fdw_sel_unsupported_test ORDER BY value ASC LIMIT 2 OFFSET 1
-- OFFSET FETCH NEXT ... ONLY
SELECT * FROM fdw_sel_unsupported_test ORDER BY value
  OFFSET 1 FETCH NEXT 2 ROWS ONLY;
ERROR:  tsurugi_fdw: Failed to execute remote SQL.
HINT:  Failed to execute the query on Tsurugi. error: SERVER_ERROR(13)
Tsurugi Error: SYNTAX_EXCEPTION (SQL-03001: compile failed with message:"appeared unexpected token: "OFFSET", expected one of {<END_OF_FILE>, %, *, +, -, ...}" region:"region(begin=100, end=106)")
CONTEXT:  SQL query: SELECT id, name, value, ref_id, manager_id FROM fdw_sel_unsupported_test ORDER BY value ASC LIMIT 2 OFFSET 1
-- SELECT FOR UPDATE / NOWAIT
BEGIN;
SELECT * FROM fdw_sel_unsupported_test FOR UPDATE NOWAIT;
ERROR:  tsurugi_fdw: Failed to execute remote SQL.
HINT:  Failed to execute the query on Tsurugi. error: SERVER_ERROR(13)
Tsurugi Error: SYNTAX_EXCEPTION (SQL-03001: compile failed with message:"appeared unexpected token: "FOR", expected one of {<END_OF_FILE>, ,, ., ;, AS, ...}" region:"region(begin=73, end=76)")
CONTEXT:  SQL query: SELECT id, name, value, ref_id, manager_id FROM fdw_sel_unsupported_test FOR UPDATE
END;
-- SELECT FOR UPDATE / SKIP LOCKED
BEGIN;
SELECT * FROM fdw_sel_unsupported_test FOR UPDATE SKIP LOCKED;
ERROR:  tsurugi_fdw: Failed to execute remote SQL.
HINT:  Failed to execute the query on Tsurugi. error: SERVER_ERROR(13)
Tsurugi Error: SYNTAX_EXCEPTION (SQL-03001: compile failed with message:"appeared unexpected token: "FOR", expected one of {<END_OF_FILE>, ,, ., ;, AS, ...}" region:"region(begin=73, end=76)")
CONTEXT:  SQL query: SELECT id, name, value, ref_id, manager_id FROM fdw_sel_unsupported_test FOR UPDATE
END;
-- Test teardown: DDL of the PostgreSQL
DROP FOREIGN TABLE fdw_sel_unsupported_test;
-- Test teardown: DDL of the Tsurugi
SELECT tg_execute_ddl('DROP TABLE fdw_sel_unsupported_test', 'tsurugidb');
  tg_execute_ddl   
-------------------
 execute succeeded
(1 row)

/* Test case: unhappy path - Unsupported INSERT statement patterns */
-- Test setup: DDL of the Tsurugi
SELECT tg_execute_ddl('
  CREATE TABLE fdw_ins_unsupported_test (
    id INT PRIMARY KEY DEFAULT 9999,
    key_col VARCHAR(100) DEFAULT ''default'',
    value_col INT DEFAULT 0
  )
', 'tsurugidb');
  tg_execute_ddl   
-------------------
 execute succeeded
(1 row)

-- Test setup: DDL of the PostgreSQL
CREATE FOREIGN TABLE fdw_ins_unsupported_test (
  id integer DEFAULT 9999,
  key_col varchar(100) DEFAULT 'default',
  value_col integer DEFAULT 0
) SERVER tsurugidb;
-- ON CONFLICT DO NOTHING
INSERT INTO fdw_ins_unsupported_test
  VALUES (4, 'key4', 777) ON CONFLICT (id) DO NOTHING;
ERROR:  there is no unique or exclusion constraint matching the ON CONFLICT specification
-- ON CONFLICT DO UPDATE SET ...
INSERT INTO fdw_ins_unsupported_test (key_col, value_col) VALUES ('key4', 444)
  ON CONFLICT (key_col) DO UPDATE SET value_col = EXCLUDED.value_col;
ERROR:  there is no unique or exclusion constraint matching the ON CONFLICT specification
-- RETURNING
INSERT INTO fdw_ins_unsupported_test (key_col, value_col) VALUES ('key6', 600)
  RETURNING id, key_col AS inserted_key;
ERROR:  RETURNING clause is not supported
-- Test teardown: DDL of the PostgreSQL
DROP FOREIGN TABLE fdw_ins_unsupported_test;
-- Test teardown: DDL of the Tsurugi
SELECT tg_execute_ddl('DROP TABLE fdw_ins_unsupported_test', 'tsurugidb');
  tg_execute_ddl   
-------------------
 execute succeeded
(1 row)

/* Test case: unhappy path - Unsupported UPDATE statement patterns */
-- Test setup: DDL of the Tsurugi
SELECT tg_execute_ddl('
  CREATE TABLE fdw_upd_unsupported_test (
    id INT PRIMARY KEY,
    key_col VARCHAR(100),
    value_col INT DEFAULT 0,
    date_col DATE
  )
', 'tsurugidb');
  tg_execute_ddl   
-------------------
 execute succeeded
(1 row)

-- Test setup: DDL of the PostgreSQL
CREATE FOREIGN TABLE fdw_upd_unsupported_test (
  id integer,
  key_col varchar(100),
  value_col integer DEFAULT 0,
  date_col date
) SERVER tsurugidb;
-- SET column_name = date + INTERVAL
UPDATE fdw_upd_unsupported_test SET date_col = date_col + INTERVAL '1 days';
ERROR:  tsurugi_fdw: Failed to execute remote SQL.
HINT:  Failed to execute the statement on Tsurugi. error: SERVER_ERROR(13)
Tsurugi Error: UNSUPPORTED_COMPILER_FEATURE_EXCEPTION (SQL-03010: compile failed with error:unsupported_feature message:"unsupported type: interval" location:<input>:1:69+8)
CONTEXT:  SQL query: UPDATE fdw_upd_unsupported_test SET date_col = (date_col + '1 day'::interval)
-- RETURNING
UPDATE fdw_upd_unsupported_test
  SET value_col = value_col + 1
  WHERE key_col = 'key3'
  RETURNING id, key_col AS updated_key, value_col;
ERROR:  RETURNING clause is not supported
-- Test teardown: DDL of the PostgreSQL
DROP FOREIGN TABLE fdw_upd_unsupported_test;
-- Test teardown: DDL of the Tsurugi
SELECT tg_execute_ddl('DROP TABLE fdw_upd_unsupported_test', 'tsurugidb');
  tg_execute_ddl   
-------------------
 execute succeeded
(1 row)

/* Test case: unhappy path - Unsupported DELETE statement patterns */
-- Test setup: DDL of the Tsurugi
SELECT tg_execute_ddl('
  CREATE TABLE fdw_del_variation_table_1 (
    id INT PRIMARY KEY,
    key_col VARCHAR(100),
    value_col INT
  )
', 'tsurugidb');
  tg_execute_ddl   
-------------------
 execute succeeded
(1 row)

SELECT tg_execute_ddl('
  CREATE TABLE fdw_del_variation_table_2 (
    key_col VARCHAR(100)
  )
', 'tsurugidb');
  tg_execute_ddl   
-------------------
 execute succeeded
(1 row)

-- Test setup: DDL of the PostgreSQL
CREATE FOREIGN TABLE fdw_del_variation_table_1 (
  id integer,
  key_col varchar(100),
  value_col integer
) SERVER tsurugidb;
CREATE FOREIGN TABLE fdw_del_variation_table_2 (
  key_col varchar(100)
) SERVER tsurugidb;
-- RETURNING
DELETE FROM fdw_del_variation_table_1 WHERE key_col = 'key6'
  RETURNING id, key_col AS deleted_key;
ERROR:  RETURNING clause is not supported
-- Test teardown: DDL of the PostgreSQL
DROP FOREIGN TABLE fdw_del_variation_table_1;
DROP FOREIGN TABLE fdw_del_variation_table_2;
-- Test teardown: DDL of the Tsurugi
SELECT tg_execute_ddl('DROP TABLE fdw_del_variation_table_1', 'tsurugidb');
  tg_execute_ddl   
-------------------
 execute succeeded
(1 row)

SELECT tg_execute_ddl('DROP TABLE fdw_del_variation_table_2', 'tsurugidb');
  tg_execute_ddl   
-------------------
 execute succeeded
(1 row)

