/* Test setup: PostgreSQL environment */
SET datestyle TO ISO, YMD;
SET timezone TO 'Asia/Tokyo';
/* Test case: happy path - Standard DML statement variations */
-- Test setup: DDL of the Tsurugi
SELECT tg_execute_ddl('
  CREATE TABLE fdw_dml_basic_table_1 (
    c1 INTEGER NOT NULL PRIMARY KEY
  )
', 'tsurugidb');
 tg_execute_ddl 
----------------
 CREATE TABLE
(1 row)

SELECT tg_execute_ddl('
  CREATE TABLE fdw_dml_basic_table_2 (
    c1 INTEGER NOT NULL PRIMARY KEY,
    c2 BIGINT DEFAULT 9999,
    c3 DOUBLE PRECISION,
    c4 VARCHAR(100),
    c5 DATE
  )
', 'tsurugidb');
 tg_execute_ddl 
----------------
 CREATE TABLE
(1 row)

-- Test setup: DDL of the PostgreSQL
CREATE FOREIGN TABLE fdw_dml_basic_table_1 (
  c1 integer NOT NULL
) SERVER tsurugidb;
CREATE FOREIGN TABLE fdw_dml_basic_table_2 (
  c1 integer NOT NULL,
  c2 bigint DEFAULT 9999,
  c3 double precision,
  c4 varchar(100),
  c5 date
) SERVER tsurugidb;
-- Test
SELECT * FROM fdw_dml_basic_table_1 ORDER BY c1;
 c1 
----
(0 rows)

-- INSERT statement variation (single column)
INSERT INTO fdw_dml_basic_table_1 (c1) VALUES (1);
INSERT INTO fdw_dml_basic_table_1 (c1) VALUES (100);
INSERT INTO fdw_dml_basic_table_1 (c1) VALUES (10);
SELECT * FROM fdw_dml_basic_table_1;
 c1  
-----
   1
  10
 100
(3 rows)

-- SELECT statement variation (single column)
--- WHERE variation
---- Equality pattern
SELECT * FROM fdw_dml_basic_table_1 WHERE c1 = 10;
 c1 
----
 10
(1 row)

---- Inequality pattern
SELECT c1 FROM fdw_dml_basic_table_1 WHERE c1 <> 10;
 c1  
-----
   1
 100
(2 rows)

---- Greater than pattern
SELECT * FROM fdw_dml_basic_table_1 WHERE c1 > 10;
 c1  
-----
 100
(1 row)

---- Greater than or equal pattern
SELECT c1 FROM fdw_dml_basic_table_1 WHERE c1 >= 10;
 c1  
-----
  10
 100
(2 rows)

---- Less than pattern
SELECT * FROM fdw_dml_basic_table_1 WHERE c1 < 10;
 c1 
----
  1
(1 row)

---- Less than or equal pattern
SELECT c1 FROM fdw_dml_basic_table_1 WHERE c1 <= 0;
 c1 
----
(0 rows)

--- ORDER variation
---- Default order pattern
SELECT * FROM fdw_dml_basic_table_1 ORDER BY c1;
 c1  
-----
   1
  10
 100
(3 rows)

---- Ascending order pattern
SELECT * FROM fdw_dml_basic_table_1 ORDER BY c1 ASC;
 c1  
-----
   1
  10
 100
(3 rows)

---- Descending order pattern
SELECT * FROM fdw_dml_basic_table_1 ORDER BY c1 DESC;
 c1  
-----
 100
  10
   1
(3 rows)

-- UPDATE statement variation (single column)
--- Single condition and direct value
UPDATE fdw_dml_basic_table_1 SET c1 = 1000 WHERE c1 = 1;
SELECT * FROM fdw_dml_basic_table_1 ORDER BY c1;
  c1  
------
   10
  100
 1000
(3 rows)

UPDATE fdw_dml_basic_table_1 SET c1 = 0 WHERE c1 = 9999;
SELECT * FROM fdw_dml_basic_table_1 ORDER BY c1;
  c1  
------
   10
  100
 1000
(3 rows)

--- Single condition and expression values
UPDATE fdw_dml_basic_table_1 SET c1 = c1 * 2 WHERE c1 = 100;
SELECT * FROM fdw_dml_basic_table_1 ORDER BY c1;
  c1  
------
   10
  200
 1000
(3 rows)

--- Multiple conditions and expression values
UPDATE fdw_dml_basic_table_1 SET c1 = c1 + 10 WHERE c1 = 10 OR c1 = 200;
SELECT * FROM fdw_dml_basic_table_1 ORDER BY c1;
  c1  
------
   20
  210
 1000
(3 rows)

UPDATE fdw_dml_basic_table_1 SET c1 = c1 + 10 WHERE c1 = 9999 OR c1 = -1;
SELECT * FROM fdw_dml_basic_table_1 ORDER BY c1;
  c1  
------
   20
  210
 1000
(3 rows)

--- Update without condition
UPDATE fdw_dml_basic_table_1 SET c1 = c1 + 1;
SELECT * FROM fdw_dml_basic_table_1 ORDER BY c1;
  c1  
------
   21
  211
 1001
(3 rows)

-- DELETE statement variation (single column)
INSERT INTO fdw_dml_basic_table_1 VALUES (1);
INSERT INTO fdw_dml_basic_table_1 VALUES (2);
INSERT INTO fdw_dml_basic_table_1 VALUES (3);
INSERT INTO fdw_dml_basic_table_1 VALUES (4);
INSERT INTO fdw_dml_basic_table_1 VALUES (5);
--- Single condition
DELETE FROM fdw_dml_basic_table_1 WHERE c1 = 211;
SELECT * FROM fdw_dml_basic_table_1 ORDER BY c1;
  c1  
------
    1
    2
    3
    4
    5
   21
 1001
(7 rows)

DELETE FROM fdw_dml_basic_table_1 WHERE c1 = -1;
SELECT * FROM fdw_dml_basic_table_1 ORDER BY c1;
  c1  
------
    1
    2
    3
    4
    5
   21
 1001
(7 rows)

--- Multiple conditions
DELETE FROM fdw_dml_basic_table_1 WHERE c1 >= 21 OR c1 = 3;
SELECT * FROM fdw_dml_basic_table_1 ORDER BY c1;
 c1 
----
  1
  2
  4
  5
(4 rows)

DELETE FROM fdw_dml_basic_table_1 WHERE c1 >= 21 OR c1 = 3;
SELECT * FROM fdw_dml_basic_table_1 ORDER BY c1;
 c1 
----
  1
  2
  4
  5
(4 rows)

--- Delete in inequality conditions.
DELETE FROM fdw_dml_basic_table_1 WHERE c1 <> 2 AND c1 <> 4;
SELECT * FROM fdw_dml_basic_table_1 ORDER BY c1;
 c1 
----
  2
  4
(2 rows)

DELETE FROM fdw_dml_basic_table_1 WHERE c1 <> 2 AND c1 <> 4;
SELECT * FROM fdw_dml_basic_table_1 ORDER BY c1;
 c1 
----
  2
  4
(2 rows)

--- Delete without condition
DELETE FROM fdw_dml_basic_table_1;
SELECT * FROM fdw_dml_basic_table_1 ORDER BY c1;
 c1 
----
(0 rows)

DELETE FROM fdw_dml_basic_table_1;
SELECT * FROM fdw_dml_basic_table_1 ORDER BY c1;
 c1 
----
(0 rows)

-- INSERT statement variation (multiple columns)
--- Full column insert with column names
INSERT INTO fdw_dml_basic_table_2 (c1, c2, c3, c4, c5)
  VALUES (1, 100, 1.1, '1st', '2025-01-01');
--- Full column insert without column names
INSERT INTO fdw_dml_basic_table_2
  VALUES (3, 300, 3.3, NULL, '2025-03-03');
--- Partial column insert with 4 columns
INSERT INTO fdw_dml_basic_table_2 (c1, c2, c3, c4)
  VALUES (2, 200, 2.2, '2nd');
--- Partial column insert with 1 column
INSERT INTO fdw_dml_basic_table_2 (c1)
  VALUES (5);
--- Partial column insert with 3 columns
INSERT INTO fdw_dml_basic_table_2 (c1, c2, c4)
  VALUES (6, 600, '6th');
--- Partial column insert with 2 columns
INSERT INTO fdw_dml_basic_table_2 (c1, c3)
  VALUES (7, 7.7);
--- Columns are in different order
INSERT INTO fdw_dml_basic_table_2 (c3, c1, c2, c5, c4)
  VALUES (4.4, 4, 400, '2025-04-04', '4th');
--- Batch insert
INSERT INTO fdw_dml_basic_table_2
  VALUES
    (8, 800, 8.8, '8th', '2025-08-08'),
    (9, 900, 9.9, '9th', '2025-08-08');
SELECT c1, c2, c3, c4, c5 FROM fdw_dml_basic_table_2;
 c1 |  c2  | c3  | c4  |     c5     
----+------+-----+-----+------------
  1 |  100 | 1.1 | 1st | 2025-01-01
  2 |  200 | 2.2 | 2nd | 
  3 |  300 | 3.3 |     | 2025-03-03
  4 |  400 | 4.4 | 4th | 2025-04-04
  5 | 9999 |     |     | 
  6 |  600 |     | 6th | 
  7 | 9999 | 7.7 |     | 
  8 |  800 | 8.8 | 8th | 2025-08-08
  9 |  900 | 9.9 | 9th | 2025-08-08
(9 rows)

-- SELECT statement variation (multiple columns)
--- Columns variation
---- Single column (integer) selection
SELECT c1 FROM fdw_dml_basic_table_2 ORDER BY c1;
 c1 
----
  1
  2
  3
  4
  5
  6
  7
  8
  9
(9 rows)

---- Single column (bigint) selection
SELECT c2 FROM fdw_dml_basic_table_2 ORDER BY c1;
  c2  
------
  100
  200
  300
  400
 9999
  600
 9999
  800
  900
(9 rows)

---- Single column (double precision) selection
SELECT c3 FROM fdw_dml_basic_table_2 ORDER BY c1;
 c3  
-----
 1.1
 2.2
 3.3
 4.4
    
    
 7.7
 8.8
 9.9
(9 rows)

---- Single column (varchar) selection
SELECT c4 FROM fdw_dml_basic_table_2 ORDER BY c1;
 c4  
-----
 1st
 2nd
 
 4th
 
 6th
 
 8th
 9th
(9 rows)

---- Single column (date) selection
SELECT c5 FROM fdw_dml_basic_table_2 ORDER BY c1;
     c5     
------------
 2025-01-01
 
 2025-03-03
 2025-04-04
 
 
 
 2025-08-08
 2025-08-08
(9 rows)

---- Multiple columns (integer/bigint) selection
SELECT c1, c2 FROM fdw_dml_basic_table_2 ORDER BY c1;
 c1 |  c2  
----+------
  1 |  100
  2 |  200
  3 |  300
  4 |  400
  5 | 9999
  6 |  600
  7 | 9999
  8 |  800
  9 |  900
(9 rows)

---- Multiple columns (integer/double precision) selection
SELECT c1, c3 FROM fdw_dml_basic_table_2 ORDER BY c1;
 c1 | c3  
----+-----
  1 | 1.1
  2 | 2.2
  3 | 3.3
  4 | 4.4
  5 |    
  6 |    
  7 | 7.7
  8 | 8.8
  9 | 9.9
(9 rows)

---- Multiple columns (double precision/varchar/bigint) selection
SELECT c2, c3, c1 FROM fdw_dml_basic_table_2 ORDER BY c1;
  c2  | c3  | c1 
------+-----+----
  100 | 1.1 |  1
  200 | 2.2 |  2
  300 | 3.3 |  3
  400 | 4.4 |  4
 9999 |     |  5
  600 |     |  6
 9999 | 7.7 |  7
  800 | 8.8 |  8
  900 | 9.9 |  9
(9 rows)

---- Column name alias
SELECT c1 AS id, c2 AS value FROM fdw_dml_basic_table_2;
 id | value 
----+-------
  1 |   100
  2 |   200
  3 |   300
  4 |   400
  5 |  9999
  6 |   600
  7 |  9999
  8 |   800
  9 |   900
(9 rows)

--- WHERE variation
SELECT c1 FROM fdw_dml_basic_table_2
  WHERE (c1 < 5) AND (c3 > 2.2) ORDER BY c1;
 c1 
----
  3
  4
(2 rows)

SELECT c1 FROM fdw_dml_basic_table_2 WHERE (c2 <> 600) AND (c3 IS NULL);
 c1 
----
  5
(1 row)

SELECT * FROM fdw_dml_basic_table_2 WHERE c4 IS NOT NULL AND c5 IS NOT NULL;
 c1 | c2  | c3  | c4  |     c5     
----+-----+-----+-----+------------
  1 | 100 | 1.1 | 1st | 2025-01-01
  4 | 400 | 4.4 | 4th | 2025-04-04
  8 | 800 | 8.8 | 8th | 2025-08-08
  9 | 900 | 9.9 | 9th | 2025-08-08
(4 rows)

SELECT c1, c4 FROM fdw_dml_basic_table_2 WHERE c4 <= '4th';
 c1 | c4  
----+-----
  1 | 1st
  2 | 2nd
  4 | 4th
(3 rows)

SELECT * FROM fdw_dml_basic_table_2 WHERE c4 >= '8th';
 c1 | c2  | c3  | c4  |     c5     
----+-----+-----+-----+------------
  8 | 800 | 8.8 | 8th | 2025-08-08
  9 | 900 | 9.9 | 9th | 2025-08-08
(2 rows)

SELECT c1, c5 FROM fdw_dml_basic_table_2 WHERE c5 <= date '2025-03-03';
 c1 |     c5     
----+------------
  1 | 2025-01-01
  3 | 2025-03-03
(2 rows)

SELECT c1, c2 FROM fdw_dml_basic_table_2
  WHERE (c2 * 2) BETWEEN 500 AND 1000
  ORDER BY c2;
 c1 | c2  
----+-----
  3 | 300
  4 | 400
(2 rows)

SELECT c1, c4 FROM fdw_dml_basic_table_2
  WHERE c4 IS NOT NULL
  ORDER BY c4 DESC;
 c1 | c4  
----+-----
  9 | 9th
  8 | 8th
  6 | 6th
  4 | 4th
  2 | 2nd
  1 | 1st
(6 rows)

SELECT c1, c5 FROM fdw_dml_basic_table_2
  WHERE c5 IS NOT NULL
  ORDER BY c5 DESC;
 c1 |     c5     
----+------------
  8 | 2025-08-08
  9 | 2025-08-08
  4 | 2025-04-04
  3 | 2025-03-03
  1 | 2025-01-01
(5 rows)

SELECT c1, c2, c3, c4, c5 FROM fdw_dml_basic_table_2
  WHERE c4 IS NOT NULL AND c5 IS NOT NULL
  ORDER BY c2 DESC;
 c1 | c2  | c3  | c4  |     c5     
----+-----+-----+-----+------------
  9 | 900 | 9.9 | 9th | 2025-08-08
  8 | 800 | 8.8 | 8th | 2025-08-08
  4 | 400 | 4.4 | 4th | 2025-04-04
  1 | 100 | 1.1 | 1st | 2025-01-01
(4 rows)

SELECT * FROM fdw_dml_basic_table_2
  WHERE (c2 < 500 AND c4 IS NOT NULL) OR (c3 < 3);
 c1 | c2  | c3  | c4  |     c5     
----+-----+-----+-----+------------
  1 | 100 | 1.1 | 1st | 2025-01-01
  2 | 200 | 2.2 | 2nd | 
  4 | 400 | 4.4 | 4th | 2025-04-04
(3 rows)

SELECT * FROM fdw_dml_basic_table_2 WHERE c4 LIKE '%th';
 c1 | c2  | c3  | c4  |     c5     
----+-----+-----+-----+------------
  4 | 400 | 4.4 | 4th | 2025-04-04
  6 | 600 |     | 6th | 
  8 | 800 | 8.8 | 8th | 2025-08-08
  9 | 900 | 9.9 | 9th | 2025-08-08
(4 rows)

--- tsurugi-issue#1078 (disable due to development) */
SELECT * FROM fdw_dml_basic_table_2 WHERE c4 LIKE '%th' ORDER BY c1;
 c1 | c2  | c3  | c4  |     c5     
----+-----+-----+-----+------------
  4 | 400 | 4.4 | 4th | 2025-04-04
  6 | 600 |     | 6th | 
  8 | 800 | 8.8 | 8th | 2025-08-08
  9 | 900 | 9.9 | 9th | 2025-08-08
(4 rows)

SELECT * FROM fdw_dml_basic_table_2 WHERE c3 IN (1.1, 2.2);
 c1 | c2  | c3  | c4  |     c5     
----+-----+-----+-----+------------
  1 | 100 | 1.1 | 1st | 2025-01-01
  2 | 200 | 2.2 | 2nd | 
(2 rows)

--- ORDER variation
SELECT * FROM fdw_dml_basic_table_2 ORDER BY c5 DESC;
 c1 |  c2  | c3  | c4  |     c5     
----+------+-----+-----+------------
  8 |  800 | 8.8 | 8th | 2025-08-08
  9 |  900 | 9.9 | 9th | 2025-08-08
  4 |  400 | 4.4 | 4th | 2025-04-04
  3 |  300 | 3.3 |     | 2025-03-03
  1 |  100 | 1.1 | 1st | 2025-01-01
  2 |  200 | 2.2 | 2nd | 
  5 | 9999 |     |     | 
  6 |  600 |     | 6th | 
  7 | 9999 | 7.7 |     | 
(9 rows)

SELECT * FROM fdw_dml_basic_table_2 ORDER BY c4;
 c1 |  c2  | c3  | c4  |     c5     
----+------+-----+-----+------------
  3 |  300 | 3.3 |     | 2025-03-03
  5 | 9999 |     |     | 
  7 | 9999 | 7.7 |     | 
  1 |  100 | 1.1 | 1st | 2025-01-01
  2 |  200 | 2.2 | 2nd | 
  4 |  400 | 4.4 | 4th | 2025-04-04
  6 |  600 |     | 6th | 
  8 |  800 | 8.8 | 8th | 2025-08-08
  9 |  900 | 9.9 | 9th | 2025-08-08
(9 rows)

SELECT * FROM fdw_dml_basic_table_2 ORDER BY c3 ASC;
 c1 |  c2  | c3  | c4  |     c5     
----+------+-----+-----+------------
  5 | 9999 |     |     | 
  6 |  600 |     | 6th | 
  1 |  100 | 1.1 | 1st | 2025-01-01
  2 |  200 | 2.2 | 2nd | 
  3 |  300 | 3.3 |     | 2025-03-03
  4 |  400 | 4.4 | 4th | 2025-04-04
  7 | 9999 | 7.7 |     | 
  8 |  800 | 8.8 | 8th | 2025-08-08
  9 |  900 | 9.9 | 9th | 2025-08-08
(9 rows)

SELECT * FROM fdw_dml_basic_table_2 ORDER BY c2;
 c1 |  c2  | c3  | c4  |     c5     
----+------+-----+-----+------------
  1 |  100 | 1.1 | 1st | 2025-01-01
  2 |  200 | 2.2 | 2nd | 
  3 |  300 | 3.3 |     | 2025-03-03
  4 |  400 | 4.4 | 4th | 2025-04-04
  6 |  600 |     | 6th | 
  8 |  800 | 8.8 | 8th | 2025-08-08
  9 |  900 | 9.9 | 9th | 2025-08-08
  5 | 9999 |     |     | 
  7 | 9999 | 7.7 |     | 
(9 rows)

SELECT * FROM fdw_dml_basic_table_2 ORDER BY c1 DESC;
 c1 |  c2  | c3  | c4  |     c5     
----+------+-----+-----+------------
  9 |  900 | 9.9 | 9th | 2025-08-08
  8 |  800 | 8.8 | 8th | 2025-08-08
  7 | 9999 | 7.7 |     | 
  6 |  600 |     | 6th | 
  5 | 9999 |     |     | 
  4 |  400 | 4.4 | 4th | 2025-04-04
  3 |  300 | 3.3 |     | 2025-03-03
  2 |  200 | 2.2 | 2nd | 
  1 |  100 | 1.1 | 1st | 2025-01-01
(9 rows)

SELECT c1, c2, c3, c4, c5 FROM fdw_dml_basic_table_2 ORDER BY c5, c4 DESC;
 c1 |  c2  | c3  | c4  |     c5     
----+------+-----+-----+------------
  6 |  600 |     | 6th | 
  2 |  200 | 2.2 | 2nd | 
  5 | 9999 |     |     | 
  7 | 9999 | 7.7 |     | 
  1 |  100 | 1.1 | 1st | 2025-01-01
  3 |  300 | 3.3 |     | 2025-03-03
  4 |  400 | 4.4 | 4th | 2025-04-04
  9 |  900 | 9.9 | 9th | 2025-08-08
  8 |  800 | 8.8 | 8th | 2025-08-08
(9 rows)

-- UPDATE statement variation (multiple columns)
UPDATE fdw_dml_basic_table_2 SET c2 = c2 + 10;
SELECT * FROM fdw_dml_basic_table_2 ORDER BY c1;
 c1 |  c2   | c3  | c4  |     c5     
----+-------+-----+-----+------------
  1 |   110 | 1.1 | 1st | 2025-01-01
  2 |   210 | 2.2 | 2nd | 
  3 |   310 | 3.3 |     | 2025-03-03
  4 |   410 | 4.4 | 4th | 2025-04-04
  5 | 10009 |     |     | 
  6 |   610 |     | 6th | 
  7 | 10009 | 7.7 |     | 
  8 |   810 | 8.8 | 8th | 2025-08-08
  9 |   910 | 9.9 | 9th | 2025-08-08
(9 rows)

UPDATE fdw_dml_basic_table_2 SET c3 = c3 - 0.1 WHERE c2 = 110;
SELECT * FROM fdw_dml_basic_table_2 ORDER BY c2 DESC;
 c1 |  c2   | c3  | c4  |     c5     
----+-------+-----+-----+------------
  5 | 10009 |     |     | 
  7 | 10009 | 7.7 |     | 
  9 |   910 | 9.9 | 9th | 2025-08-08
  8 |   810 | 8.8 | 8th | 2025-08-08
  6 |   610 |     | 6th | 
  4 |   410 | 4.4 | 4th | 2025-04-04
  3 |   310 | 3.3 |     | 2025-03-03
  2 |   210 | 2.2 | 2nd | 
  1 |   110 |   1 | 1st | 2025-01-01
(9 rows)

UPDATE fdw_dml_basic_table_2 SET c3 = c3 + 2 WHERE c2 >= 410;
SELECT * FROM fdw_dml_basic_table_2 ORDER BY c3 ASC;
 c1 |  c2   |  c3  | c4  |     c5     
----+-------+------+-----+------------
  5 | 10009 |      |     | 
  6 |   610 |      | 6th | 
  1 |   110 |    1 | 1st | 2025-01-01
  2 |   210 |  2.2 | 2nd | 
  3 |   310 |  3.3 |     | 2025-03-03
  4 |   410 |  6.4 | 4th | 2025-04-04
  7 | 10009 |  9.7 |     | 
  8 |   810 | 10.8 | 8th | 2025-08-08
  9 |   910 | 11.9 | 9th | 2025-08-08
(9 rows)

UPDATE fdw_dml_basic_table_2 SET c5 = c5, c4 = c4 WHERE c4 >= '5th';
SELECT * FROM fdw_dml_basic_table_2 ORDER BY c1;
 c1 |  c2   |  c3  | c4  |     c5     
----+-------+------+-----+------------
  1 |   110 |    1 | 1st | 2025-01-01
  2 |   210 |  2.2 | 2nd | 
  3 |   310 |  3.3 |     | 2025-03-03
  4 |   410 |  6.4 | 4th | 2025-04-04
  5 | 10009 |      |     | 
  6 |   610 |      | 6th | 
  7 | 10009 |  9.7 |     | 
  8 |   810 | 10.8 | 8th | 2025-08-08
  9 |   910 | 11.9 | 9th | 2025-08-08
(9 rows)

UPDATE fdw_dml_basic_table_2
  SET c4 = '9thUpdate', c5 = date '2021-09-09' WHERE c4 = '9th';
SELECT * FROM fdw_dml_basic_table_2 ORDER BY c1;
 c1 |  c2   |  c3  |    c4     |     c5     
----+-------+------+-----------+------------
  1 |   110 |    1 | 1st       | 2025-01-01
  2 |   210 |  2.2 | 2nd       | 
  3 |   310 |  3.3 |           | 2025-03-03
  4 |   410 |  6.4 | 4th       | 2025-04-04
  5 | 10009 |      |           | 
  6 |   610 |      | 6th       | 
  7 | 10009 |  9.7 |           | 
  8 |   810 | 10.8 | 8th       | 2025-08-08
  9 |   910 | 11.9 | 9thUpdate | 2021-09-09
(9 rows)

-- DELETE statement variation (multiple columns)
DELETE FROM fdw_dml_basic_table_2 WHERE c1 < 0;
SELECT * FROM fdw_dml_basic_table_2 ORDER BY c1;
 c1 |  c2   |  c3  |    c4     |     c5     
----+-------+------+-----------+------------
  1 |   110 |    1 | 1st       | 2025-01-01
  2 |   210 |  2.2 | 2nd       | 
  3 |   310 |  3.3 |           | 2025-03-03
  4 |   410 |  6.4 | 4th       | 2025-04-04
  5 | 10009 |      |           | 
  6 |   610 |      | 6th       | 
  7 | 10009 |  9.7 |           | 
  8 |   810 | 10.8 | 8th       | 2025-08-08
  9 |   910 | 11.9 | 9thUpdate | 2021-09-09
(9 rows)

DELETE FROM fdw_dml_basic_table_2 WHERE c3 IS NULL;
SELECT * FROM fdw_dml_basic_table_2 ORDER BY c2;
 c1 |  c2   |  c3  |    c4     |     c5     
----+-------+------+-----------+------------
  1 |   110 |    1 | 1st       | 2025-01-01
  2 |   210 |  2.2 | 2nd       | 
  3 |   310 |  3.3 |           | 2025-03-03
  4 |   410 |  6.4 | 4th       | 2025-04-04
  8 |   810 | 10.8 | 8th       | 2025-08-08
  9 |   910 | 11.9 | 9thUpdate | 2021-09-09
  7 | 10009 |  9.7 |           | 
(7 rows)

DELETE FROM fdw_dml_basic_table_2 WHERE c4 LIKE '9th%';
SELECT * FROM fdw_dml_basic_table_2 ORDER BY c4;
 c1 |  c2   |  c3  | c4  |     c5     
----+-------+------+-----+------------
  3 |   310 |  3.3 |     | 2025-03-03
  7 | 10009 |  9.7 |     | 
  1 |   110 |    1 | 1st | 2025-01-01
  2 |   210 |  2.2 | 2nd | 
  4 |   410 |  6.4 | 4th | 2025-04-04
  8 |   810 | 10.8 | 8th | 2025-08-08
(6 rows)

DELETE FROM fdw_dml_basic_table_2 WHERE c2 > 800;
SELECT * FROM fdw_dml_basic_table_2 ORDER BY c3;
 c1 | c2  | c3  | c4  |     c5     
----+-----+-----+-----+------------
  1 | 110 |   1 | 1st | 2025-01-01
  2 | 210 | 2.2 | 2nd | 
  3 | 310 | 3.3 |     | 2025-03-03
  4 | 410 | 6.4 | 4th | 2025-04-04
(4 rows)

DELETE FROM fdw_dml_basic_table_2 WHERE c3 <= 1.0;
SELECT * FROM fdw_dml_basic_table_2 ORDER BY c2 DESC;
 c1 | c2  | c3  | c4  |     c5     
----+-----+-----+-----+------------
  4 | 410 | 6.4 | 4th | 2025-04-04
  3 | 310 | 3.3 |     | 2025-03-03
  2 | 210 | 2.2 | 2nd | 
(3 rows)

DELETE FROM fdw_dml_basic_table_2 WHERE (c1 <> 2) AND (c1 <> 4);
SELECT * FROM fdw_dml_basic_table_2 ORDER BY c4;
 c1 | c2  | c3  | c4  |     c5     
----+-----+-----+-----+------------
  2 | 210 | 2.2 | 2nd | 
  4 | 410 | 6.4 | 4th | 2025-04-04
(2 rows)

DELETE FROM fdw_dml_basic_table_2;
SELECT * FROM fdw_dml_basic_table_2;
 c1 | c2 | c3 | c4 | c5 
----+----+----+----+----
(0 rows)

-- Test teardown: DDL of the PostgreSQL
DROP FOREIGN TABLE fdw_dml_basic_table_1;
DROP FOREIGN TABLE fdw_dml_basic_table_2;
-- Test teardown: DDL of the Tsurugi
SELECT tg_execute_ddl('DROP TABLE fdw_dml_basic_table_1', 'tsurugidb');
 tg_execute_ddl 
----------------
 DROP TABLE
(1 row)

SELECT tg_execute_ddl('DROP TABLE fdw_dml_basic_table_2', 'tsurugidb');
 tg_execute_ddl 
----------------
 DROP TABLE
(1 row)

/* Test case: happy path - Aggregation related testing */
-- Test setup: DDL of the Tsurugi
SELECT tg_execute_ddl('
  CREATE TABLE fdw_group_basic_table (
    c1 INTEGER PRIMARY KEY,
    c2 INTEGER,
    c3 BIGINT,
    c4 REAL,
    c5 DOUBLE PRECISION,
    c6 INTEGER,
    c7 VARCHAR(5)
  )
', 'tsurugidb');
 tg_execute_ddl 
----------------
 CREATE TABLE
(1 row)

-- Test setup: DDL of the PostgreSQL
CREATE FOREIGN TABLE fdw_group_basic_table (
  c1 integer,
  c2 integer,
  c3 bigint,
  c4 real,
  c5 double precision,
  c6 integer,
  c7 varchar(5)
) SERVER tsurugidb;
-- Initialization of test data
INSERT INTO fdw_group_basic_table
  (c1, c2, c3, c4, c5, c6, c7)
  VALUES
    (1, 11, 111, 1.1, 1.11, 1, 'aaa'),
    (2, 22, 222, 2.2, 2.22, 2, 'bbb'),
    (3, 33, 333, 3.3, 3.33, 3, 'ccc'),
    (4, 44, 444, 4.4, 4.44, 1, 'aaa'),
    (5, 55, 555, 5.5, 5.55, 2, 'bbb');
-- GROUP BY variations
SELECT COUNT(c1) AS "count(c1)", SUM(c2) AS "sum(c2)", c6
  FROM fdw_group_basic_table
  GROUP BY c6
  ORDER BY c6;
 count(c1) | sum(c2) | c6 
-----------+---------+----
         2 |      55 |  1
         2 |      77 |  2
         1 |      33 |  3
(3 rows)

SELECT COUNT(c3) AS "count(c3)", SUM(c4) AS "sum(c4)", c7
  FROM fdw_group_basic_table
  GROUP BY c7
  ORDER BY c7;
 count(c3) | sum(c4) | c7  
-----------+---------+-----
         2 |     5.5 | aaa
         2 |     7.7 | bbb
         1 |     3.3 | ccc
(3 rows)

SELECT COUNT(c1) AS "count(c1)", SUM(c2) AS "sum(c2)", c6
  FROM fdw_group_basic_table
  GROUP BY c6
  HAVING SUM(c2) > 55
  ORDER BY c6;
 count(c1) | sum(c2) | c6 
-----------+---------+----
         2 |      77 |  2
(1 row)

SELECT COUNT(c3) AS "count(c3)", SUM(c4) AS "sum(c4)", c7
  FROM fdw_group_basic_table
  GROUP BY c7
  HAVING SUM(c2) <> 55
  ORDER BY c7;
 count(c3) | sum(c4) | c7  
-----------+---------+-----
         2 |     7.7 | bbb
         1 |     3.3 | ccc
(2 rows)

SELECT c6, COUNT(c1), SUM(c2), AVG(c3), MIN(c4), MAX(c5)
  FROM fdw_group_basic_table
  GROUP BY c6;
 c6 | count | sum | avg | min | max  
----+-------+-----+-----+-----+------
  1 |     2 |  55 | 277 | 1.1 | 4.44
  2 |     2 |  77 | 388 | 2.2 | 5.55
  3 |     1 |  33 | 333 | 3.3 | 3.33
(3 rows)

SELECT c7, COUNT(c1), SUM(c2), AVG(c3), MIN(c4), MAX(c5)
  FROM fdw_group_basic_table
  WHERE c1 <= 3
  GROUP BY c7
  ORDER BY c7;
 c7  | count | sum | avg | min | max  
-----+-------+-----+-----+-----+------
 aaa |     1 |  11 | 111 | 1.1 | 1.11
 bbb |     1 |  22 | 222 | 2.2 | 2.22
 ccc |     1 |  33 | 333 | 3.3 | 3.33
(3 rows)

-- Test teardown: DDL of the PostgreSQL
DROP FOREIGN TABLE fdw_group_basic_table;
-- Test teardown: DDL of the Tsurugi
SELECT tg_execute_ddl('DROP TABLE fdw_group_basic_table', 'tsurugidb');
 tg_execute_ddl 
----------------
 DROP TABLE
(1 row)

/* Test case: happy path - JOIN related testing */
-- Test setup: DDL of the Tsurugi
SELECT tg_execute_ddl('
  CREATE TABLE fdw_join_basic_table_1 (
    c1 INTEGER PRIMARY KEY,
    c2 INTEGER,
    c3 BIGINT,
    c4 REAL,
    c5 DOUBLE PRECISION,
    c6 CHAR(10),
    c7 VARCHAR(26)
  )
', 'tsurugidb');
 tg_execute_ddl 
----------------
 CREATE TABLE
(1 row)

SELECT tg_execute_ddl('
  CREATE TABLE fdw_join_basic_table_2 (
    c1 INTEGER PRIMARY KEY,
    c2 INTEGER,
    c3 BIGINT,
    c4 REAL,
    c5 DOUBLE PRECISION,
    c6 CHAR(10),
    c7 VARCHAR(26)
  )
', 'tsurugidb');
 tg_execute_ddl 
----------------
 CREATE TABLE
(1 row)

-- Test setup: DDL of the PostgreSQL
CREATE FOREIGN TABLE fdw_join_basic_table_1 (
  c1 integer,
  c2 integer,
  c3 bigint,
  c4 real,
  c5 double precision,
  c6 char(10),
  c7 varchar(26)
) SERVER tsurugidb;
CREATE FOREIGN TABLE fdw_join_basic_table_2 (
  c1 integer,
  c2 integer,
  c3 bigint,
  c4 real,
  c5 double precision,
  c6 char(10),
  c7 varchar(26)
) SERVER tsurugidb;
-- Initialization of test data
INSERT INTO fdw_join_basic_table_1
  (c1, c2, c3, c4, c5, c6, c7)
  VALUES
    (1, 11, 111, 1.1, 1.11, 'one', 'first'),
    (2, 22, 222, 2.2, 2.22, 'two', 'second'),
    (3, 33, 333, 3.3, 3.33, 'three', 'third');
INSERT INTO fdw_join_basic_table_2
  (c1, c2, c3, c4, c5, c6, c7)
  VALUES
    (1, 11, 111, 1.1, 1.11, 'one', 'first'),
    (2, 22, 222, 2.2, 2.22, 'two', 'second'),
    (3, 33, 333, 3.3, 3.33, 'three', 'third'),
    (4, NULL, NULL, NULL, NULL, 'NULL', NULL),
    (5, 55, 555, 5.5, 5.55, 'five', 'fifth');
-- TG JOIN - tsurugi-issue#863
SELECT *
  FROM fdw_join_basic_table_1 a
  INNER JOIN fdw_join_basic_table_2 b ON a.c1 = b.c1
  WHERE b.c1 > 1
  ORDER BY a.c1;
 c1 | c2 | c3  | c4  |  c5  |     c6     |   c7   | c1 | c2 | c3  | c4  |  c5  |     c6     |   c7   
----+----+-----+-----+------+------------+--------+----+----+-----+-----+------+------------+--------
  2 | 22 | 222 | 2.2 | 2.22 | two        | second |  2 | 22 | 222 | 2.2 | 2.22 | two        | second
  3 | 33 | 333 | 3.3 | 3.33 | three      | third  |  3 | 33 | 333 | 3.3 | 3.33 | three      | third
(2 rows)

SELECT *
  FROM fdw_join_basic_table_1 a
  INNER JOIN fdw_join_basic_table_2 b ON a.c1 = b.c1
  WHERE b.c1 > 3
  ORDER BY a.c1;
 c1 | c2 | c3 | c4 | c5 | c6 | c7 | c1 | c2 | c3 | c4 | c5 | c6 | c7 
----+----+----+----+----+----+----+----+----+----+----+----+----+----
(0 rows)

SELECT a.c1, a.c2, b.c2, b.c7
  FROM fdw_join_basic_table_1 a
  INNER JOIN fdw_join_basic_table_2 b USING (c1)
  ORDER BY b.c4 DESC;
 c1 | c2 | c2 |   c7   
----+----+----+--------
  3 | 33 | 33 | third
  2 | 22 | 22 | second
  1 | 11 | 11 | first
(3 rows)

SELECT *
  FROM fdw_join_basic_table_1 AS a
  JOIN fdw_join_basic_table_2 AS b ON a.c4 = b.c4
  JOIN fdw_join_basic_table_1 AS c ON b.c4 = c.c4
  WHERE a.c2 = 22;
 c1 | c2 | c3  | c4  |  c5  |     c6     |   c7   | c1 | c2 | c3  | c4  |  c5  |     c6     |   c7   | c1 | c2 | c3  | c4  |  c5  |     c6     |   c7   
----+----+-----+-----+------+------------+--------+----+----+-----+-----+------+------------+--------+----+----+-----+-----+------+------------+--------
  2 | 22 | 222 | 2.2 | 2.22 | two        | second |  2 | 22 | 222 | 2.2 | 2.22 | two        | second |  2 | 22 | 222 | 2.2 | 2.22 | two        | second
(1 row)

SELECT *
  FROM fdw_join_basic_table_1 AS a
  JOIN fdw_join_basic_table_2 AS b ON a.c4 = b.c4
  JOIN fdw_join_basic_table_1 AS c ON b.c4 = c.c4
  WHERE a.c2 = 44;
 c1 | c2 | c3 | c4 | c5 | c6 | c7 | c1 | c2 | c3 | c4 | c5 | c6 | c7 | c1 | c2 | c3 | c4 | c5 | c6 | c7 
----+----+----+----+----+----+----+----+----+----+----+----+----+----+----+----+----+----+----+----+----
(0 rows)

SELECT *
  FROM  fdw_join_basic_table_1 AS a
  CROSS JOIN fdw_join_basic_table_2 AS b
  ORDER BY b.c1;
 c1 | c2 | c3  | c4  |  c5  |     c6     |   c7   | c1 | c2 | c3  | c4  |  c5  |     c6     |   c7   
----+----+-----+-----+------+------------+--------+----+----+-----+-----+------+------------+--------
  1 | 11 | 111 | 1.1 | 1.11 | one        | first  |  1 | 11 | 111 | 1.1 | 1.11 | one        | first
  2 | 22 | 222 | 2.2 | 2.22 | two        | second |  1 | 11 | 111 | 1.1 | 1.11 | one        | first
  3 | 33 | 333 | 3.3 | 3.33 | three      | third  |  1 | 11 | 111 | 1.1 | 1.11 | one        | first
  1 | 11 | 111 | 1.1 | 1.11 | one        | first  |  2 | 22 | 222 | 2.2 | 2.22 | two        | second
  2 | 22 | 222 | 2.2 | 2.22 | two        | second |  2 | 22 | 222 | 2.2 | 2.22 | two        | second
  3 | 33 | 333 | 3.3 | 3.33 | three      | third  |  2 | 22 | 222 | 2.2 | 2.22 | two        | second
  1 | 11 | 111 | 1.1 | 1.11 | one        | first  |  3 | 33 | 333 | 3.3 | 3.33 | three      | third
  2 | 22 | 222 | 2.2 | 2.22 | two        | second |  3 | 33 | 333 | 3.3 | 3.33 | three      | third
  3 | 33 | 333 | 3.3 | 3.33 | three      | third  |  3 | 33 | 333 | 3.3 | 3.33 | three      | third
  1 | 11 | 111 | 1.1 | 1.11 | one        | first  |  4 |    |     |     |      | NULL       | 
  2 | 22 | 222 | 2.2 | 2.22 | two        | second |  4 |    |     |     |      | NULL       | 
  3 | 33 | 333 | 3.3 | 3.33 | three      | third  |  4 |    |     |     |      | NULL       | 
  1 | 11 | 111 | 1.1 | 1.11 | one        | first  |  5 | 55 | 555 | 5.5 | 5.55 | five       | fifth
  2 | 22 | 222 | 2.2 | 2.22 | two        | second |  5 | 55 | 555 | 5.5 | 5.55 | five       | fifth
  3 | 33 | 333 | 3.3 | 3.33 | three      | third  |  5 | 55 | 555 | 5.5 | 5.55 | five       | fifth
(15 rows)

SELECT *
  FROM fdw_join_basic_table_1 AS a
  JOIN fdw_join_basic_table_1 AS b ON a.c3 = b.c3
  ORDER BY a.c3;
 c1 | c2 | c3  | c4  |  c5  |     c6     |   c7   | c1 | c2 | c3  | c4  |  c5  |     c6     |   c7   
----+----+-----+-----+------+------------+--------+----+----+-----+-----+------+------------+--------
  1 | 11 | 111 | 1.1 | 1.11 | one        | first  |  1 | 11 | 111 | 1.1 | 1.11 | one        | first
  2 | 22 | 222 | 2.2 | 2.22 | two        | second |  2 | 22 | 222 | 2.2 | 2.22 | two        | second
  3 | 33 | 333 | 3.3 | 3.33 | three      | third  |  3 | 33 | 333 | 3.3 | 3.33 | three      | third
(3 rows)

-- Test teardown: DDL of the PostgreSQL
DROP FOREIGN TABLE fdw_join_basic_table_1;
DROP FOREIGN TABLE fdw_join_basic_table_2;
-- Test teardown: DDL of the Tsurugi
SELECT tg_execute_ddl('DROP TABLE fdw_join_basic_table_1', 'tsurugidb');
 tg_execute_ddl 
----------------
 DROP TABLE
(1 row)

SELECT tg_execute_ddl('DROP TABLE fdw_join_basic_table_2', 'tsurugidb');
 tg_execute_ddl 
----------------
 DROP TABLE
(1 row)

/* Test case: happy path - Supported SELECT statement patterns */
-- Test setup: DDL of the Tsurugi
SELECT tg_execute_ddl('
  CREATE TABLE fdw_select_variation_table_1 (
    id INTEGER PRIMARY KEY,
    name VARCHAR(100) NOT NULL,
    value NUMERIC(10,2) NOT NULL,
    ref_id INT,
    manager_id INT
  )
', 'tsurugidb');
 tg_execute_ddl 
----------------
 CREATE TABLE
(1 row)

SELECT tg_execute_ddl('
  CREATE TABLE fdw_select_variation_table_2 (
    id INTEGER PRIMARY KEY,
    name VARCHAR(100) NOT NULL
  )
', 'tsurugidb');
 tg_execute_ddl 
----------------
 CREATE TABLE
(1 row)

-- Test setup: DDL of the PostgreSQL
CREATE FOREIGN TABLE fdw_select_variation_table_1 (
  id integer,
  name text,
  value numeric,
  ref_id integer,
  manager_id integer
) SERVER tsurugidb;
CREATE FOREIGN TABLE fdw_select_variation_table_2 (
  id integer,
  name varchar(100)
) SERVER tsurugidb;
-- Initialization of test data
INSERT INTO fdw_select_variation_table_1
  (id, name, value, ref_id, manager_id)
  VALUES
    (1000, 'name-1000', 100000, NULL, NULL),
    (1001, 'name-1001', 60000, 1, 1002),
    (1002, 'name-1002', 75000, 1, 1000),
    (1003, 'name-1003', 50000, 2, 1005),
    (1004, 'name-1004', 55000, 3, 1005),
    (1005, 'name-1005', 80000, 3, 1000);
INSERT INTO fdw_select_variation_table_2
  (id, name)
  VALUES
    (1, 'dep-1'),
    (2, 'dep-2'),
    (3, 'dep-3'),
    (4, 'dep-4');
-- SELECT ALL
SELECT ALL id, name, value
  FROM fdw_select_variation_table_1
  ORDER BY value, id;
  id  |   name    |   value   
------+-----------+-----------
 1003 | name-1003 |  50000.00
 1004 | name-1004 |  55000.00
 1001 | name-1001 |  60000.00
 1002 | name-1002 |  75000.00
 1005 | name-1005 |  80000.00
 1000 | name-1000 | 100000.00
(6 rows)

-- SELECT DISTINCT
SELECT DISTINCT (ref_id) ref_id
  FROM fdw_select_variation_table_1
  ORDER BY ref_id;
 ref_id 
--------
       
      1
      2
      3
(4 rows)

SELECT DISTINCT (t2.id) id, t2.name
  FROM fdw_select_variation_table_1 t1
  JOIN fdw_select_variation_table_2 t2 ON (t1.ref_id = t2.id)
  ORDER BY t2.id;
 id | name  
----+-------
  1 | dep-1
  2 | dep-2
  3 | dep-3
(3 rows)

-- AS
SELECT id AS user_id, name AS user_name FROM fdw_select_variation_table_1;
 user_id | user_name 
---------+-----------
    1000 | name-1000
    1001 | name-1001
    1002 | name-1002
    1003 | name-1003
    1004 | name-1004
    1005 | name-1005
(6 rows)

-- [INNER] JOIN
SELECT t1.id, t1.name, t2.name
  FROM fdw_select_variation_table_1 t1
  JOIN fdw_select_variation_table_2 t2 ON t1.ref_id = t2.id
  ORDER BY t1.id;
  id  |   name    | name  
------+-----------+-------
 1001 | name-1001 | dep-1
 1002 | name-1002 | dep-1
 1003 | name-1003 | dep-2
 1004 | name-1004 | dep-3
 1005 | name-1005 | dep-3
(5 rows)

SELECT t1.id, t1.name, t2.name
  FROM fdw_select_variation_table_1 t1
  INNER JOIN fdw_select_variation_table_2 t2 ON t1.ref_id = t2.id
  ORDER BY t1.id;
  id  |   name    | name  
------+-----------+-------
 1001 | name-1001 | dep-1
 1002 | name-1002 | dep-1
 1003 | name-1003 | dep-2
 1004 | name-1004 | dep-3
 1005 | name-1005 | dep-3
(5 rows)

-- LEFT [OUTER] JOIN
SELECT t1.id, t1.name, t2.name
  FROM fdw_select_variation_table_1 t1
  LEFT OUTER JOIN fdw_select_variation_table_2 t2 ON t1.ref_id = t2.id
  ORDER BY t1.id;
  id  |   name    | name  
------+-----------+-------
 1000 | name-1000 | 
 1001 | name-1001 | dep-1
 1002 | name-1002 | dep-1
 1003 | name-1003 | dep-2
 1004 | name-1004 | dep-3
 1005 | name-1005 | dep-3
(6 rows)

SELECT t1.id, t1.name, t2.name
  FROM fdw_select_variation_table_1 t1
  LEFT JOIN fdw_select_variation_table_2 t2 ON t1.ref_id = t2.id
  ORDER BY t1.id;
  id  |   name    | name  
------+-----------+-------
 1000 | name-1000 | 
 1001 | name-1001 | dep-1
 1002 | name-1002 | dep-1
 1003 | name-1003 | dep-2
 1004 | name-1004 | dep-3
 1005 | name-1005 | dep-3
(6 rows)

-- RIGHT [OUTER] JOIN
SELECT t1.id, t1.name, t2.name
  FROM fdw_select_variation_table_1 t1
  RIGHT OUTER JOIN fdw_select_variation_table_2 t2 ON t1.ref_id = t2.id
  ORDER BY t2.id;
  id  |   name    | name  
------+-----------+-------
 1001 | name-1001 | dep-1
 1002 | name-1002 | dep-1
 1003 | name-1003 | dep-2
 1004 | name-1004 | dep-3
 1005 | name-1005 | dep-3
      |           | dep-4
(6 rows)

SELECT t1.id, t1.name, t2.name
  FROM fdw_select_variation_table_1 t1
  RIGHT JOIN fdw_select_variation_table_2 t2 ON t1.ref_id = t2.id
  ORDER BY t2.id;
  id  |   name    | name  
------+-----------+-------
 1001 | name-1001 | dep-1
 1002 | name-1002 | dep-1
 1003 | name-1003 | dep-2
 1004 | name-1004 | dep-3
 1005 | name-1005 | dep-3
      |           | dep-4
(6 rows)

-- FULL [OUTER] JOIN
SELECT t1.id, t1.name, t2.name
  FROM fdw_select_variation_table_1 t1
  FULL OUTER JOIN fdw_select_variation_table_2 t2 ON t1.ref_id = t2.id
  ORDER BY t1.id, t2.id;
  id  |   name    | name  
------+-----------+-------
      |           | dep-4
 1000 | name-1000 | 
 1001 | name-1001 | dep-1
 1002 | name-1002 | dep-1
 1003 | name-1003 | dep-2
 1004 | name-1004 | dep-3
 1005 | name-1005 | dep-3
(7 rows)

SELECT t1.id, t1.name, t2.name
  FROM fdw_select_variation_table_1 t1
  FULL JOIN fdw_select_variation_table_2 t2 ON t1.ref_id = t2.id
  ORDER BY t1.id, t2.id;
  id  |   name    | name  
------+-----------+-------
      |           | dep-4
 1000 | name-1000 | 
 1001 | name-1001 | dep-1
 1002 | name-1002 | dep-1
 1003 | name-1003 | dep-2
 1004 | name-1004 | dep-3
 1005 | name-1005 | dep-3
(7 rows)

-- CROSS JOIN
SELECT t1.id, t1.name, t2.name
  FROM fdw_select_variation_table_1 t1
  CROSS JOIN fdw_select_variation_table_2 t2;
  id  |   name    | name  
------+-----------+-------
 1000 | name-1000 | dep-1
 1000 | name-1000 | dep-2
 1000 | name-1000 | dep-3
 1000 | name-1000 | dep-4
 1001 | name-1001 | dep-1
 1001 | name-1001 | dep-2
 1001 | name-1001 | dep-3
 1001 | name-1001 | dep-4
 1002 | name-1002 | dep-1
 1002 | name-1002 | dep-2
 1002 | name-1002 | dep-3
 1002 | name-1002 | dep-4
 1003 | name-1003 | dep-1
 1003 | name-1003 | dep-2
 1003 | name-1003 | dep-3
 1003 | name-1003 | dep-4
 1004 | name-1004 | dep-1
 1004 | name-1004 | dep-2
 1004 | name-1004 | dep-3
 1004 | name-1004 | dep-4
 1005 | name-1005 | dep-1
 1005 | name-1005 | dep-2
 1005 | name-1005 | dep-3
 1005 | name-1005 | dep-4
(24 rows)

-- BETWEEN ... AND
SELECT id, name, value
  FROM fdw_select_variation_table_1
  WHERE value BETWEEN 60000 AND 80000;
  id  |   name    |  value   
------+-----------+----------
 1001 | name-1001 | 60000.00
 1002 | name-1002 | 75000.00
 1005 | name-1005 | 80000.00
(3 rows)

-- IN
SELECT id, name, manager_id
  FROM fdw_select_variation_table_1
  WHERE manager_id IN (1000);
  id  |   name    | manager_id 
------+-----------+------------
 1002 | name-1002 |       1000
 1005 | name-1005 |       1000
(2 rows)

SELECT id, name, manager_id
  FROM fdw_select_variation_table_1
  WHERE manager_id IN (1000, 1005);
  id  |   name    | manager_id 
------+-----------+------------
 1002 | name-1002 |       1000
 1003 | name-1003 |       1005
 1004 | name-1004 |       1005
 1005 | name-1005 |       1000
(4 rows)

-- LIKE
SELECT id, name, value
  FROM fdw_select_variation_table_1
  WHERE name LIKE 'name-%';
  id  |   name    |   value   
------+-----------+-----------
 1000 | name-1000 | 100000.00
 1001 | name-1001 |  60000.00
 1002 | name-1002 |  75000.00
 1003 | name-1003 |  50000.00
 1004 | name-1004 |  55000.00
 1005 | name-1005 |  80000.00
(6 rows)

-- ORDER BY
SELECT * FROM fdw_select_variation_table_1 ORDER BY value;
  id  |   name    |   value   | ref_id | manager_id 
------+-----------+-----------+--------+------------
 1003 | name-1003 |  50000.00 |      2 |       1005
 1004 | name-1004 |  55000.00 |      3 |       1005
 1001 | name-1001 |  60000.00 |      1 |       1002
 1002 | name-1002 |  75000.00 |      1 |       1000
 1005 | name-1005 |  80000.00 |      3 |       1000
 1000 | name-1000 | 100000.00 |        |           
(6 rows)

-- ORDER BY ASC
SELECT * FROM fdw_select_variation_table_1 ORDER BY value ASC;
  id  |   name    |   value   | ref_id | manager_id 
------+-----------+-----------+--------+------------
 1003 | name-1003 |  50000.00 |      2 |       1005
 1004 | name-1004 |  55000.00 |      3 |       1005
 1001 | name-1001 |  60000.00 |      1 |       1002
 1002 | name-1002 |  75000.00 |      1 |       1000
 1005 | name-1005 |  80000.00 |      3 |       1000
 1000 | name-1000 | 100000.00 |        |           
(6 rows)

-- ORDER BY DESC
SELECT * FROM fdw_select_variation_table_1 ORDER BY value DESC;
  id  |   name    |   value   | ref_id | manager_id 
------+-----------+-----------+--------+------------
 1000 | name-1000 | 100000.00 |        |           
 1005 | name-1005 |  80000.00 |      3 |       1000
 1002 | name-1002 |  75000.00 |      1 |       1000
 1001 | name-1001 |  60000.00 |      1 |       1002
 1004 | name-1004 |  55000.00 |      3 |       1005
 1003 | name-1003 |  50000.00 |      2 |       1005
(6 rows)

-- ORDER BY + NULLS FIRST
SELECT * FROM fdw_select_variation_table_1 ORDER BY ref_id NULLS FIRST;
  id  |   name    |   value   | ref_id | manager_id 
------+-----------+-----------+--------+------------
 1000 | name-1000 | 100000.00 |        |           
 1001 | name-1001 |  60000.00 |      1 |       1002
 1002 | name-1002 |  75000.00 |      1 |       1000
 1003 | name-1003 |  50000.00 |      2 |       1005
 1004 | name-1004 |  55000.00 |      3 |       1005
 1005 | name-1005 |  80000.00 |      3 |       1000
(6 rows)

-- ORDER BY + NULLS LAST --- Tsurugi specifications
SELECT * FROM fdw_select_variation_table_1 ORDER BY ref_id NULLS LAST;
  id  |   name    |   value   | ref_id | manager_id 
------+-----------+-----------+--------+------------
 1000 | name-1000 | 100000.00 |        |           
 1001 | name-1001 |  60000.00 |      1 |       1002
 1002 | name-1002 |  75000.00 |      1 |       1000
 1003 | name-1003 |  50000.00 |      2 |       1005
 1004 | name-1004 |  55000.00 |      3 |       1005
 1005 | name-1005 |  80000.00 |      3 |       1000
(6 rows)

-- GROUP BY
SELECT ref_id, COUNT(*), SUM(value)
  FROM fdw_select_variation_table_1
  GROUP BY ref_id
  ORDER BY ref_id;
 ref_id | count |    sum    
--------+-------+-----------
        |     1 | 100000.00
      1 |     2 | 135000.00
      2 |     1 |  50000.00
      3 |     2 | 135000.00
(4 rows)

-- HAVING
SELECT ref_id, COUNT(*), SUM(value)
  FROM fdw_select_variation_table_1
  GROUP BY ref_id
  HAVING COUNT(*) >= 2;
 ref_id | count |    sum    
--------+-------+-----------
      1 |     2 | 135000.00
      3 |     2 | 135000.00
(2 rows)

-- LIMIT
SELECT * FROM fdw_select_variation_table_1 LIMIT 2;
  id  |   name    |   value   | ref_id | manager_id 
------+-----------+-----------+--------+------------
 1000 | name-1000 | 100000.00 |        |           
 1001 | name-1001 |  60000.00 |      1 |       1002
(2 rows)

-- Test teardown: DDL of the PostgreSQL
DROP FOREIGN TABLE fdw_select_variation_table_1;
DROP FOREIGN TABLE fdw_select_variation_table_2;
-- Test teardown: DDL of the Tsurugi
SELECT tg_execute_ddl('DROP TABLE fdw_select_variation_table_1', 'tsurugidb');
 tg_execute_ddl 
----------------
 DROP TABLE
(1 row)

SELECT tg_execute_ddl('DROP TABLE fdw_select_variation_table_2', 'tsurugidb');
 tg_execute_ddl 
----------------
 DROP TABLE
(1 row)

/* Test case: happy path - Supported INSERT statement patterns */
-- Test setup: DDL of the Tsurugi
SELECT tg_execute_ddl('
  CREATE TABLE fdw_ins_variation_table (
    c_int INTEGER DEFAULT 11,
    c_big BIGINT DEFAULT 22,
    c_dec DECIMAL DEFAULT 33,
    c_rel REAL DEFAULT 44.4,
    c_dbl DOUBLE PRECISION DEFAULT 55.5,
    c_chr CHAR DEFAULT ''a'',
    c_vchr VARCHAR DEFAULT ''default'',
    c_date DATE DEFAULT DATE ''2025-01-01'',
    c_time TIME DEFAULT TIME ''01:00:00'',
    c_tstmp TIMESTAMP DEFAULT TIMESTAMP ''2025-03-03 03:03:03''
  )
', 'tsurugidb');
 tg_execute_ddl 
----------------
 CREATE TABLE
(1 row)

-- Test setup: DDL of the PostgreSQL
CREATE FOREIGN TABLE fdw_ins_variation_table (
  c_int integer,
  c_big bigint,
  c_dec decimal,
  c_rel real,
  c_dbl double precision,
  c_chr char,
  c_vchr varchar,
  c_date date,
  c_time time,
  c_tstmp timestamp
) SERVER tsurugidb;
-- DEFAULT VALUES
INSERT INTO fdw_ins_variation_table DEFAULT VALUES;
SELECT * FROM fdw_ins_variation_table;
 c_int | c_big | c_dec | c_rel | c_dbl | c_chr | c_vchr  |   c_date   |  c_time  |       c_tstmp       
-------+-------+-------+-------+-------+-------+---------+------------+----------+---------------------
    11 |    22 |    33 |  44.4 |  55.5 | a     | default | 2025-01-01 | 01:00:00 | 2025-03-03 03:03:03
(1 row)

-- INSERT ... VALUES (...), ...
INSERT INTO fdw_ins_variation_table
  (c_int, c_vchr, c_big, c_chr, c_dec)
  VALUES (4, 'key4', 400, 'b', 34), (5, 'key5', 500, 'c', 35);
SELECT * FROM fdw_ins_variation_table;
 c_int | c_big | c_dec | c_rel | c_dbl | c_chr | c_vchr  |   c_date   |  c_time  |       c_tstmp       
-------+-------+-------+-------+-------+-------+---------+------------+----------+---------------------
    11 |    22 |    33 |  44.4 |  55.5 | a     | default | 2025-01-01 | 01:00:00 | 2025-03-03 03:03:03
     4 |   400 |    34 |  44.4 |  55.5 | b     | key4    | 2025-01-01 | 01:00:00 | 2025-03-03 03:03:03
     5 |   500 |    35 |  44.4 |  55.5 | c     | key5    | 2025-01-01 | 01:00:00 | 2025-03-03 03:03:03
(3 rows)

-- Test teardown: DDL of the PostgreSQL
DROP FOREIGN TABLE fdw_ins_variation_table;
-- Test teardown: DDL of the Tsurugi
SELECT tg_execute_ddl('DROP TABLE fdw_ins_variation_table', 'tsurugidb');
 tg_execute_ddl 
----------------
 DROP TABLE
(1 row)

/* Test case: happy path - Supported UPDATE statement patterns */
-- Test setup: DDL of the Tsurugi
SELECT tg_execute_ddl('
  CREATE TABLE fdw_upd_variation_table (
    c_int INTEGER,
    c_big BIGINT,
    c_dec DECIMAL,
    c_rel REAL,
    c_dbl DOUBLE PRECISION,
    c_chr CHAR,
    c_vchr VARCHAR,
    c_date DATE,
    c_time TIME,
    c_tstmp TIMESTAMP,
    c_tstmptz TIMESTAMP WITH TIME ZONE
  )
', 'tsurugidb');
 tg_execute_ddl 
----------------
 CREATE TABLE
(1 row)

-- Test setup: DDL of the PostgreSQL
CREATE FOREIGN TABLE fdw_upd_variation_table (
  c_int integer,
  c_big bigint,
  c_dec decimal,
  c_rel real,
  c_dbl double precision,
  c_chr char,
  c_vchr varchar,
  c_date date,
  c_time time,
  c_tstmp timestamp,
  c_tstmptz timestamp with time zone
) SERVER tsurugidb;
-- Initialization of test data
INSERT INTO fdw_upd_variation_table
  VALUES
  (1, 11, 12, 13.1, 14.2, 'a', 'val_1', '2025-01-01', '01:00:00',
   '2025-01-01 01:00:00', '2025-01-01 01:00:00+09'),
  (5, 51, 52, 53.1, 54.2, 'e', 'val_5', '2025-05-05', '05:00:00',
   '2025-05-05 05:00:00', '2025-05-05 05:00:00+09'),
  (10, 101, 102, 103.1, 104.2, 'j', 'val_10', '2025-10-10', '09:00:00',
   '2025-10-10 10:00:00', '2025-10-10 10:00:00+09'),
  (20, 201, 202, 203.1, 204.2, 't', 'val_20', '2025-08-20', '20:00:00',
   '2025-08-20 20:00:00', '2025-08-20 20:00:00+09');
SELECT * FROM fdw_upd_variation_table ORDER BY c_int;
 c_int | c_big | c_dec | c_rel | c_dbl | c_chr | c_vchr |   c_date   |  c_time  |       c_tstmp       |       c_tstmptz        
-------+-------+-------+-------+-------+-------+--------+------------+----------+---------------------+------------------------
     1 |    11 |    12 |  13.1 |  14.2 | a     | val_1  | 2025-01-01 | 01:00:00 | 2025-01-01 01:00:00 | 2025-01-01 01:00:00+09
     5 |    51 |    52 |  53.1 |  54.2 | e     | val_5  | 2025-05-05 | 05:00:00 | 2025-05-05 05:00:00 | 2025-05-05 05:00:00+09
    10 |   101 |   102 | 103.1 | 104.2 | j     | val_10 | 2025-10-10 | 09:00:00 | 2025-10-10 10:00:00 | 2025-10-10 10:00:00+09
    20 |   201 |   202 | 203.1 | 204.2 | t     | val_20 | 2025-08-20 | 20:00:00 | 2025-08-20 20:00:00 | 2025-08-20 20:00:00+09
(4 rows)

-- SET column_name (int) = value
UPDATE fdw_upd_variation_table SET c_int = 6 WHERE c_int = 1;
SELECT * FROM fdw_upd_variation_table ORDER BY c_int;
 c_int | c_big | c_dec | c_rel | c_dbl | c_chr | c_vchr |   c_date   |  c_time  |       c_tstmp       |       c_tstmptz        
-------+-------+-------+-------+-------+-------+--------+------------+----------+---------------------+------------------------
     5 |    51 |    52 |  53.1 |  54.2 | e     | val_5  | 2025-05-05 | 05:00:00 | 2025-05-05 05:00:00 | 2025-05-05 05:00:00+09
     6 |    11 |    12 |  13.1 |  14.2 | a     | val_1  | 2025-01-01 | 01:00:00 | 2025-01-01 01:00:00 | 2025-01-01 01:00:00+09
    10 |   101 |   102 | 103.1 | 104.2 | j     | val_10 | 2025-10-10 | 09:00:00 | 2025-10-10 10:00:00 | 2025-10-10 10:00:00+09
    20 |   201 |   202 | 203.1 | 204.2 | t     | val_20 | 2025-08-20 | 20:00:00 | 2025-08-20 20:00:00 | 2025-08-20 20:00:00+09
(4 rows)

-- SET column_name (bigint) = expression
UPDATE fdw_upd_variation_table
  SET c_int = 1, c_big = c_big + 101
  WHERE c_big = 11;
SELECT * FROM fdw_upd_variation_table ORDER BY c_big;
 c_int | c_big | c_dec | c_rel | c_dbl | c_chr | c_vchr |   c_date   |  c_time  |       c_tstmp       |       c_tstmptz        
-------+-------+-------+-------+-------+-------+--------+------------+----------+---------------------+------------------------
     5 |    51 |    52 |  53.1 |  54.2 | e     | val_5  | 2025-05-05 | 05:00:00 | 2025-05-05 05:00:00 | 2025-05-05 05:00:00+09
    10 |   101 |   102 | 103.1 | 104.2 | j     | val_10 | 2025-10-10 | 09:00:00 | 2025-10-10 10:00:00 | 2025-10-10 10:00:00+09
     1 |   112 |    12 |  13.1 |  14.2 | a     | val_1  | 2025-01-01 | 01:00:00 | 2025-01-01 01:00:00 | 2025-01-01 01:00:00+09
    20 |   201 |   202 | 203.1 | 204.2 | t     | val_20 | 2025-08-20 | 20:00:00 | 2025-08-20 20:00:00 | 2025-08-20 20:00:00+09
(4 rows)

-- SET column_name (decimal) = expression
UPDATE fdw_upd_variation_table
  SET c_big = c_big - 101, c_dec = c_dec - 1
  WHERE c_dec = 12;
SELECT * FROM fdw_upd_variation_table ORDER BY c_dec DESC;
 c_int | c_big | c_dec | c_rel | c_dbl | c_chr | c_vchr |   c_date   |  c_time  |       c_tstmp       |       c_tstmptz        
-------+-------+-------+-------+-------+-------+--------+------------+----------+---------------------+------------------------
    20 |   201 |   202 | 203.1 | 204.2 | t     | val_20 | 2025-08-20 | 20:00:00 | 2025-08-20 20:00:00 | 2025-08-20 20:00:00+09
    10 |   101 |   102 | 103.1 | 104.2 | j     | val_10 | 2025-10-10 | 09:00:00 | 2025-10-10 10:00:00 | 2025-10-10 10:00:00+09
     5 |    51 |    52 |  53.1 |  54.2 | e     | val_5  | 2025-05-05 | 05:00:00 | 2025-05-05 05:00:00 | 2025-05-05 05:00:00+09
     1 |    11 |    11 |  13.1 |  14.2 | a     | val_1  | 2025-01-01 | 01:00:00 | 2025-01-01 01:00:00 | 2025-01-01 01:00:00+09
(4 rows)

-- SET column_name (real) = expression
UPDATE fdw_upd_variation_table
  SET c_dec = c_dec + 1, c_rel = c_rel * 10
  WHERE c_rel = 13.1::real;
SELECT * FROM fdw_upd_variation_table ORDER BY c_rel DESC;
 c_int | c_big | c_dec | c_rel | c_dbl | c_chr | c_vchr |   c_date   |  c_time  |       c_tstmp       |       c_tstmptz        
-------+-------+-------+-------+-------+-------+--------+------------+----------+---------------------+------------------------
    20 |   201 |   202 | 203.1 | 204.2 | t     | val_20 | 2025-08-20 | 20:00:00 | 2025-08-20 20:00:00 | 2025-08-20 20:00:00+09
     1 |    11 |    12 |   131 |  14.2 | a     | val_1  | 2025-01-01 | 01:00:00 | 2025-01-01 01:00:00 | 2025-01-01 01:00:00+09
    10 |   101 |   102 | 103.1 | 104.2 | j     | val_10 | 2025-10-10 | 09:00:00 | 2025-10-10 10:00:00 | 2025-10-10 10:00:00+09
     5 |    51 |    52 |  53.1 |  54.2 | e     | val_5  | 2025-05-05 | 05:00:00 | 2025-05-05 05:00:00 | 2025-05-05 05:00:00+09
(4 rows)

-- SET column_name (double precision) = expression
UPDATE fdw_upd_variation_table
  SET c_rel = c_rel / 10, c_dbl = c_dbl * 10 / 2
  WHERE c_dbl = CAST(14.2 AS double precision);
SELECT * FROM fdw_upd_variation_table ORDER BY c_dbl DESC;
 c_int | c_big | c_dec | c_rel | c_dbl | c_chr | c_vchr |   c_date   |  c_time  |       c_tstmp       |       c_tstmptz        
-------+-------+-------+-------+-------+-------+--------+------------+----------+---------------------+------------------------
    20 |   201 |   202 | 203.1 | 204.2 | t     | val_20 | 2025-08-20 | 20:00:00 | 2025-08-20 20:00:00 | 2025-08-20 20:00:00+09
    10 |   101 |   102 | 103.1 | 104.2 | j     | val_10 | 2025-10-10 | 09:00:00 | 2025-10-10 10:00:00 | 2025-10-10 10:00:00+09
     1 |    11 |    12 |  13.1 |    71 | a     | val_1  | 2025-01-01 | 01:00:00 | 2025-01-01 01:00:00 | 2025-01-01 01:00:00+09
     5 |    51 |    52 |  53.1 |  54.2 | e     | val_5  | 2025-05-05 | 05:00:00 | 2025-05-05 05:00:00 | 2025-05-05 05:00:00+09
(4 rows)

-- SET column_name (char) = value
UPDATE fdw_upd_variation_table
  SET c_dbl = c_dbl * 2 / 10, c_chr = 'k' WHERE c_chr = 'a';
SELECT * FROM fdw_upd_variation_table ORDER BY c_chr;
 c_int | c_big | c_dec | c_rel | c_dbl | c_chr | c_vchr |   c_date   |  c_time  |       c_tstmp       |       c_tstmptz        
-------+-------+-------+-------+-------+-------+--------+------------+----------+---------------------+------------------------
     5 |    51 |    52 |  53.1 |  54.2 | e     | val_5  | 2025-05-05 | 05:00:00 | 2025-05-05 05:00:00 | 2025-05-05 05:00:00+09
    10 |   101 |   102 | 103.1 | 104.2 | j     | val_10 | 2025-10-10 | 09:00:00 | 2025-10-10 10:00:00 | 2025-10-10 10:00:00+09
     1 |    11 |    12 |  13.1 |  14.2 | k     | val_1  | 2025-01-01 | 01:00:00 | 2025-01-01 01:00:00 | 2025-01-01 01:00:00+09
    20 |   201 |   202 | 203.1 | 204.2 | t     | val_20 | 2025-08-20 | 20:00:00 | 2025-08-20 20:00:00 | 2025-08-20 20:00:00+09
(4 rows)

-- SET column_name (varchar) = expression
UPDATE fdw_upd_variation_table
  SET c_chr = 'a', c_vchr = c_vchr || '_updated'
  WHERE c_vchr = 'val_1';
SELECT * FROM fdw_upd_variation_table ORDER BY c_vchr;
 c_int | c_big | c_dec | c_rel | c_dbl | c_chr |    c_vchr     |   c_date   |  c_time  |       c_tstmp       |       c_tstmptz        
-------+-------+-------+-------+-------+-------+---------------+------------+----------+---------------------+------------------------
    10 |   101 |   102 | 103.1 | 104.2 | j     | val_10        | 2025-10-10 | 09:00:00 | 2025-10-10 10:00:00 | 2025-10-10 10:00:00+09
     1 |    11 |    12 |  13.1 |  14.2 | a     | val_1_updated | 2025-01-01 | 01:00:00 | 2025-01-01 01:00:00 | 2025-01-01 01:00:00+09
    20 |   201 |   202 | 203.1 | 204.2 | t     | val_20        | 2025-08-20 | 20:00:00 | 2025-08-20 20:00:00 | 2025-08-20 20:00:00+09
     5 |    51 |    52 |  53.1 |  54.2 | e     | val_5         | 2025-05-05 | 05:00:00 | 2025-05-05 05:00:00 | 2025-05-05 05:00:00+09
(4 rows)

-- SET column_name (date) = value
UPDATE fdw_upd_variation_table
  SET c_vchr = 'val_1', c_date = '2025-08-08'
  WHERE c_date = '2025-01-01'::date;
SELECT * FROM fdw_upd_variation_table ORDER BY c_date;
 c_int | c_big | c_dec | c_rel | c_dbl | c_chr | c_vchr |   c_date   |  c_time  |       c_tstmp       |       c_tstmptz        
-------+-------+-------+-------+-------+-------+--------+------------+----------+---------------------+------------------------
     5 |    51 |    52 |  53.1 |  54.2 | e     | val_5  | 2025-05-05 | 05:00:00 | 2025-05-05 05:00:00 | 2025-05-05 05:00:00+09
     1 |    11 |    12 |  13.1 |  14.2 | a     | val_1  | 2025-08-08 | 01:00:00 | 2025-01-01 01:00:00 | 2025-01-01 01:00:00+09
    20 |   201 |   202 | 203.1 | 204.2 | t     | val_20 | 2025-08-20 | 20:00:00 | 2025-08-20 20:00:00 | 2025-08-20 20:00:00+09
    10 |   101 |   102 | 103.1 | 104.2 | j     | val_10 | 2025-10-10 | 09:00:00 | 2025-10-10 10:00:00 | 2025-10-10 10:00:00+09
(4 rows)

-- SET column_name (time) = value
UPDATE fdw_upd_variation_table
  SET c_date = '2025-01-01', c_time = '12:00:00'
  WHERE c_time = '01:00:00'::time;
SELECT * FROM fdw_upd_variation_table ORDER BY c_time DESC;
 c_int | c_big | c_dec | c_rel | c_dbl | c_chr | c_vchr |   c_date   |  c_time  |       c_tstmp       |       c_tstmptz        
-------+-------+-------+-------+-------+-------+--------+------------+----------+---------------------+------------------------
    20 |   201 |   202 | 203.1 | 204.2 | t     | val_20 | 2025-08-20 | 20:00:00 | 2025-08-20 20:00:00 | 2025-08-20 20:00:00+09
     1 |    11 |    12 |  13.1 |  14.2 | a     | val_1  | 2025-01-01 | 12:00:00 | 2025-01-01 01:00:00 | 2025-01-01 01:00:00+09
    10 |   101 |   102 | 103.1 | 104.2 | j     | val_10 | 2025-10-10 | 09:00:00 | 2025-10-10 10:00:00 | 2025-10-10 10:00:00+09
     5 |    51 |    52 |  53.1 |  54.2 | e     | val_5  | 2025-05-05 | 05:00:00 | 2025-05-05 05:00:00 | 2025-05-05 05:00:00+09
(4 rows)

-- SET column_name (timestamp) = value
UPDATE fdw_upd_variation_table
  SET c_time = '01:00:00', c_tstmp = '2025-08-08 12:00:00'
  WHERE c_tstmp = '2025-01-01 01:00:00'::timestamp;
SELECT * FROM fdw_upd_variation_table ORDER BY c_tstmp;
 c_int | c_big | c_dec | c_rel | c_dbl | c_chr | c_vchr |   c_date   |  c_time  |       c_tstmp       |       c_tstmptz        
-------+-------+-------+-------+-------+-------+--------+------------+----------+---------------------+------------------------
     5 |    51 |    52 |  53.1 |  54.2 | e     | val_5  | 2025-05-05 | 05:00:00 | 2025-05-05 05:00:00 | 2025-05-05 05:00:00+09
     1 |    11 |    12 |  13.1 |  14.2 | a     | val_1  | 2025-01-01 | 01:00:00 | 2025-08-08 12:00:00 | 2025-01-01 01:00:00+09
    20 |   201 |   202 | 203.1 | 204.2 | t     | val_20 | 2025-08-20 | 20:00:00 | 2025-08-20 20:00:00 | 2025-08-20 20:00:00+09
    10 |   101 |   102 | 103.1 | 104.2 | j     | val_10 | 2025-10-10 | 09:00:00 | 2025-10-10 10:00:00 | 2025-10-10 10:00:00+09
(4 rows)

-- SET column_name (timestamp with time zone) = value
UPDATE fdw_upd_variation_table
  SET c_tstmp = '2025-01-01 01:00:00', c_tstmptz = '2025-08-08 12:00:00+09'
  WHERE c_tstmptz = '2025-01-01 01:00:00+09'::timestamp with time zone;
SELECT * FROM fdw_upd_variation_table ORDER BY c_tstmptz DESC;
 c_int | c_big | c_dec | c_rel | c_dbl | c_chr | c_vchr |   c_date   |  c_time  |       c_tstmp       |       c_tstmptz        
-------+-------+-------+-------+-------+-------+--------+------------+----------+---------------------+------------------------
    10 |   101 |   102 | 103.1 | 104.2 | j     | val_10 | 2025-10-10 | 09:00:00 | 2025-10-10 10:00:00 | 2025-10-10 10:00:00+09
    20 |   201 |   202 | 203.1 | 204.2 | t     | val_20 | 2025-08-20 | 20:00:00 | 2025-08-20 20:00:00 | 2025-08-20 20:00:00+09
     1 |    11 |    12 |  13.1 |  14.2 | a     | val_1  | 2025-01-01 | 01:00:00 | 2025-01-01 01:00:00 | 2025-08-08 12:00:00+09
     5 |    51 |    52 |  53.1 |  54.2 | e     | val_5  | 2025-05-05 | 05:00:00 | 2025-05-05 05:00:00 | 2025-05-05 05:00:00+09
(4 rows)

-- Test teardown: DDL of the PostgreSQL
DROP FOREIGN TABLE fdw_upd_variation_table;
-- Test teardown: DDL of the Tsurugi
SELECT tg_execute_ddl('DROP TABLE fdw_upd_variation_table', 'tsurugidb');
 tg_execute_ddl 
----------------
 DROP TABLE
(1 row)

/* Test case: happy path - Supported DELETE statement patterns */
-- Test setup: DDL of the Tsurugi
SELECT tg_execute_ddl('
  CREATE TABLE fdw_del_variation_table (
    id INT PRIMARY KEY,
    key_col VARCHAR(100),
    value_col INT
  )
', 'tsurugidb');
 tg_execute_ddl 
----------------
 CREATE TABLE
(1 row)

-- Test setup: DDL of the PostgreSQL
CREATE FOREIGN TABLE fdw_del_variation_table (
  id integer,
  key_col text,
  value_col integer
) SERVER tsurugidb;
-- Initialization of test data
INSERT INTO fdw_del_variation_table
  (id, key_col, value_col)
  VALUES
    (1, 'key1', 10),
    (2, 'key2', 20),
    (3, 'key3', 30),
    (4, 'key4', 40),
    (5, 'key5', 50),
    (6, 'key6', 60),
    (7, 'key7', 70),
    (8, 'key8', 80),
    (9, 'key9', 90),
    (10, 'key10', 100);
SELECT * FROM fdw_del_variation_table ORDER BY id;
 id | key_col | value_col 
----+---------+-----------
  1 | key1    |        10
  2 | key2    |        20
  3 | key3    |        30
  4 | key4    |        40
  5 | key5    |        50
  6 | key6    |        60
  7 | key7    |        70
  8 | key8    |        80
  9 | key9    |        90
 10 | key10   |       100
(10 rows)

-- Test
DELETE FROM fdw_del_variation_table WHERE id BETWEEN 3 AND 5;
SELECT * FROM fdw_del_variation_table;
 id | key_col | value_col 
----+---------+-----------
  1 | key1    |        10
  2 | key2    |        20
  6 | key6    |        60
  7 | key7    |        70
  8 | key8    |        80
  9 | key9    |        90
 10 | key10   |       100
(7 rows)

DELETE FROM fdw_del_variation_table WHERE value_col IN (10, 60);
SELECT * FROM fdw_del_variation_table;
 id | key_col | value_col 
----+---------+-----------
  2 | key2    |        20
  7 | key7    |        70
  8 | key8    |        80
  9 | key9    |        90
 10 | key10   |       100
(5 rows)

DELETE FROM fdw_del_variation_table WHERE key_col LIKE '%1%';
SELECT * FROM fdw_del_variation_table;
 id | key_col | value_col 
----+---------+-----------
  2 | key2    |        20
  7 | key7    |        70
  8 | key8    |        80
  9 | key9    |        90
(4 rows)

DELETE
  FROM fdw_del_variation_table
  WHERE (key_col <> 'key2') AND (value_col < 90);
SELECT * FROM fdw_del_variation_table;
 id | key_col | value_col 
----+---------+-----------
  2 | key2    |        20
  9 | key9    |        90
(2 rows)

DELETE FROM fdw_del_variation_table;
SELECT * FROM fdw_del_variation_table;
 id | key_col | value_col 
----+---------+-----------
(0 rows)

-- Test teardown: DDL of the PostgreSQL
DROP FOREIGN TABLE fdw_del_variation_table;
-- Test teardown: DDL of the Tsurugi
SELECT tg_execute_ddl('DROP TABLE fdw_del_variation_table', 'tsurugidb');
 tg_execute_ddl 
----------------
 DROP TABLE
(1 row)

/* Test teardown: PostgreSQL environment */
SET datestyle TO 'default';
SET timezone TO DEFAULT;
