/* Test setup: PostgreSQL environment */
SET datestyle TO ISO, YMD;
SET timezone TO 'Asia/Tokyo';
/* Test setup: PostgreSQL functions */
CREATE OR REPLACE FUNCTION drop_foreign_tables()
RETURNS text AS $$
DECLARE
  r RECORD;
BEGIN
  FOR r IN
    SELECT n.nspname, c.relname
    FROM pg_foreign_table ft
      JOIN pg_class c ON c.oid = ft.ftrelid
      JOIN pg_namespace n ON n.oid = c.relnamespace
  LOOP
    EXECUTE format('DROP FOREIGN TABLE %I.%I;', r.nspname, r.relname);
  END LOOP;
  RETURN 'DROP FOREIGN TABLE';
END;
$$ LANGUAGE plpgsql;
/* Test case: 3-1-1_4 */
-- Test setup: DDL of the Tsurugi
SELECT tg_execute_ddl('
  CREATE TABLE fdw_test_type_num (
    col_int INT,
    col_bigint BIGINT,
    col_real REAL,
    col_float FLOAT,
    col_double DOUBLE,
    col_double_precision DOUBLE PRECISION,
    col_decimal DECIMAL,
    col_decimal_p DECIMAL(2),
    col_decimal_ps DECIMAL(3, 2),
    col_decimal_max DECIMAL(*)
  )
', 'tsurugidb');
 tg_execute_ddl 
----------------
 CREATE TABLE
(1 row)

-- Test
IMPORT FOREIGN SCHEMA public FROM SERVER tsurugidb INTO public;
\det fdw_test_type_num
         List of foreign tables
 Schema |       Table       |  Server   
--------+-------------------+-----------
 public | fdw_test_type_num | tsurugidb
(1 row)

\d fdw_test_type_num
                        Foreign table "public.fdw_test_type_num"
        Column        |       Type       | Collation | Nullable | Default | FDW options 
----------------------+------------------+-----------+----------+---------+-------------
 col_int              | integer          |           |          |         | 
 col_bigint           | bigint           |           |          |         | 
 col_real             | real             |           |          |         | 
 col_float            | real             |           |          |         | 
 col_double           | double precision |           |          |         | 
 col_double_precision | double precision |           |          |         | 
 col_decimal          | numeric          |           |          |         | 
 col_decimal_p        | numeric          |           |          |         | 
 col_decimal_ps       | numeric          |           |          |         | 
 col_decimal_max      | numeric          |           |          |         | 
Server: tsurugidb

INSERT INTO fdw_test_type_num 
  (col_int, col_bigint, col_real, col_float, col_double, col_double_precision,
    col_decimal, col_decimal_p, col_decimal_ps, col_decimal_max)
  VALUES (1, 2, 3.33, 4.44, 5.55, 6.66, 77777, 88, 9.99, 1000);
SELECT * FROM fdw_test_type_num;
 col_int | col_bigint | col_real | col_float | col_double | col_double_precision | col_decimal | col_decimal_p | col_decimal_ps | col_decimal_max 
---------+------------+----------+-----------+------------+----------------------+-------------+---------------+----------------+-----------------
       1 |          2 |     3.33 |      4.44 |       5.55 |                 6.66 |       77777 |            88 |           9.99 |            1000
(1 row)

UPDATE fdw_test_type_num
  SET col_int = 2, col_bigint = 3, col_real = 4.567, col_float = 5.678, col_double = 6.78901,
      col_double_precision = 7.89012, col_decimal = 890, col_decimal_p = 90, col_decimal_ps = 1.23,
      col_decimal_max = 99999
  WHERE col_int = 1;
SELECT * FROM fdw_test_type_num;
 col_int | col_bigint | col_real | col_float | col_double | col_double_precision | col_decimal | col_decimal_p | col_decimal_ps | col_decimal_max 
---------+------------+----------+-----------+------------+----------------------+-------------+---------------+----------------+-----------------
       2 |          3 |    4.567 |     5.678 |    6.78901 |              7.89012 |         890 |            90 |           1.23 |           99999
(1 row)

DELETE FROM fdw_test_type_num WHERE col_double = 6.78901;
SELECT * FROM fdw_test_type_num;
 col_int | col_bigint | col_real | col_float | col_double | col_double_precision | col_decimal | col_decimal_p | col_decimal_ps | col_decimal_max 
---------+------------+----------+-----------+------------+----------------------+-------------+---------------+----------------+-----------------
(0 rows)

-- Test teardown: DDL of the PostgreSQL
SELECT drop_foreign_tables();
 drop_foreign_tables 
---------------------
 DROP FOREIGN TABLE
(1 row)

-- Test teardown: DDL of the Tsurugi
SELECT tg_execute_ddl('DROP TABLE fdw_test_type_num', 'tsurugidb');
 tg_execute_ddl 
----------------
 DROP TABLE
(1 row)

/* Test case: 3-2-1_4 */
-- Test setup: DDL of the Tsurugi
SELECT tg_execute_ddl('
  CREATE TABLE fdw_test_type_str (
    col_char CHAR,
    col_char_l CHAR(64),
    col_character CHARACTER,
    col_character_l CHARACTER(64),
    col_varchar VARCHAR,
    col_varchar_l VARCHAR(64),
    col_char_varying CHAR VARYING,
    col_char_varying_l CHAR VARYING(64),
    col_character_varying CHARACTER VARYING,
    col_character_varying_l CHARACTER VARYING(64)
  )
', 'tsurugidb');
 tg_execute_ddl 
----------------
 CREATE TABLE
(1 row)

-- Test
IMPORT FOREIGN SCHEMA public FROM SERVER tsurugidb INTO public;
\det fdw_test_type_str
         List of foreign tables
 Schema |       Table       |  Server   
--------+-------------------+-----------
 public | fdw_test_type_str | tsurugidb
(1 row)

\d fdw_test_type_str
                   Foreign table "public.fdw_test_type_str"
         Column          | Type | Collation | Nullable | Default | FDW options 
-------------------------+------+-----------+----------+---------+-------------
 col_char                | text |           |          |         | 
 col_char_l              | text |           |          |         | 
 col_character           | text |           |          |         | 
 col_character_l         | text |           |          |         | 
 col_varchar             | text |           |          |         | 
 col_varchar_l           | text |           |          |         | 
 col_char_varying        | text |           |          |         | 
 col_char_varying_l      | text |           |          |         | 
 col_character_varying   | text |           |          |         | 
 col_character_varying_l | text |           |          |         | 
Server: tsurugidb

INSERT INTO fdw_test_type_str
  (col_char, col_char_l, col_character, col_character_l, col_varchar, col_varchar_l,
   col_char_varying, col_char_varying_l, col_character_varying, col_character_varying_l)
  VALUES ('1', 'char', '2', 'character', 'varchar', 'varchar_l',
          'char_varying', 'char_varying_l', 'character_varying', 'character_varying_l');
SELECT * FROM fdw_test_type_str;
 col_char |                            col_char_l                            | col_character |                         col_character_l                          | col_varchar | col_varchar_l | col_char_varying | col_char_varying_l | col_character_varying | col_character_varying_l 
----------+------------------------------------------------------------------+---------------+------------------------------------------------------------------+-------------+---------------+------------------+--------------------+-----------------------+-------------------------
 1        | char                                                             | 2             | character                                                        | varchar     | varchar_l     | char_varying     | char_varying_l     | character_varying     | character_varying_l
(1 row)

UPDATE fdw_test_type_str
  SET col_char = '3', col_char_l = 'char_upd', col_character = '4', col_character_l = 'character_upd',
      col_varchar = 'varchar_upd', col_varchar_l = 'varchar_l_upd', col_char_varying = 'char_varying_upd',
      col_char_varying_l = 'char_varying_l_upd', col_character_varying = 'character_varying_upd',
      col_character_varying_l = 'character_varying_l_upd'
  WHERE col_char = '1';
SELECT * FROM fdw_test_type_str;
 col_char |                            col_char_l                            | col_character |                         col_character_l                          | col_varchar | col_varchar_l | col_char_varying | col_char_varying_l | col_character_varying | col_character_varying_l 
----------+------------------------------------------------------------------+---------------+------------------------------------------------------------------+-------------+---------------+------------------+--------------------+-----------------------+-------------------------
 3        | char_upd                                                         | 4             | character_upd                                                    | varchar_upd | varchar_l_upd | char_varying_upd | char_varying_l_upd | character_varying_upd | character_varying_l_upd
(1 row)

DELETE FROM fdw_test_type_str WHERE col_char = '3';
SELECT * FROM fdw_test_type_str;
 col_char | col_char_l | col_character | col_character_l | col_varchar | col_varchar_l | col_char_varying | col_char_varying_l | col_character_varying | col_character_varying_l 
----------+------------+---------------+-----------------+-------------+---------------+------------------+--------------------+-----------------------+-------------------------
(0 rows)

-- Test teardown: DDL of the PostgreSQL
SELECT drop_foreign_tables();
 drop_foreign_tables 
---------------------
 DROP FOREIGN TABLE
(1 row)

-- Test teardown: DDL of the Tsurugi
SELECT tg_execute_ddl('DROP TABLE fdw_test_type_str', 'tsurugidb');
 tg_execute_ddl 
----------------
 DROP TABLE
(1 row)

/* Test case: 3-3-1_4 */
-- Test setup: DDL of the Tsurugi
SELECT tg_execute_ddl('
  CREATE TABLE fdw_test_type_datetime (
    col_date DATE,
    col_time TIME,
    col_time_tz TIME WITH TIME ZONE,
    col_timestamp TIMESTAMP,
    col_timestamp_tz TIMESTAMP WITH TIME ZONE
  )
', 'tsurugidb');
 tg_execute_ddl 
----------------
 CREATE TABLE
(1 row)

-- Test
IMPORT FOREIGN SCHEMA public FROM SERVER tsurugidb INTO public;
\det fdw_test_type_datetime
           List of foreign tables
 Schema |         Table          |  Server   
--------+------------------------+-----------
 public | fdw_test_type_datetime | tsurugidb
(1 row)

\d fdw_test_type_datetime
                         Foreign table "public.fdw_test_type_datetime"
      Column      |            Type             | Collation | Nullable | Default | FDW options 
------------------+-----------------------------+-----------+----------+---------+-------------
 col_date         | date                        |           |          |         | 
 col_time         | time without time zone      |           |          |         | 
 col_time_tz      | time with time zone         |           |          |         | 
 col_timestamp    | timestamp without time zone |           |          |         | 
 col_timestamp_tz | timestamp with time zone    |           |          |         | 
Server: tsurugidb

INSERT INTO fdw_test_type_datetime
  (col_date, col_time, col_timestamp, col_timestamp_tz)
  VALUES (DATE '2025-01-23', TIME '08:09:10', TIMESTAMP '2025-01-23 08:09:10',
          TIMESTAMP WITH TIME ZONE '2025-01-23 08:09:10+09');
SELECT * FROM fdw_test_type_datetime;
  col_date  | col_time | col_time_tz |    col_timestamp    |    col_timestamp_tz    
------------+----------+-------------+---------------------+------------------------
 2025-01-23 | 08:09:10 |             | 2025-01-23 08:09:10 | 2025-01-23 08:09:10+09
(1 row)

UPDATE fdw_test_type_datetime
  SET col_date = DATE '2025-02-12', col_time = TIME '09:10:11', col_timestamp = TIMESTAMP '2025-02-12 09:10:11',
      col_timestamp_tz = TIMESTAMP WITH TIME ZONE '2025-02-12 09:10:11+09' WHERE col_date = DATE '2025-01-23';
SELECT * FROM fdw_test_type_datetime;
  col_date  | col_time | col_time_tz |    col_timestamp    |    col_timestamp_tz    
------------+----------+-------------+---------------------+------------------------
 2025-02-12 | 09:10:11 |             | 2025-02-12 09:10:11 | 2025-02-12 09:10:11+09
(1 row)

DELETE FROM fdw_test_type_datetime WHERE col_date = DATE '2025-02-12';
SELECT * FROM fdw_test_type_datetime;
 col_date | col_time | col_time_tz | col_timestamp | col_timestamp_tz 
----------+----------+-------------+---------------+------------------
(0 rows)

-- Test teardown: DDL of the PostgreSQL
SELECT drop_foreign_tables();
 drop_foreign_tables 
---------------------
 DROP FOREIGN TABLE
(1 row)

-- Test teardown: DDL of the Tsurugi
SELECT tg_execute_ddl('DROP TABLE fdw_test_type_datetime', 'tsurugidb');
 tg_execute_ddl 
----------------
 DROP TABLE
(1 row)

/* Test case: 3-4 */
-- Test setup: DDL of the Tsurugi
SELECT tg_execute_ddl('
  CREATE TABLE fdw_test_type_invalid (col_binary BINARY)
', 'tsurugidb');
 tg_execute_ddl 
----------------
 CREATE TABLE
(1 row)

-- Test
IMPORT FOREIGN SCHEMA public FROM SERVER tsurugidb INTO public;
ERROR:  unsupported tsurugi data type "11"
DETAIL:  table:"fdw_test_type_invalid" column:"col_binary" type:11
-- Test teardown: DDL of the PostgreSQL
SELECT drop_foreign_tables();
 drop_foreign_tables 
---------------------
 DROP FOREIGN TABLE
(1 row)

-- Test teardown: DDL of the Tsurugi
SELECT tg_execute_ddl('DROP TABLE fdw_test_type_invalid', 'tsurugidb');
 tg_execute_ddl 
----------------
 DROP TABLE
(1 row)

/* Test case: 4-1-1 */
-- Test setup: DDL of the Tsurugi
SELECT tg_execute_ddl('
  CREATE TABLE fdw_test_table_name2_________3_________4_________5_________6__ (id INT, name VARCHAR)
', 'tsurugidb');
 tg_execute_ddl 
----------------
 CREATE TABLE
(1 row)

-- Test
IMPORT FOREIGN SCHEMA public FROM SERVER tsurugidb INTO public;
\det fdw_test_table_name2_________3_________4_________5_________6__
                               List of foreign tables
 Schema |                             Table                              |  Server   
--------+----------------------------------------------------------------+-----------
 public | fdw_test_table_name2_________3_________4_________5_________6__ | tsurugidb
(1 row)

\d fdw_test_table_name2_________3_________4_________5_________6__
Foreign table "public.fdw_test_table_name2_________3_________4_________5_________6__"
 Column |  Type   | Collation | Nullable | Default | FDW options 
--------+---------+-----------+----------+---------+-------------
 id     | integer |           |          |         | 
 name   | text    |           |          |         | 
Server: tsurugidb

-- Test teardown: DDL of the PostgreSQL
SELECT drop_foreign_tables();
 drop_foreign_tables 
---------------------
 DROP FOREIGN TABLE
(1 row)

-- Test teardown: DDL of the Tsurugi
SELECT tg_execute_ddl('
  DROP TABLE fdw_test_table_name2_________3_________4_________5_________6__
', 'tsurugidb');
 tg_execute_ddl 
----------------
 DROP TABLE
(1 row)

/* Test case: 4-1-2 */
-- Test setup: DDL of the Tsurugi
SELECT tg_execute_ddl('
  CREATE TABLE fdw_test_table_name2_________3_________4_________5_________6___ (id INT, name VARCHAR)
', 'tsurugidb');
 tg_execute_ddl 
----------------
 CREATE TABLE
(1 row)

-- Test
IMPORT FOREIGN SCHEMA public FROM SERVER tsurugidb INTO public;
\det fdw_test_table_name2_________3_________4_________5_________6___
                                List of foreign tables
 Schema |                              Table                              |  Server   
--------+-----------------------------------------------------------------+-----------
 public | fdw_test_table_name2_________3_________4_________5_________6___ | tsurugidb
(1 row)

\d fdw_test_table_name2_________3_________4_________5_________6___
Foreign table "public.fdw_test_table_name2_________3_________4_________5_________6___"
 Column |  Type   | Collation | Nullable | Default | FDW options 
--------+---------+-----------+----------+---------+-------------
 id     | integer |           |          |         | 
 name   | text    |           |          |         | 
Server: tsurugidb

-- Test teardown: DDL of the PostgreSQL
SELECT drop_foreign_tables();
 drop_foreign_tables 
---------------------
 DROP FOREIGN TABLE
(1 row)

-- Test teardown: DDL of the Tsurugi
SELECT tg_execute_ddl('
  DROP TABLE fdw_test_table_name2_________3_________4_________5_________6___
', 'tsurugidb');
 tg_execute_ddl 
----------------
 DROP TABLE
(1 row)

/* Test case: 4-1-3 */
-- Test setup: DDL of the Tsurugi
SELECT tg_execute_ddl('
  CREATE TABLE fdw_test_table_name2_________3_________4_________5_________6____ (id INT, name VARCHAR)
', 'tsurugidb');
 tg_execute_ddl 
----------------
 CREATE TABLE
(1 row)

-- Test
IMPORT FOREIGN SCHEMA public FROM SERVER tsurugidb INTO public;
NOTICE:  identifier "fdw_test_table_name2_________3_________4_________5_________6____" will be truncated to "fdw_test_table_name2_________3_________4_________5_________6___"
\det fdw_test_table_name2_________3_________4_________5_________6___
                                List of foreign tables
 Schema |                              Table                              |  Server   
--------+-----------------------------------------------------------------+-----------
 public | fdw_test_table_name2_________3_________4_________5_________6___ | tsurugidb
(1 row)

\d fdw_test_table_name2_________3_________4_________5_________6___
Foreign table "public.fdw_test_table_name2_________3_________4_________5_________6___"
 Column |  Type   | Collation | Nullable | Default | FDW options 
--------+---------+-----------+----------+---------+-------------
 id     | integer |           |          |         | 
 name   | text    |           |          |         | 
Server: tsurugidb

-- Test teardown: DDL of the PostgreSQL
SELECT drop_foreign_tables();
 drop_foreign_tables 
---------------------
 DROP FOREIGN TABLE
(1 row)

-- Test teardown: DDL of the Tsurugi
SELECT tg_execute_ddl('
  DROP TABLE fdw_test_table_name2_________3_________4_________5_________6____
', 'tsurugidb');
 tg_execute_ddl 
----------------
 DROP TABLE
(1 row)

/* Test case: 4-2-1 */
-- Test setup: DDL of the Tsurugi
SELECT tg_execute_ddl('
  CREATE TABLE fdw_test_table (id INT, columnname_________2_________3_________4_________5_________6__ VARCHAR)
', 'tsurugidb');
 tg_execute_ddl 
----------------
 CREATE TABLE
(1 row)

-- Test
IMPORT FOREIGN SCHEMA public FROM SERVER tsurugidb INTO public;
\det fdw_test_table
       List of foreign tables
 Schema |     Table      |  Server   
--------+----------------+-----------
 public | fdw_test_table | tsurugidb
(1 row)

\d fdw_test_table
                                          Foreign table "public.fdw_test_table"
                             Column                             |  Type   | Collation | Nullable | Default | FDW options 
----------------------------------------------------------------+---------+-----------+----------+---------+-------------
 id                                                             | integer |           |          |         | 
 columnname_________2_________3_________4_________5_________6__ | text    |           |          |         | 
Server: tsurugidb

-- Test teardown: DDL of the PostgreSQL
SELECT drop_foreign_tables();
 drop_foreign_tables 
---------------------
 DROP FOREIGN TABLE
(1 row)

-- Test teardown: DDL of the Tsurugi
SELECT tg_execute_ddl('DROP TABLE fdw_test_table', 'tsurugidb');
 tg_execute_ddl 
----------------
 DROP TABLE
(1 row)

/* Test case: 4-2-2 */
-- Test setup: DDL of the Tsurugi
SELECT tg_execute_ddl('
  CREATE TABLE fdw_test_table (id INT, columnname_________2_________3_________4_________5_________6___ VARCHAR)
', 'tsurugidb');
 tg_execute_ddl 
----------------
 CREATE TABLE
(1 row)

-- Test
IMPORT FOREIGN SCHEMA public FROM SERVER tsurugidb INTO public;
\det fdw_test_table
       List of foreign tables
 Schema |     Table      |  Server   
--------+----------------+-----------
 public | fdw_test_table | tsurugidb
(1 row)

\d fdw_test_table
                                          Foreign table "public.fdw_test_table"
                             Column                              |  Type   | Collation | Nullable | Default | FDW options 
-----------------------------------------------------------------+---------+-----------+----------+---------+-------------
 id                                                              | integer |           |          |         | 
 columnname_________2_________3_________4_________5_________6___ | text    |           |          |         | 
Server: tsurugidb

-- Test teardown: DDL of the PostgreSQL
SELECT drop_foreign_tables();
 drop_foreign_tables 
---------------------
 DROP FOREIGN TABLE
(1 row)

-- Test teardown: DDL of the Tsurugi
SELECT tg_execute_ddl('DROP TABLE fdw_test_table', 'tsurugidb');
 tg_execute_ddl 
----------------
 DROP TABLE
(1 row)

/* Test case: 4-2-3 */
-- Test setup: DDL of the Tsurugi
SELECT tg_execute_ddl('
  CREATE TABLE fdw_test_table (id INT, columnname_________2_________3_________4_________5_________6____ VARCHAR)
', 'tsurugidb');
 tg_execute_ddl 
----------------
 CREATE TABLE
(1 row)

-- Test
IMPORT FOREIGN SCHEMA public FROM SERVER tsurugidb INTO public;
NOTICE:  identifier "columnname_________2_________3_________4_________5_________6____" will be truncated to "columnname_________2_________3_________4_________5_________6___"
\det fdw_test_table
       List of foreign tables
 Schema |     Table      |  Server   
--------+----------------+-----------
 public | fdw_test_table | tsurugidb
(1 row)

\d fdw_test_table
                                          Foreign table "public.fdw_test_table"
                             Column                              |  Type   | Collation | Nullable | Default | FDW options 
-----------------------------------------------------------------+---------+-----------+----------+---------+-------------
 id                                                              | integer |           |          |         | 
 columnname_________2_________3_________4_________5_________6___ | text    |           |          |         | 
Server: tsurugidb

-- Test teardown: DDL of the PostgreSQL
SELECT drop_foreign_tables();
 drop_foreign_tables 
---------------------
 DROP FOREIGN TABLE
(1 row)

-- Test teardown: DDL of the Tsurugi
SELECT tg_execute_ddl('DROP TABLE fdw_test_table', 'tsurugidb');
 tg_execute_ddl 
----------------
 DROP TABLE
(1 row)

/* Test case: 6-1 */
-- Test setup: DDL of the Tsurugi
DO $$
DECLARE
    TABLE_MAX CONSTANT INT := 1000;
    COLUMN_MAX CONSTANT INT := 50;
    columns_def TEXT;
    i INT;
BEGIN
    SELECT string_agg(format('col_%s INT', n), ', ')
        INTO columns_def
    FROM generate_series(1, COLUMN_MAX) n;

    FOR i IN 1..TABLE_MAX LOOP
        EXECUTE format(
            'SELECT tg_execute_ddl(''CREATE TABLE IF NOT EXISTS fdw_test_table_%s (%s)'', ''tsurugidb'')',
            to_char(i, 'FM0000'), columns_def);
    END LOOP;
END $$;
-- Test
IMPORT FOREIGN SCHEMA public FROM SERVER tsurugidb INTO public;
\det fdw_test_table_*
          List of foreign tables
 Schema |        Table        |  Server   
--------+---------------------+-----------
 public | fdw_test_table_0001 | tsurugidb
 public | fdw_test_table_0002 | tsurugidb
 public | fdw_test_table_0003 | tsurugidb
 public | fdw_test_table_0004 | tsurugidb
 public | fdw_test_table_0005 | tsurugidb
 public | fdw_test_table_0006 | tsurugidb
 public | fdw_test_table_0007 | tsurugidb
 public | fdw_test_table_0008 | tsurugidb
 public | fdw_test_table_0009 | tsurugidb
 public | fdw_test_table_0010 | tsurugidb
 public | fdw_test_table_0011 | tsurugidb
 public | fdw_test_table_0012 | tsurugidb
 public | fdw_test_table_0013 | tsurugidb
 public | fdw_test_table_0014 | tsurugidb
 public | fdw_test_table_0015 | tsurugidb
 public | fdw_test_table_0016 | tsurugidb
 public | fdw_test_table_0017 | tsurugidb
 public | fdw_test_table_0018 | tsurugidb
 public | fdw_test_table_0019 | tsurugidb
 public | fdw_test_table_0020 | tsurugidb
 public | fdw_test_table_0021 | tsurugidb
 public | fdw_test_table_0022 | tsurugidb
 public | fdw_test_table_0023 | tsurugidb
 public | fdw_test_table_0024 | tsurugidb
 public | fdw_test_table_0025 | tsurugidb
 public | fdw_test_table_0026 | tsurugidb
 public | fdw_test_table_0027 | tsurugidb
 public | fdw_test_table_0028 | tsurugidb
 public | fdw_test_table_0029 | tsurugidb
 public | fdw_test_table_0030 | tsurugidb
 public | fdw_test_table_0031 | tsurugidb
 public | fdw_test_table_0032 | tsurugidb
 public | fdw_test_table_0033 | tsurugidb
 public | fdw_test_table_0034 | tsurugidb
 public | fdw_test_table_0035 | tsurugidb
 public | fdw_test_table_0036 | tsurugidb
 public | fdw_test_table_0037 | tsurugidb
 public | fdw_test_table_0038 | tsurugidb
 public | fdw_test_table_0039 | tsurugidb
 public | fdw_test_table_0040 | tsurugidb
 public | fdw_test_table_0041 | tsurugidb
 public | fdw_test_table_0042 | tsurugidb
 public | fdw_test_table_0043 | tsurugidb
 public | fdw_test_table_0044 | tsurugidb
 public | fdw_test_table_0045 | tsurugidb
 public | fdw_test_table_0046 | tsurugidb
 public | fdw_test_table_0047 | tsurugidb
 public | fdw_test_table_0048 | tsurugidb
 public | fdw_test_table_0049 | tsurugidb
 public | fdw_test_table_0050 | tsurugidb
 public | fdw_test_table_0051 | tsurugidb
 public | fdw_test_table_0052 | tsurugidb
 public | fdw_test_table_0053 | tsurugidb
 public | fdw_test_table_0054 | tsurugidb
 public | fdw_test_table_0055 | tsurugidb
 public | fdw_test_table_0056 | tsurugidb
 public | fdw_test_table_0057 | tsurugidb
 public | fdw_test_table_0058 | tsurugidb
 public | fdw_test_table_0059 | tsurugidb
 public | fdw_test_table_0060 | tsurugidb
 public | fdw_test_table_0061 | tsurugidb
 public | fdw_test_table_0062 | tsurugidb
 public | fdw_test_table_0063 | tsurugidb
 public | fdw_test_table_0064 | tsurugidb
 public | fdw_test_table_0065 | tsurugidb
 public | fdw_test_table_0066 | tsurugidb
 public | fdw_test_table_0067 | tsurugidb
 public | fdw_test_table_0068 | tsurugidb
 public | fdw_test_table_0069 | tsurugidb
 public | fdw_test_table_0070 | tsurugidb
 public | fdw_test_table_0071 | tsurugidb
 public | fdw_test_table_0072 | tsurugidb
 public | fdw_test_table_0073 | tsurugidb
 public | fdw_test_table_0074 | tsurugidb
 public | fdw_test_table_0075 | tsurugidb
 public | fdw_test_table_0076 | tsurugidb
 public | fdw_test_table_0077 | tsurugidb
 public | fdw_test_table_0078 | tsurugidb
 public | fdw_test_table_0079 | tsurugidb
 public | fdw_test_table_0080 | tsurugidb
 public | fdw_test_table_0081 | tsurugidb
 public | fdw_test_table_0082 | tsurugidb
 public | fdw_test_table_0083 | tsurugidb
 public | fdw_test_table_0084 | tsurugidb
 public | fdw_test_table_0085 | tsurugidb
 public | fdw_test_table_0086 | tsurugidb
 public | fdw_test_table_0087 | tsurugidb
 public | fdw_test_table_0088 | tsurugidb
 public | fdw_test_table_0089 | tsurugidb
 public | fdw_test_table_0090 | tsurugidb
 public | fdw_test_table_0091 | tsurugidb
 public | fdw_test_table_0092 | tsurugidb
 public | fdw_test_table_0093 | tsurugidb
 public | fdw_test_table_0094 | tsurugidb
 public | fdw_test_table_0095 | tsurugidb
 public | fdw_test_table_0096 | tsurugidb
 public | fdw_test_table_0097 | tsurugidb
 public | fdw_test_table_0098 | tsurugidb
 public | fdw_test_table_0099 | tsurugidb
 public | fdw_test_table_0100 | tsurugidb
 public | fdw_test_table_0101 | tsurugidb
 public | fdw_test_table_0102 | tsurugidb
 public | fdw_test_table_0103 | tsurugidb
 public | fdw_test_table_0104 | tsurugidb
 public | fdw_test_table_0105 | tsurugidb
 public | fdw_test_table_0106 | tsurugidb
 public | fdw_test_table_0107 | tsurugidb
 public | fdw_test_table_0108 | tsurugidb
 public | fdw_test_table_0109 | tsurugidb
 public | fdw_test_table_0110 | tsurugidb
 public | fdw_test_table_0111 | tsurugidb
 public | fdw_test_table_0112 | tsurugidb
 public | fdw_test_table_0113 | tsurugidb
 public | fdw_test_table_0114 | tsurugidb
 public | fdw_test_table_0115 | tsurugidb
 public | fdw_test_table_0116 | tsurugidb
 public | fdw_test_table_0117 | tsurugidb
 public | fdw_test_table_0118 | tsurugidb
 public | fdw_test_table_0119 | tsurugidb
 public | fdw_test_table_0120 | tsurugidb
 public | fdw_test_table_0121 | tsurugidb
 public | fdw_test_table_0122 | tsurugidb
 public | fdw_test_table_0123 | tsurugidb
 public | fdw_test_table_0124 | tsurugidb
 public | fdw_test_table_0125 | tsurugidb
 public | fdw_test_table_0126 | tsurugidb
 public | fdw_test_table_0127 | tsurugidb
 public | fdw_test_table_0128 | tsurugidb
 public | fdw_test_table_0129 | tsurugidb
 public | fdw_test_table_0130 | tsurugidb
 public | fdw_test_table_0131 | tsurugidb
 public | fdw_test_table_0132 | tsurugidb
 public | fdw_test_table_0133 | tsurugidb
 public | fdw_test_table_0134 | tsurugidb
 public | fdw_test_table_0135 | tsurugidb
 public | fdw_test_table_0136 | tsurugidb
 public | fdw_test_table_0137 | tsurugidb
 public | fdw_test_table_0138 | tsurugidb
 public | fdw_test_table_0139 | tsurugidb
 public | fdw_test_table_0140 | tsurugidb
 public | fdw_test_table_0141 | tsurugidb
 public | fdw_test_table_0142 | tsurugidb
 public | fdw_test_table_0143 | tsurugidb
 public | fdw_test_table_0144 | tsurugidb
 public | fdw_test_table_0145 | tsurugidb
 public | fdw_test_table_0146 | tsurugidb
 public | fdw_test_table_0147 | tsurugidb
 public | fdw_test_table_0148 | tsurugidb
 public | fdw_test_table_0149 | tsurugidb
 public | fdw_test_table_0150 | tsurugidb
 public | fdw_test_table_0151 | tsurugidb
 public | fdw_test_table_0152 | tsurugidb
 public | fdw_test_table_0153 | tsurugidb
 public | fdw_test_table_0154 | tsurugidb
 public | fdw_test_table_0155 | tsurugidb
 public | fdw_test_table_0156 | tsurugidb
 public | fdw_test_table_0157 | tsurugidb
 public | fdw_test_table_0158 | tsurugidb
 public | fdw_test_table_0159 | tsurugidb
 public | fdw_test_table_0160 | tsurugidb
 public | fdw_test_table_0161 | tsurugidb
 public | fdw_test_table_0162 | tsurugidb
 public | fdw_test_table_0163 | tsurugidb
 public | fdw_test_table_0164 | tsurugidb
 public | fdw_test_table_0165 | tsurugidb
 public | fdw_test_table_0166 | tsurugidb
 public | fdw_test_table_0167 | tsurugidb
 public | fdw_test_table_0168 | tsurugidb
 public | fdw_test_table_0169 | tsurugidb
 public | fdw_test_table_0170 | tsurugidb
 public | fdw_test_table_0171 | tsurugidb
 public | fdw_test_table_0172 | tsurugidb
 public | fdw_test_table_0173 | tsurugidb
 public | fdw_test_table_0174 | tsurugidb
 public | fdw_test_table_0175 | tsurugidb
 public | fdw_test_table_0176 | tsurugidb
 public | fdw_test_table_0177 | tsurugidb
 public | fdw_test_table_0178 | tsurugidb
 public | fdw_test_table_0179 | tsurugidb
 public | fdw_test_table_0180 | tsurugidb
 public | fdw_test_table_0181 | tsurugidb
 public | fdw_test_table_0182 | tsurugidb
 public | fdw_test_table_0183 | tsurugidb
 public | fdw_test_table_0184 | tsurugidb
 public | fdw_test_table_0185 | tsurugidb
 public | fdw_test_table_0186 | tsurugidb
 public | fdw_test_table_0187 | tsurugidb
 public | fdw_test_table_0188 | tsurugidb
 public | fdw_test_table_0189 | tsurugidb
 public | fdw_test_table_0190 | tsurugidb
 public | fdw_test_table_0191 | tsurugidb
 public | fdw_test_table_0192 | tsurugidb
 public | fdw_test_table_0193 | tsurugidb
 public | fdw_test_table_0194 | tsurugidb
 public | fdw_test_table_0195 | tsurugidb
 public | fdw_test_table_0196 | tsurugidb
 public | fdw_test_table_0197 | tsurugidb
 public | fdw_test_table_0198 | tsurugidb
 public | fdw_test_table_0199 | tsurugidb
 public | fdw_test_table_0200 | tsurugidb
 public | fdw_test_table_0201 | tsurugidb
 public | fdw_test_table_0202 | tsurugidb
 public | fdw_test_table_0203 | tsurugidb
 public | fdw_test_table_0204 | tsurugidb
 public | fdw_test_table_0205 | tsurugidb
 public | fdw_test_table_0206 | tsurugidb
 public | fdw_test_table_0207 | tsurugidb
 public | fdw_test_table_0208 | tsurugidb
 public | fdw_test_table_0209 | tsurugidb
 public | fdw_test_table_0210 | tsurugidb
 public | fdw_test_table_0211 | tsurugidb
 public | fdw_test_table_0212 | tsurugidb
 public | fdw_test_table_0213 | tsurugidb
 public | fdw_test_table_0214 | tsurugidb
 public | fdw_test_table_0215 | tsurugidb
 public | fdw_test_table_0216 | tsurugidb
 public | fdw_test_table_0217 | tsurugidb
 public | fdw_test_table_0218 | tsurugidb
 public | fdw_test_table_0219 | tsurugidb
 public | fdw_test_table_0220 | tsurugidb
 public | fdw_test_table_0221 | tsurugidb
 public | fdw_test_table_0222 | tsurugidb
 public | fdw_test_table_0223 | tsurugidb
 public | fdw_test_table_0224 | tsurugidb
 public | fdw_test_table_0225 | tsurugidb
 public | fdw_test_table_0226 | tsurugidb
 public | fdw_test_table_0227 | tsurugidb
 public | fdw_test_table_0228 | tsurugidb
 public | fdw_test_table_0229 | tsurugidb
 public | fdw_test_table_0230 | tsurugidb
 public | fdw_test_table_0231 | tsurugidb
 public | fdw_test_table_0232 | tsurugidb
 public | fdw_test_table_0233 | tsurugidb
 public | fdw_test_table_0234 | tsurugidb
 public | fdw_test_table_0235 | tsurugidb
 public | fdw_test_table_0236 | tsurugidb
 public | fdw_test_table_0237 | tsurugidb
 public | fdw_test_table_0238 | tsurugidb
 public | fdw_test_table_0239 | tsurugidb
 public | fdw_test_table_0240 | tsurugidb
 public | fdw_test_table_0241 | tsurugidb
 public | fdw_test_table_0242 | tsurugidb
 public | fdw_test_table_0243 | tsurugidb
 public | fdw_test_table_0244 | tsurugidb
 public | fdw_test_table_0245 | tsurugidb
 public | fdw_test_table_0246 | tsurugidb
 public | fdw_test_table_0247 | tsurugidb
 public | fdw_test_table_0248 | tsurugidb
 public | fdw_test_table_0249 | tsurugidb
 public | fdw_test_table_0250 | tsurugidb
 public | fdw_test_table_0251 | tsurugidb
 public | fdw_test_table_0252 | tsurugidb
 public | fdw_test_table_0253 | tsurugidb
 public | fdw_test_table_0254 | tsurugidb
 public | fdw_test_table_0255 | tsurugidb
 public | fdw_test_table_0256 | tsurugidb
 public | fdw_test_table_0257 | tsurugidb
 public | fdw_test_table_0258 | tsurugidb
 public | fdw_test_table_0259 | tsurugidb
 public | fdw_test_table_0260 | tsurugidb
 public | fdw_test_table_0261 | tsurugidb
 public | fdw_test_table_0262 | tsurugidb
 public | fdw_test_table_0263 | tsurugidb
 public | fdw_test_table_0264 | tsurugidb
 public | fdw_test_table_0265 | tsurugidb
 public | fdw_test_table_0266 | tsurugidb
 public | fdw_test_table_0267 | tsurugidb
 public | fdw_test_table_0268 | tsurugidb
 public | fdw_test_table_0269 | tsurugidb
 public | fdw_test_table_0270 | tsurugidb
 public | fdw_test_table_0271 | tsurugidb
 public | fdw_test_table_0272 | tsurugidb
 public | fdw_test_table_0273 | tsurugidb
 public | fdw_test_table_0274 | tsurugidb
 public | fdw_test_table_0275 | tsurugidb
 public | fdw_test_table_0276 | tsurugidb
 public | fdw_test_table_0277 | tsurugidb
 public | fdw_test_table_0278 | tsurugidb
 public | fdw_test_table_0279 | tsurugidb
 public | fdw_test_table_0280 | tsurugidb
 public | fdw_test_table_0281 | tsurugidb
 public | fdw_test_table_0282 | tsurugidb
 public | fdw_test_table_0283 | tsurugidb
 public | fdw_test_table_0284 | tsurugidb
 public | fdw_test_table_0285 | tsurugidb
 public | fdw_test_table_0286 | tsurugidb
 public | fdw_test_table_0287 | tsurugidb
 public | fdw_test_table_0288 | tsurugidb
 public | fdw_test_table_0289 | tsurugidb
 public | fdw_test_table_0290 | tsurugidb
 public | fdw_test_table_0291 | tsurugidb
 public | fdw_test_table_0292 | tsurugidb
 public | fdw_test_table_0293 | tsurugidb
 public | fdw_test_table_0294 | tsurugidb
 public | fdw_test_table_0295 | tsurugidb
 public | fdw_test_table_0296 | tsurugidb
 public | fdw_test_table_0297 | tsurugidb
 public | fdw_test_table_0298 | tsurugidb
 public | fdw_test_table_0299 | tsurugidb
 public | fdw_test_table_0300 | tsurugidb
 public | fdw_test_table_0301 | tsurugidb
 public | fdw_test_table_0302 | tsurugidb
 public | fdw_test_table_0303 | tsurugidb
 public | fdw_test_table_0304 | tsurugidb
 public | fdw_test_table_0305 | tsurugidb
 public | fdw_test_table_0306 | tsurugidb
 public | fdw_test_table_0307 | tsurugidb
 public | fdw_test_table_0308 | tsurugidb
 public | fdw_test_table_0309 | tsurugidb
 public | fdw_test_table_0310 | tsurugidb
 public | fdw_test_table_0311 | tsurugidb
 public | fdw_test_table_0312 | tsurugidb
 public | fdw_test_table_0313 | tsurugidb
 public | fdw_test_table_0314 | tsurugidb
 public | fdw_test_table_0315 | tsurugidb
 public | fdw_test_table_0316 | tsurugidb
 public | fdw_test_table_0317 | tsurugidb
 public | fdw_test_table_0318 | tsurugidb
 public | fdw_test_table_0319 | tsurugidb
 public | fdw_test_table_0320 | tsurugidb
 public | fdw_test_table_0321 | tsurugidb
 public | fdw_test_table_0322 | tsurugidb
 public | fdw_test_table_0323 | tsurugidb
 public | fdw_test_table_0324 | tsurugidb
 public | fdw_test_table_0325 | tsurugidb
 public | fdw_test_table_0326 | tsurugidb
 public | fdw_test_table_0327 | tsurugidb
 public | fdw_test_table_0328 | tsurugidb
 public | fdw_test_table_0329 | tsurugidb
 public | fdw_test_table_0330 | tsurugidb
 public | fdw_test_table_0331 | tsurugidb
 public | fdw_test_table_0332 | tsurugidb
 public | fdw_test_table_0333 | tsurugidb
 public | fdw_test_table_0334 | tsurugidb
 public | fdw_test_table_0335 | tsurugidb
 public | fdw_test_table_0336 | tsurugidb
 public | fdw_test_table_0337 | tsurugidb
 public | fdw_test_table_0338 | tsurugidb
 public | fdw_test_table_0339 | tsurugidb
 public | fdw_test_table_0340 | tsurugidb
 public | fdw_test_table_0341 | tsurugidb
 public | fdw_test_table_0342 | tsurugidb
 public | fdw_test_table_0343 | tsurugidb
 public | fdw_test_table_0344 | tsurugidb
 public | fdw_test_table_0345 | tsurugidb
 public | fdw_test_table_0346 | tsurugidb
 public | fdw_test_table_0347 | tsurugidb
 public | fdw_test_table_0348 | tsurugidb
 public | fdw_test_table_0349 | tsurugidb
 public | fdw_test_table_0350 | tsurugidb
 public | fdw_test_table_0351 | tsurugidb
 public | fdw_test_table_0352 | tsurugidb
 public | fdw_test_table_0353 | tsurugidb
 public | fdw_test_table_0354 | tsurugidb
 public | fdw_test_table_0355 | tsurugidb
 public | fdw_test_table_0356 | tsurugidb
 public | fdw_test_table_0357 | tsurugidb
 public | fdw_test_table_0358 | tsurugidb
 public | fdw_test_table_0359 | tsurugidb
 public | fdw_test_table_0360 | tsurugidb
 public | fdw_test_table_0361 | tsurugidb
 public | fdw_test_table_0362 | tsurugidb
 public | fdw_test_table_0363 | tsurugidb
 public | fdw_test_table_0364 | tsurugidb
 public | fdw_test_table_0365 | tsurugidb
 public | fdw_test_table_0366 | tsurugidb
 public | fdw_test_table_0367 | tsurugidb
 public | fdw_test_table_0368 | tsurugidb
 public | fdw_test_table_0369 | tsurugidb
 public | fdw_test_table_0370 | tsurugidb
 public | fdw_test_table_0371 | tsurugidb
 public | fdw_test_table_0372 | tsurugidb
 public | fdw_test_table_0373 | tsurugidb
 public | fdw_test_table_0374 | tsurugidb
 public | fdw_test_table_0375 | tsurugidb
 public | fdw_test_table_0376 | tsurugidb
 public | fdw_test_table_0377 | tsurugidb
 public | fdw_test_table_0378 | tsurugidb
 public | fdw_test_table_0379 | tsurugidb
 public | fdw_test_table_0380 | tsurugidb
 public | fdw_test_table_0381 | tsurugidb
 public | fdw_test_table_0382 | tsurugidb
 public | fdw_test_table_0383 | tsurugidb
 public | fdw_test_table_0384 | tsurugidb
 public | fdw_test_table_0385 | tsurugidb
 public | fdw_test_table_0386 | tsurugidb
 public | fdw_test_table_0387 | tsurugidb
 public | fdw_test_table_0388 | tsurugidb
 public | fdw_test_table_0389 | tsurugidb
 public | fdw_test_table_0390 | tsurugidb
 public | fdw_test_table_0391 | tsurugidb
 public | fdw_test_table_0392 | tsurugidb
 public | fdw_test_table_0393 | tsurugidb
 public | fdw_test_table_0394 | tsurugidb
 public | fdw_test_table_0395 | tsurugidb
 public | fdw_test_table_0396 | tsurugidb
 public | fdw_test_table_0397 | tsurugidb
 public | fdw_test_table_0398 | tsurugidb
 public | fdw_test_table_0399 | tsurugidb
 public | fdw_test_table_0400 | tsurugidb
 public | fdw_test_table_0401 | tsurugidb
 public | fdw_test_table_0402 | tsurugidb
 public | fdw_test_table_0403 | tsurugidb
 public | fdw_test_table_0404 | tsurugidb
 public | fdw_test_table_0405 | tsurugidb
 public | fdw_test_table_0406 | tsurugidb
 public | fdw_test_table_0407 | tsurugidb
 public | fdw_test_table_0408 | tsurugidb
 public | fdw_test_table_0409 | tsurugidb
 public | fdw_test_table_0410 | tsurugidb
 public | fdw_test_table_0411 | tsurugidb
 public | fdw_test_table_0412 | tsurugidb
 public | fdw_test_table_0413 | tsurugidb
 public | fdw_test_table_0414 | tsurugidb
 public | fdw_test_table_0415 | tsurugidb
 public | fdw_test_table_0416 | tsurugidb
 public | fdw_test_table_0417 | tsurugidb
 public | fdw_test_table_0418 | tsurugidb
 public | fdw_test_table_0419 | tsurugidb
 public | fdw_test_table_0420 | tsurugidb
 public | fdw_test_table_0421 | tsurugidb
 public | fdw_test_table_0422 | tsurugidb
 public | fdw_test_table_0423 | tsurugidb
 public | fdw_test_table_0424 | tsurugidb
 public | fdw_test_table_0425 | tsurugidb
 public | fdw_test_table_0426 | tsurugidb
 public | fdw_test_table_0427 | tsurugidb
 public | fdw_test_table_0428 | tsurugidb
 public | fdw_test_table_0429 | tsurugidb
 public | fdw_test_table_0430 | tsurugidb
 public | fdw_test_table_0431 | tsurugidb
 public | fdw_test_table_0432 | tsurugidb
 public | fdw_test_table_0433 | tsurugidb
 public | fdw_test_table_0434 | tsurugidb
 public | fdw_test_table_0435 | tsurugidb
 public | fdw_test_table_0436 | tsurugidb
 public | fdw_test_table_0437 | tsurugidb
 public | fdw_test_table_0438 | tsurugidb
 public | fdw_test_table_0439 | tsurugidb
 public | fdw_test_table_0440 | tsurugidb
 public | fdw_test_table_0441 | tsurugidb
 public | fdw_test_table_0442 | tsurugidb
 public | fdw_test_table_0443 | tsurugidb
 public | fdw_test_table_0444 | tsurugidb
 public | fdw_test_table_0445 | tsurugidb
 public | fdw_test_table_0446 | tsurugidb
 public | fdw_test_table_0447 | tsurugidb
 public | fdw_test_table_0448 | tsurugidb
 public | fdw_test_table_0449 | tsurugidb
 public | fdw_test_table_0450 | tsurugidb
 public | fdw_test_table_0451 | tsurugidb
 public | fdw_test_table_0452 | tsurugidb
 public | fdw_test_table_0453 | tsurugidb
 public | fdw_test_table_0454 | tsurugidb
 public | fdw_test_table_0455 | tsurugidb
 public | fdw_test_table_0456 | tsurugidb
 public | fdw_test_table_0457 | tsurugidb
 public | fdw_test_table_0458 | tsurugidb
 public | fdw_test_table_0459 | tsurugidb
 public | fdw_test_table_0460 | tsurugidb
 public | fdw_test_table_0461 | tsurugidb
 public | fdw_test_table_0462 | tsurugidb
 public | fdw_test_table_0463 | tsurugidb
 public | fdw_test_table_0464 | tsurugidb
 public | fdw_test_table_0465 | tsurugidb
 public | fdw_test_table_0466 | tsurugidb
 public | fdw_test_table_0467 | tsurugidb
 public | fdw_test_table_0468 | tsurugidb
 public | fdw_test_table_0469 | tsurugidb
 public | fdw_test_table_0470 | tsurugidb
 public | fdw_test_table_0471 | tsurugidb
 public | fdw_test_table_0472 | tsurugidb
 public | fdw_test_table_0473 | tsurugidb
 public | fdw_test_table_0474 | tsurugidb
 public | fdw_test_table_0475 | tsurugidb
 public | fdw_test_table_0476 | tsurugidb
 public | fdw_test_table_0477 | tsurugidb
 public | fdw_test_table_0478 | tsurugidb
 public | fdw_test_table_0479 | tsurugidb
 public | fdw_test_table_0480 | tsurugidb
 public | fdw_test_table_0481 | tsurugidb
 public | fdw_test_table_0482 | tsurugidb
 public | fdw_test_table_0483 | tsurugidb
 public | fdw_test_table_0484 | tsurugidb
 public | fdw_test_table_0485 | tsurugidb
 public | fdw_test_table_0486 | tsurugidb
 public | fdw_test_table_0487 | tsurugidb
 public | fdw_test_table_0488 | tsurugidb
 public | fdw_test_table_0489 | tsurugidb
 public | fdw_test_table_0490 | tsurugidb
 public | fdw_test_table_0491 | tsurugidb
 public | fdw_test_table_0492 | tsurugidb
 public | fdw_test_table_0493 | tsurugidb
 public | fdw_test_table_0494 | tsurugidb
 public | fdw_test_table_0495 | tsurugidb
 public | fdw_test_table_0496 | tsurugidb
 public | fdw_test_table_0497 | tsurugidb
 public | fdw_test_table_0498 | tsurugidb
 public | fdw_test_table_0499 | tsurugidb
 public | fdw_test_table_0500 | tsurugidb
 public | fdw_test_table_0501 | tsurugidb
 public | fdw_test_table_0502 | tsurugidb
 public | fdw_test_table_0503 | tsurugidb
 public | fdw_test_table_0504 | tsurugidb
 public | fdw_test_table_0505 | tsurugidb
 public | fdw_test_table_0506 | tsurugidb
 public | fdw_test_table_0507 | tsurugidb
 public | fdw_test_table_0508 | tsurugidb
 public | fdw_test_table_0509 | tsurugidb
 public | fdw_test_table_0510 | tsurugidb
 public | fdw_test_table_0511 | tsurugidb
 public | fdw_test_table_0512 | tsurugidb
 public | fdw_test_table_0513 | tsurugidb
 public | fdw_test_table_0514 | tsurugidb
 public | fdw_test_table_0515 | tsurugidb
 public | fdw_test_table_0516 | tsurugidb
 public | fdw_test_table_0517 | tsurugidb
 public | fdw_test_table_0518 | tsurugidb
 public | fdw_test_table_0519 | tsurugidb
 public | fdw_test_table_0520 | tsurugidb
 public | fdw_test_table_0521 | tsurugidb
 public | fdw_test_table_0522 | tsurugidb
 public | fdw_test_table_0523 | tsurugidb
 public | fdw_test_table_0524 | tsurugidb
 public | fdw_test_table_0525 | tsurugidb
 public | fdw_test_table_0526 | tsurugidb
 public | fdw_test_table_0527 | tsurugidb
 public | fdw_test_table_0528 | tsurugidb
 public | fdw_test_table_0529 | tsurugidb
 public | fdw_test_table_0530 | tsurugidb
 public | fdw_test_table_0531 | tsurugidb
 public | fdw_test_table_0532 | tsurugidb
 public | fdw_test_table_0533 | tsurugidb
 public | fdw_test_table_0534 | tsurugidb
 public | fdw_test_table_0535 | tsurugidb
 public | fdw_test_table_0536 | tsurugidb
 public | fdw_test_table_0537 | tsurugidb
 public | fdw_test_table_0538 | tsurugidb
 public | fdw_test_table_0539 | tsurugidb
 public | fdw_test_table_0540 | tsurugidb
 public | fdw_test_table_0541 | tsurugidb
 public | fdw_test_table_0542 | tsurugidb
 public | fdw_test_table_0543 | tsurugidb
 public | fdw_test_table_0544 | tsurugidb
 public | fdw_test_table_0545 | tsurugidb
 public | fdw_test_table_0546 | tsurugidb
 public | fdw_test_table_0547 | tsurugidb
 public | fdw_test_table_0548 | tsurugidb
 public | fdw_test_table_0549 | tsurugidb
 public | fdw_test_table_0550 | tsurugidb
 public | fdw_test_table_0551 | tsurugidb
 public | fdw_test_table_0552 | tsurugidb
 public | fdw_test_table_0553 | tsurugidb
 public | fdw_test_table_0554 | tsurugidb
 public | fdw_test_table_0555 | tsurugidb
 public | fdw_test_table_0556 | tsurugidb
 public | fdw_test_table_0557 | tsurugidb
 public | fdw_test_table_0558 | tsurugidb
 public | fdw_test_table_0559 | tsurugidb
 public | fdw_test_table_0560 | tsurugidb
 public | fdw_test_table_0561 | tsurugidb
 public | fdw_test_table_0562 | tsurugidb
 public | fdw_test_table_0563 | tsurugidb
 public | fdw_test_table_0564 | tsurugidb
 public | fdw_test_table_0565 | tsurugidb
 public | fdw_test_table_0566 | tsurugidb
 public | fdw_test_table_0567 | tsurugidb
 public | fdw_test_table_0568 | tsurugidb
 public | fdw_test_table_0569 | tsurugidb
 public | fdw_test_table_0570 | tsurugidb
 public | fdw_test_table_0571 | tsurugidb
 public | fdw_test_table_0572 | tsurugidb
 public | fdw_test_table_0573 | tsurugidb
 public | fdw_test_table_0574 | tsurugidb
 public | fdw_test_table_0575 | tsurugidb
 public | fdw_test_table_0576 | tsurugidb
 public | fdw_test_table_0577 | tsurugidb
 public | fdw_test_table_0578 | tsurugidb
 public | fdw_test_table_0579 | tsurugidb
 public | fdw_test_table_0580 | tsurugidb
 public | fdw_test_table_0581 | tsurugidb
 public | fdw_test_table_0582 | tsurugidb
 public | fdw_test_table_0583 | tsurugidb
 public | fdw_test_table_0584 | tsurugidb
 public | fdw_test_table_0585 | tsurugidb
 public | fdw_test_table_0586 | tsurugidb
 public | fdw_test_table_0587 | tsurugidb
 public | fdw_test_table_0588 | tsurugidb
 public | fdw_test_table_0589 | tsurugidb
 public | fdw_test_table_0590 | tsurugidb
 public | fdw_test_table_0591 | tsurugidb
 public | fdw_test_table_0592 | tsurugidb
 public | fdw_test_table_0593 | tsurugidb
 public | fdw_test_table_0594 | tsurugidb
 public | fdw_test_table_0595 | tsurugidb
 public | fdw_test_table_0596 | tsurugidb
 public | fdw_test_table_0597 | tsurugidb
 public | fdw_test_table_0598 | tsurugidb
 public | fdw_test_table_0599 | tsurugidb
 public | fdw_test_table_0600 | tsurugidb
 public | fdw_test_table_0601 | tsurugidb
 public | fdw_test_table_0602 | tsurugidb
 public | fdw_test_table_0603 | tsurugidb
 public | fdw_test_table_0604 | tsurugidb
 public | fdw_test_table_0605 | tsurugidb
 public | fdw_test_table_0606 | tsurugidb
 public | fdw_test_table_0607 | tsurugidb
 public | fdw_test_table_0608 | tsurugidb
 public | fdw_test_table_0609 | tsurugidb
 public | fdw_test_table_0610 | tsurugidb
 public | fdw_test_table_0611 | tsurugidb
 public | fdw_test_table_0612 | tsurugidb
 public | fdw_test_table_0613 | tsurugidb
 public | fdw_test_table_0614 | tsurugidb
 public | fdw_test_table_0615 | tsurugidb
 public | fdw_test_table_0616 | tsurugidb
 public | fdw_test_table_0617 | tsurugidb
 public | fdw_test_table_0618 | tsurugidb
 public | fdw_test_table_0619 | tsurugidb
 public | fdw_test_table_0620 | tsurugidb
 public | fdw_test_table_0621 | tsurugidb
 public | fdw_test_table_0622 | tsurugidb
 public | fdw_test_table_0623 | tsurugidb
 public | fdw_test_table_0624 | tsurugidb
 public | fdw_test_table_0625 | tsurugidb
 public | fdw_test_table_0626 | tsurugidb
 public | fdw_test_table_0627 | tsurugidb
 public | fdw_test_table_0628 | tsurugidb
 public | fdw_test_table_0629 | tsurugidb
 public | fdw_test_table_0630 | tsurugidb
 public | fdw_test_table_0631 | tsurugidb
 public | fdw_test_table_0632 | tsurugidb
 public | fdw_test_table_0633 | tsurugidb
 public | fdw_test_table_0634 | tsurugidb
 public | fdw_test_table_0635 | tsurugidb
 public | fdw_test_table_0636 | tsurugidb
 public | fdw_test_table_0637 | tsurugidb
 public | fdw_test_table_0638 | tsurugidb
 public | fdw_test_table_0639 | tsurugidb
 public | fdw_test_table_0640 | tsurugidb
 public | fdw_test_table_0641 | tsurugidb
 public | fdw_test_table_0642 | tsurugidb
 public | fdw_test_table_0643 | tsurugidb
 public | fdw_test_table_0644 | tsurugidb
 public | fdw_test_table_0645 | tsurugidb
 public | fdw_test_table_0646 | tsurugidb
 public | fdw_test_table_0647 | tsurugidb
 public | fdw_test_table_0648 | tsurugidb
 public | fdw_test_table_0649 | tsurugidb
 public | fdw_test_table_0650 | tsurugidb
 public | fdw_test_table_0651 | tsurugidb
 public | fdw_test_table_0652 | tsurugidb
 public | fdw_test_table_0653 | tsurugidb
 public | fdw_test_table_0654 | tsurugidb
 public | fdw_test_table_0655 | tsurugidb
 public | fdw_test_table_0656 | tsurugidb
 public | fdw_test_table_0657 | tsurugidb
 public | fdw_test_table_0658 | tsurugidb
 public | fdw_test_table_0659 | tsurugidb
 public | fdw_test_table_0660 | tsurugidb
 public | fdw_test_table_0661 | tsurugidb
 public | fdw_test_table_0662 | tsurugidb
 public | fdw_test_table_0663 | tsurugidb
 public | fdw_test_table_0664 | tsurugidb
 public | fdw_test_table_0665 | tsurugidb
 public | fdw_test_table_0666 | tsurugidb
 public | fdw_test_table_0667 | tsurugidb
 public | fdw_test_table_0668 | tsurugidb
 public | fdw_test_table_0669 | tsurugidb
 public | fdw_test_table_0670 | tsurugidb
 public | fdw_test_table_0671 | tsurugidb
 public | fdw_test_table_0672 | tsurugidb
 public | fdw_test_table_0673 | tsurugidb
 public | fdw_test_table_0674 | tsurugidb
 public | fdw_test_table_0675 | tsurugidb
 public | fdw_test_table_0676 | tsurugidb
 public | fdw_test_table_0677 | tsurugidb
 public | fdw_test_table_0678 | tsurugidb
 public | fdw_test_table_0679 | tsurugidb
 public | fdw_test_table_0680 | tsurugidb
 public | fdw_test_table_0681 | tsurugidb
 public | fdw_test_table_0682 | tsurugidb
 public | fdw_test_table_0683 | tsurugidb
 public | fdw_test_table_0684 | tsurugidb
 public | fdw_test_table_0685 | tsurugidb
 public | fdw_test_table_0686 | tsurugidb
 public | fdw_test_table_0687 | tsurugidb
 public | fdw_test_table_0688 | tsurugidb
 public | fdw_test_table_0689 | tsurugidb
 public | fdw_test_table_0690 | tsurugidb
 public | fdw_test_table_0691 | tsurugidb
 public | fdw_test_table_0692 | tsurugidb
 public | fdw_test_table_0693 | tsurugidb
 public | fdw_test_table_0694 | tsurugidb
 public | fdw_test_table_0695 | tsurugidb
 public | fdw_test_table_0696 | tsurugidb
 public | fdw_test_table_0697 | tsurugidb
 public | fdw_test_table_0698 | tsurugidb
 public | fdw_test_table_0699 | tsurugidb
 public | fdw_test_table_0700 | tsurugidb
 public | fdw_test_table_0701 | tsurugidb
 public | fdw_test_table_0702 | tsurugidb
 public | fdw_test_table_0703 | tsurugidb
 public | fdw_test_table_0704 | tsurugidb
 public | fdw_test_table_0705 | tsurugidb
 public | fdw_test_table_0706 | tsurugidb
 public | fdw_test_table_0707 | tsurugidb
 public | fdw_test_table_0708 | tsurugidb
 public | fdw_test_table_0709 | tsurugidb
 public | fdw_test_table_0710 | tsurugidb
 public | fdw_test_table_0711 | tsurugidb
 public | fdw_test_table_0712 | tsurugidb
 public | fdw_test_table_0713 | tsurugidb
 public | fdw_test_table_0714 | tsurugidb
 public | fdw_test_table_0715 | tsurugidb
 public | fdw_test_table_0716 | tsurugidb
 public | fdw_test_table_0717 | tsurugidb
 public | fdw_test_table_0718 | tsurugidb
 public | fdw_test_table_0719 | tsurugidb
 public | fdw_test_table_0720 | tsurugidb
 public | fdw_test_table_0721 | tsurugidb
 public | fdw_test_table_0722 | tsurugidb
 public | fdw_test_table_0723 | tsurugidb
 public | fdw_test_table_0724 | tsurugidb
 public | fdw_test_table_0725 | tsurugidb
 public | fdw_test_table_0726 | tsurugidb
 public | fdw_test_table_0727 | tsurugidb
 public | fdw_test_table_0728 | tsurugidb
 public | fdw_test_table_0729 | tsurugidb
 public | fdw_test_table_0730 | tsurugidb
 public | fdw_test_table_0731 | tsurugidb
 public | fdw_test_table_0732 | tsurugidb
 public | fdw_test_table_0733 | tsurugidb
 public | fdw_test_table_0734 | tsurugidb
 public | fdw_test_table_0735 | tsurugidb
 public | fdw_test_table_0736 | tsurugidb
 public | fdw_test_table_0737 | tsurugidb
 public | fdw_test_table_0738 | tsurugidb
 public | fdw_test_table_0739 | tsurugidb
 public | fdw_test_table_0740 | tsurugidb
 public | fdw_test_table_0741 | tsurugidb
 public | fdw_test_table_0742 | tsurugidb
 public | fdw_test_table_0743 | tsurugidb
 public | fdw_test_table_0744 | tsurugidb
 public | fdw_test_table_0745 | tsurugidb
 public | fdw_test_table_0746 | tsurugidb
 public | fdw_test_table_0747 | tsurugidb
 public | fdw_test_table_0748 | tsurugidb
 public | fdw_test_table_0749 | tsurugidb
 public | fdw_test_table_0750 | tsurugidb
 public | fdw_test_table_0751 | tsurugidb
 public | fdw_test_table_0752 | tsurugidb
 public | fdw_test_table_0753 | tsurugidb
 public | fdw_test_table_0754 | tsurugidb
 public | fdw_test_table_0755 | tsurugidb
 public | fdw_test_table_0756 | tsurugidb
 public | fdw_test_table_0757 | tsurugidb
 public | fdw_test_table_0758 | tsurugidb
 public | fdw_test_table_0759 | tsurugidb
 public | fdw_test_table_0760 | tsurugidb
 public | fdw_test_table_0761 | tsurugidb
 public | fdw_test_table_0762 | tsurugidb
 public | fdw_test_table_0763 | tsurugidb
 public | fdw_test_table_0764 | tsurugidb
 public | fdw_test_table_0765 | tsurugidb
 public | fdw_test_table_0766 | tsurugidb
 public | fdw_test_table_0767 | tsurugidb
 public | fdw_test_table_0768 | tsurugidb
 public | fdw_test_table_0769 | tsurugidb
 public | fdw_test_table_0770 | tsurugidb
 public | fdw_test_table_0771 | tsurugidb
 public | fdw_test_table_0772 | tsurugidb
 public | fdw_test_table_0773 | tsurugidb
 public | fdw_test_table_0774 | tsurugidb
 public | fdw_test_table_0775 | tsurugidb
 public | fdw_test_table_0776 | tsurugidb
 public | fdw_test_table_0777 | tsurugidb
 public | fdw_test_table_0778 | tsurugidb
 public | fdw_test_table_0779 | tsurugidb
 public | fdw_test_table_0780 | tsurugidb
 public | fdw_test_table_0781 | tsurugidb
 public | fdw_test_table_0782 | tsurugidb
 public | fdw_test_table_0783 | tsurugidb
 public | fdw_test_table_0784 | tsurugidb
 public | fdw_test_table_0785 | tsurugidb
 public | fdw_test_table_0786 | tsurugidb
 public | fdw_test_table_0787 | tsurugidb
 public | fdw_test_table_0788 | tsurugidb
 public | fdw_test_table_0789 | tsurugidb
 public | fdw_test_table_0790 | tsurugidb
 public | fdw_test_table_0791 | tsurugidb
 public | fdw_test_table_0792 | tsurugidb
 public | fdw_test_table_0793 | tsurugidb
 public | fdw_test_table_0794 | tsurugidb
 public | fdw_test_table_0795 | tsurugidb
 public | fdw_test_table_0796 | tsurugidb
 public | fdw_test_table_0797 | tsurugidb
 public | fdw_test_table_0798 | tsurugidb
 public | fdw_test_table_0799 | tsurugidb
 public | fdw_test_table_0800 | tsurugidb
 public | fdw_test_table_0801 | tsurugidb
 public | fdw_test_table_0802 | tsurugidb
 public | fdw_test_table_0803 | tsurugidb
 public | fdw_test_table_0804 | tsurugidb
 public | fdw_test_table_0805 | tsurugidb
 public | fdw_test_table_0806 | tsurugidb
 public | fdw_test_table_0807 | tsurugidb
 public | fdw_test_table_0808 | tsurugidb
 public | fdw_test_table_0809 | tsurugidb
 public | fdw_test_table_0810 | tsurugidb
 public | fdw_test_table_0811 | tsurugidb
 public | fdw_test_table_0812 | tsurugidb
 public | fdw_test_table_0813 | tsurugidb
 public | fdw_test_table_0814 | tsurugidb
 public | fdw_test_table_0815 | tsurugidb
 public | fdw_test_table_0816 | tsurugidb
 public | fdw_test_table_0817 | tsurugidb
 public | fdw_test_table_0818 | tsurugidb
 public | fdw_test_table_0819 | tsurugidb
 public | fdw_test_table_0820 | tsurugidb
 public | fdw_test_table_0821 | tsurugidb
 public | fdw_test_table_0822 | tsurugidb
 public | fdw_test_table_0823 | tsurugidb
 public | fdw_test_table_0824 | tsurugidb
 public | fdw_test_table_0825 | tsurugidb
 public | fdw_test_table_0826 | tsurugidb
 public | fdw_test_table_0827 | tsurugidb
 public | fdw_test_table_0828 | tsurugidb
 public | fdw_test_table_0829 | tsurugidb
 public | fdw_test_table_0830 | tsurugidb
 public | fdw_test_table_0831 | tsurugidb
 public | fdw_test_table_0832 | tsurugidb
 public | fdw_test_table_0833 | tsurugidb
 public | fdw_test_table_0834 | tsurugidb
 public | fdw_test_table_0835 | tsurugidb
 public | fdw_test_table_0836 | tsurugidb
 public | fdw_test_table_0837 | tsurugidb
 public | fdw_test_table_0838 | tsurugidb
 public | fdw_test_table_0839 | tsurugidb
 public | fdw_test_table_0840 | tsurugidb
 public | fdw_test_table_0841 | tsurugidb
 public | fdw_test_table_0842 | tsurugidb
 public | fdw_test_table_0843 | tsurugidb
 public | fdw_test_table_0844 | tsurugidb
 public | fdw_test_table_0845 | tsurugidb
 public | fdw_test_table_0846 | tsurugidb
 public | fdw_test_table_0847 | tsurugidb
 public | fdw_test_table_0848 | tsurugidb
 public | fdw_test_table_0849 | tsurugidb
 public | fdw_test_table_0850 | tsurugidb
 public | fdw_test_table_0851 | tsurugidb
 public | fdw_test_table_0852 | tsurugidb
 public | fdw_test_table_0853 | tsurugidb
 public | fdw_test_table_0854 | tsurugidb
 public | fdw_test_table_0855 | tsurugidb
 public | fdw_test_table_0856 | tsurugidb
 public | fdw_test_table_0857 | tsurugidb
 public | fdw_test_table_0858 | tsurugidb
 public | fdw_test_table_0859 | tsurugidb
 public | fdw_test_table_0860 | tsurugidb
 public | fdw_test_table_0861 | tsurugidb
 public | fdw_test_table_0862 | tsurugidb
 public | fdw_test_table_0863 | tsurugidb
 public | fdw_test_table_0864 | tsurugidb
 public | fdw_test_table_0865 | tsurugidb
 public | fdw_test_table_0866 | tsurugidb
 public | fdw_test_table_0867 | tsurugidb
 public | fdw_test_table_0868 | tsurugidb
 public | fdw_test_table_0869 | tsurugidb
 public | fdw_test_table_0870 | tsurugidb
 public | fdw_test_table_0871 | tsurugidb
 public | fdw_test_table_0872 | tsurugidb
 public | fdw_test_table_0873 | tsurugidb
 public | fdw_test_table_0874 | tsurugidb
 public | fdw_test_table_0875 | tsurugidb
 public | fdw_test_table_0876 | tsurugidb
 public | fdw_test_table_0877 | tsurugidb
 public | fdw_test_table_0878 | tsurugidb
 public | fdw_test_table_0879 | tsurugidb
 public | fdw_test_table_0880 | tsurugidb
 public | fdw_test_table_0881 | tsurugidb
 public | fdw_test_table_0882 | tsurugidb
 public | fdw_test_table_0883 | tsurugidb
 public | fdw_test_table_0884 | tsurugidb
 public | fdw_test_table_0885 | tsurugidb
 public | fdw_test_table_0886 | tsurugidb
 public | fdw_test_table_0887 | tsurugidb
 public | fdw_test_table_0888 | tsurugidb
 public | fdw_test_table_0889 | tsurugidb
 public | fdw_test_table_0890 | tsurugidb
 public | fdw_test_table_0891 | tsurugidb
 public | fdw_test_table_0892 | tsurugidb
 public | fdw_test_table_0893 | tsurugidb
 public | fdw_test_table_0894 | tsurugidb
 public | fdw_test_table_0895 | tsurugidb
 public | fdw_test_table_0896 | tsurugidb
 public | fdw_test_table_0897 | tsurugidb
 public | fdw_test_table_0898 | tsurugidb
 public | fdw_test_table_0899 | tsurugidb
 public | fdw_test_table_0900 | tsurugidb
 public | fdw_test_table_0901 | tsurugidb
 public | fdw_test_table_0902 | tsurugidb
 public | fdw_test_table_0903 | tsurugidb
 public | fdw_test_table_0904 | tsurugidb
 public | fdw_test_table_0905 | tsurugidb
 public | fdw_test_table_0906 | tsurugidb
 public | fdw_test_table_0907 | tsurugidb
 public | fdw_test_table_0908 | tsurugidb
 public | fdw_test_table_0909 | tsurugidb
 public | fdw_test_table_0910 | tsurugidb
 public | fdw_test_table_0911 | tsurugidb
 public | fdw_test_table_0912 | tsurugidb
 public | fdw_test_table_0913 | tsurugidb
 public | fdw_test_table_0914 | tsurugidb
 public | fdw_test_table_0915 | tsurugidb
 public | fdw_test_table_0916 | tsurugidb
 public | fdw_test_table_0917 | tsurugidb
 public | fdw_test_table_0918 | tsurugidb
 public | fdw_test_table_0919 | tsurugidb
 public | fdw_test_table_0920 | tsurugidb
 public | fdw_test_table_0921 | tsurugidb
 public | fdw_test_table_0922 | tsurugidb
 public | fdw_test_table_0923 | tsurugidb
 public | fdw_test_table_0924 | tsurugidb
 public | fdw_test_table_0925 | tsurugidb
 public | fdw_test_table_0926 | tsurugidb
 public | fdw_test_table_0927 | tsurugidb
 public | fdw_test_table_0928 | tsurugidb
 public | fdw_test_table_0929 | tsurugidb
 public | fdw_test_table_0930 | tsurugidb
 public | fdw_test_table_0931 | tsurugidb
 public | fdw_test_table_0932 | tsurugidb
 public | fdw_test_table_0933 | tsurugidb
 public | fdw_test_table_0934 | tsurugidb
 public | fdw_test_table_0935 | tsurugidb
 public | fdw_test_table_0936 | tsurugidb
 public | fdw_test_table_0937 | tsurugidb
 public | fdw_test_table_0938 | tsurugidb
 public | fdw_test_table_0939 | tsurugidb
 public | fdw_test_table_0940 | tsurugidb
 public | fdw_test_table_0941 | tsurugidb
 public | fdw_test_table_0942 | tsurugidb
 public | fdw_test_table_0943 | tsurugidb
 public | fdw_test_table_0944 | tsurugidb
 public | fdw_test_table_0945 | tsurugidb
 public | fdw_test_table_0946 | tsurugidb
 public | fdw_test_table_0947 | tsurugidb
 public | fdw_test_table_0948 | tsurugidb
 public | fdw_test_table_0949 | tsurugidb
 public | fdw_test_table_0950 | tsurugidb
 public | fdw_test_table_0951 | tsurugidb
 public | fdw_test_table_0952 | tsurugidb
 public | fdw_test_table_0953 | tsurugidb
 public | fdw_test_table_0954 | tsurugidb
 public | fdw_test_table_0955 | tsurugidb
 public | fdw_test_table_0956 | tsurugidb
 public | fdw_test_table_0957 | tsurugidb
 public | fdw_test_table_0958 | tsurugidb
 public | fdw_test_table_0959 | tsurugidb
 public | fdw_test_table_0960 | tsurugidb
 public | fdw_test_table_0961 | tsurugidb
 public | fdw_test_table_0962 | tsurugidb
 public | fdw_test_table_0963 | tsurugidb
 public | fdw_test_table_0964 | tsurugidb
 public | fdw_test_table_0965 | tsurugidb
 public | fdw_test_table_0966 | tsurugidb
 public | fdw_test_table_0967 | tsurugidb
 public | fdw_test_table_0968 | tsurugidb
 public | fdw_test_table_0969 | tsurugidb
 public | fdw_test_table_0970 | tsurugidb
 public | fdw_test_table_0971 | tsurugidb
 public | fdw_test_table_0972 | tsurugidb
 public | fdw_test_table_0973 | tsurugidb
 public | fdw_test_table_0974 | tsurugidb
 public | fdw_test_table_0975 | tsurugidb
 public | fdw_test_table_0976 | tsurugidb
 public | fdw_test_table_0977 | tsurugidb
 public | fdw_test_table_0978 | tsurugidb
 public | fdw_test_table_0979 | tsurugidb
 public | fdw_test_table_0980 | tsurugidb
 public | fdw_test_table_0981 | tsurugidb
 public | fdw_test_table_0982 | tsurugidb
 public | fdw_test_table_0983 | tsurugidb
 public | fdw_test_table_0984 | tsurugidb
 public | fdw_test_table_0985 | tsurugidb
 public | fdw_test_table_0986 | tsurugidb
 public | fdw_test_table_0987 | tsurugidb
 public | fdw_test_table_0988 | tsurugidb
 public | fdw_test_table_0989 | tsurugidb
 public | fdw_test_table_0990 | tsurugidb
 public | fdw_test_table_0991 | tsurugidb
 public | fdw_test_table_0992 | tsurugidb
 public | fdw_test_table_0993 | tsurugidb
 public | fdw_test_table_0994 | tsurugidb
 public | fdw_test_table_0995 | tsurugidb
 public | fdw_test_table_0996 | tsurugidb
 public | fdw_test_table_0997 | tsurugidb
 public | fdw_test_table_0998 | tsurugidb
 public | fdw_test_table_0999 | tsurugidb
 public | fdw_test_table_1000 | tsurugidb
(1000 rows)

\d fdw_test_table_0001
           Foreign table "public.fdw_test_table_0001"
 Column |  Type   | Collation | Nullable | Default | FDW options 
--------+---------+-----------+----------+---------+-------------
 col_1  | integer |           |          |         | 
 col_2  | integer |           |          |         | 
 col_3  | integer |           |          |         | 
 col_4  | integer |           |          |         | 
 col_5  | integer |           |          |         | 
 col_6  | integer |           |          |         | 
 col_7  | integer |           |          |         | 
 col_8  | integer |           |          |         | 
 col_9  | integer |           |          |         | 
 col_10 | integer |           |          |         | 
 col_11 | integer |           |          |         | 
 col_12 | integer |           |          |         | 
 col_13 | integer |           |          |         | 
 col_14 | integer |           |          |         | 
 col_15 | integer |           |          |         | 
 col_16 | integer |           |          |         | 
 col_17 | integer |           |          |         | 
 col_18 | integer |           |          |         | 
 col_19 | integer |           |          |         | 
 col_20 | integer |           |          |         | 
 col_21 | integer |           |          |         | 
 col_22 | integer |           |          |         | 
 col_23 | integer |           |          |         | 
 col_24 | integer |           |          |         | 
 col_25 | integer |           |          |         | 
 col_26 | integer |           |          |         | 
 col_27 | integer |           |          |         | 
 col_28 | integer |           |          |         | 
 col_29 | integer |           |          |         | 
 col_30 | integer |           |          |         | 
 col_31 | integer |           |          |         | 
 col_32 | integer |           |          |         | 
 col_33 | integer |           |          |         | 
 col_34 | integer |           |          |         | 
 col_35 | integer |           |          |         | 
 col_36 | integer |           |          |         | 
 col_37 | integer |           |          |         | 
 col_38 | integer |           |          |         | 
 col_39 | integer |           |          |         | 
 col_40 | integer |           |          |         | 
 col_41 | integer |           |          |         | 
 col_42 | integer |           |          |         | 
 col_43 | integer |           |          |         | 
 col_44 | integer |           |          |         | 
 col_45 | integer |           |          |         | 
 col_46 | integer |           |          |         | 
 col_47 | integer |           |          |         | 
 col_48 | integer |           |          |         | 
 col_49 | integer |           |          |         | 
 col_50 | integer |           |          |         | 
Server: tsurugidb

\d fdw_test_table_0050
           Foreign table "public.fdw_test_table_0050"
 Column |  Type   | Collation | Nullable | Default | FDW options 
--------+---------+-----------+----------+---------+-------------
 col_1  | integer |           |          |         | 
 col_2  | integer |           |          |         | 
 col_3  | integer |           |          |         | 
 col_4  | integer |           |          |         | 
 col_5  | integer |           |          |         | 
 col_6  | integer |           |          |         | 
 col_7  | integer |           |          |         | 
 col_8  | integer |           |          |         | 
 col_9  | integer |           |          |         | 
 col_10 | integer |           |          |         | 
 col_11 | integer |           |          |         | 
 col_12 | integer |           |          |         | 
 col_13 | integer |           |          |         | 
 col_14 | integer |           |          |         | 
 col_15 | integer |           |          |         | 
 col_16 | integer |           |          |         | 
 col_17 | integer |           |          |         | 
 col_18 | integer |           |          |         | 
 col_19 | integer |           |          |         | 
 col_20 | integer |           |          |         | 
 col_21 | integer |           |          |         | 
 col_22 | integer |           |          |         | 
 col_23 | integer |           |          |         | 
 col_24 | integer |           |          |         | 
 col_25 | integer |           |          |         | 
 col_26 | integer |           |          |         | 
 col_27 | integer |           |          |         | 
 col_28 | integer |           |          |         | 
 col_29 | integer |           |          |         | 
 col_30 | integer |           |          |         | 
 col_31 | integer |           |          |         | 
 col_32 | integer |           |          |         | 
 col_33 | integer |           |          |         | 
 col_34 | integer |           |          |         | 
 col_35 | integer |           |          |         | 
 col_36 | integer |           |          |         | 
 col_37 | integer |           |          |         | 
 col_38 | integer |           |          |         | 
 col_39 | integer |           |          |         | 
 col_40 | integer |           |          |         | 
 col_41 | integer |           |          |         | 
 col_42 | integer |           |          |         | 
 col_43 | integer |           |          |         | 
 col_44 | integer |           |          |         | 
 col_45 | integer |           |          |         | 
 col_46 | integer |           |          |         | 
 col_47 | integer |           |          |         | 
 col_48 | integer |           |          |         | 
 col_49 | integer |           |          |         | 
 col_50 | integer |           |          |         | 
Server: tsurugidb

\d fdw_test_table_0256
           Foreign table "public.fdw_test_table_0256"
 Column |  Type   | Collation | Nullable | Default | FDW options 
--------+---------+-----------+----------+---------+-------------
 col_1  | integer |           |          |         | 
 col_2  | integer |           |          |         | 
 col_3  | integer |           |          |         | 
 col_4  | integer |           |          |         | 
 col_5  | integer |           |          |         | 
 col_6  | integer |           |          |         | 
 col_7  | integer |           |          |         | 
 col_8  | integer |           |          |         | 
 col_9  | integer |           |          |         | 
 col_10 | integer |           |          |         | 
 col_11 | integer |           |          |         | 
 col_12 | integer |           |          |         | 
 col_13 | integer |           |          |         | 
 col_14 | integer |           |          |         | 
 col_15 | integer |           |          |         | 
 col_16 | integer |           |          |         | 
 col_17 | integer |           |          |         | 
 col_18 | integer |           |          |         | 
 col_19 | integer |           |          |         | 
 col_20 | integer |           |          |         | 
 col_21 | integer |           |          |         | 
 col_22 | integer |           |          |         | 
 col_23 | integer |           |          |         | 
 col_24 | integer |           |          |         | 
 col_25 | integer |           |          |         | 
 col_26 | integer |           |          |         | 
 col_27 | integer |           |          |         | 
 col_28 | integer |           |          |         | 
 col_29 | integer |           |          |         | 
 col_30 | integer |           |          |         | 
 col_31 | integer |           |          |         | 
 col_32 | integer |           |          |         | 
 col_33 | integer |           |          |         | 
 col_34 | integer |           |          |         | 
 col_35 | integer |           |          |         | 
 col_36 | integer |           |          |         | 
 col_37 | integer |           |          |         | 
 col_38 | integer |           |          |         | 
 col_39 | integer |           |          |         | 
 col_40 | integer |           |          |         | 
 col_41 | integer |           |          |         | 
 col_42 | integer |           |          |         | 
 col_43 | integer |           |          |         | 
 col_44 | integer |           |          |         | 
 col_45 | integer |           |          |         | 
 col_46 | integer |           |          |         | 
 col_47 | integer |           |          |         | 
 col_48 | integer |           |          |         | 
 col_49 | integer |           |          |         | 
 col_50 | integer |           |          |         | 
Server: tsurugidb

\d fdw_test_table_0512
           Foreign table "public.fdw_test_table_0512"
 Column |  Type   | Collation | Nullable | Default | FDW options 
--------+---------+-----------+----------+---------+-------------
 col_1  | integer |           |          |         | 
 col_2  | integer |           |          |         | 
 col_3  | integer |           |          |         | 
 col_4  | integer |           |          |         | 
 col_5  | integer |           |          |         | 
 col_6  | integer |           |          |         | 
 col_7  | integer |           |          |         | 
 col_8  | integer |           |          |         | 
 col_9  | integer |           |          |         | 
 col_10 | integer |           |          |         | 
 col_11 | integer |           |          |         | 
 col_12 | integer |           |          |         | 
 col_13 | integer |           |          |         | 
 col_14 | integer |           |          |         | 
 col_15 | integer |           |          |         | 
 col_16 | integer |           |          |         | 
 col_17 | integer |           |          |         | 
 col_18 | integer |           |          |         | 
 col_19 | integer |           |          |         | 
 col_20 | integer |           |          |         | 
 col_21 | integer |           |          |         | 
 col_22 | integer |           |          |         | 
 col_23 | integer |           |          |         | 
 col_24 | integer |           |          |         | 
 col_25 | integer |           |          |         | 
 col_26 | integer |           |          |         | 
 col_27 | integer |           |          |         | 
 col_28 | integer |           |          |         | 
 col_29 | integer |           |          |         | 
 col_30 | integer |           |          |         | 
 col_31 | integer |           |          |         | 
 col_32 | integer |           |          |         | 
 col_33 | integer |           |          |         | 
 col_34 | integer |           |          |         | 
 col_35 | integer |           |          |         | 
 col_36 | integer |           |          |         | 
 col_37 | integer |           |          |         | 
 col_38 | integer |           |          |         | 
 col_39 | integer |           |          |         | 
 col_40 | integer |           |          |         | 
 col_41 | integer |           |          |         | 
 col_42 | integer |           |          |         | 
 col_43 | integer |           |          |         | 
 col_44 | integer |           |          |         | 
 col_45 | integer |           |          |         | 
 col_46 | integer |           |          |         | 
 col_47 | integer |           |          |         | 
 col_48 | integer |           |          |         | 
 col_49 | integer |           |          |         | 
 col_50 | integer |           |          |         | 
Server: tsurugidb

\d fdw_test_table_0999
           Foreign table "public.fdw_test_table_0999"
 Column |  Type   | Collation | Nullable | Default | FDW options 
--------+---------+-----------+----------+---------+-------------
 col_1  | integer |           |          |         | 
 col_2  | integer |           |          |         | 
 col_3  | integer |           |          |         | 
 col_4  | integer |           |          |         | 
 col_5  | integer |           |          |         | 
 col_6  | integer |           |          |         | 
 col_7  | integer |           |          |         | 
 col_8  | integer |           |          |         | 
 col_9  | integer |           |          |         | 
 col_10 | integer |           |          |         | 
 col_11 | integer |           |          |         | 
 col_12 | integer |           |          |         | 
 col_13 | integer |           |          |         | 
 col_14 | integer |           |          |         | 
 col_15 | integer |           |          |         | 
 col_16 | integer |           |          |         | 
 col_17 | integer |           |          |         | 
 col_18 | integer |           |          |         | 
 col_19 | integer |           |          |         | 
 col_20 | integer |           |          |         | 
 col_21 | integer |           |          |         | 
 col_22 | integer |           |          |         | 
 col_23 | integer |           |          |         | 
 col_24 | integer |           |          |         | 
 col_25 | integer |           |          |         | 
 col_26 | integer |           |          |         | 
 col_27 | integer |           |          |         | 
 col_28 | integer |           |          |         | 
 col_29 | integer |           |          |         | 
 col_30 | integer |           |          |         | 
 col_31 | integer |           |          |         | 
 col_32 | integer |           |          |         | 
 col_33 | integer |           |          |         | 
 col_34 | integer |           |          |         | 
 col_35 | integer |           |          |         | 
 col_36 | integer |           |          |         | 
 col_37 | integer |           |          |         | 
 col_38 | integer |           |          |         | 
 col_39 | integer |           |          |         | 
 col_40 | integer |           |          |         | 
 col_41 | integer |           |          |         | 
 col_42 | integer |           |          |         | 
 col_43 | integer |           |          |         | 
 col_44 | integer |           |          |         | 
 col_45 | integer |           |          |         | 
 col_46 | integer |           |          |         | 
 col_47 | integer |           |          |         | 
 col_48 | integer |           |          |         | 
 col_49 | integer |           |          |         | 
 col_50 | integer |           |          |         | 
Server: tsurugidb

\d fdw_test_table_1000
           Foreign table "public.fdw_test_table_1000"
 Column |  Type   | Collation | Nullable | Default | FDW options 
--------+---------+-----------+----------+---------+-------------
 col_1  | integer |           |          |         | 
 col_2  | integer |           |          |         | 
 col_3  | integer |           |          |         | 
 col_4  | integer |           |          |         | 
 col_5  | integer |           |          |         | 
 col_6  | integer |           |          |         | 
 col_7  | integer |           |          |         | 
 col_8  | integer |           |          |         | 
 col_9  | integer |           |          |         | 
 col_10 | integer |           |          |         | 
 col_11 | integer |           |          |         | 
 col_12 | integer |           |          |         | 
 col_13 | integer |           |          |         | 
 col_14 | integer |           |          |         | 
 col_15 | integer |           |          |         | 
 col_16 | integer |           |          |         | 
 col_17 | integer |           |          |         | 
 col_18 | integer |           |          |         | 
 col_19 | integer |           |          |         | 
 col_20 | integer |           |          |         | 
 col_21 | integer |           |          |         | 
 col_22 | integer |           |          |         | 
 col_23 | integer |           |          |         | 
 col_24 | integer |           |          |         | 
 col_25 | integer |           |          |         | 
 col_26 | integer |           |          |         | 
 col_27 | integer |           |          |         | 
 col_28 | integer |           |          |         | 
 col_29 | integer |           |          |         | 
 col_30 | integer |           |          |         | 
 col_31 | integer |           |          |         | 
 col_32 | integer |           |          |         | 
 col_33 | integer |           |          |         | 
 col_34 | integer |           |          |         | 
 col_35 | integer |           |          |         | 
 col_36 | integer |           |          |         | 
 col_37 | integer |           |          |         | 
 col_38 | integer |           |          |         | 
 col_39 | integer |           |          |         | 
 col_40 | integer |           |          |         | 
 col_41 | integer |           |          |         | 
 col_42 | integer |           |          |         | 
 col_43 | integer |           |          |         | 
 col_44 | integer |           |          |         | 
 col_45 | integer |           |          |         | 
 col_46 | integer |           |          |         | 
 col_47 | integer |           |          |         | 
 col_48 | integer |           |          |         | 
 col_49 | integer |           |          |         | 
 col_50 | integer |           |          |         | 
Server: tsurugidb

-- Test teardown: DDL of the PostgreSQL
SELECT drop_foreign_tables();
 drop_foreign_tables 
---------------------
 DROP FOREIGN TABLE
(1 row)

-- Test teardown: DDL of the Tsurugi
DO $$
DECLARE
    TABLE_MAX CONSTANT INT := 1000;
    i INT;
BEGIN
    FOR i IN 1..TABLE_MAX LOOP
        EXECUTE format(
            'SELECT tg_execute_ddl(''DROP TABLE IF EXISTS fdw_test_table_%s'', ''tsurugidb'')',
            to_char(i, 'FM0000'));
    END LOOP;
END $$;
