/* Test setup: DDL of the Tsurugi */
SELECT tg_execute_ddl('
    CREATE TABLE weather (
        id       int primary key,
        city     varchar(80),
        temp_lo  int,
        temp_hi  int,
        prcp     real,
        the_date date default DATE ''2023-04-01''
    )
', 'tsurugidb');
 tg_execute_ddl 
----------------
 CREATE TABLE
(1 row)

/* Test setup: DDL of the PostgreSQL */
CREATE FOREIGN TABLE weather (
    id       int,
    city     varchar(80),
    temp_lo  int,           -- 最低気温
    temp_hi  int,           -- 最高気温
    prcp     real,          -- 降水量
    the_date date default '2023-04-01'
) SERVER tsurugidb;
/* SET DATASTYLE */
SET datestyle TO ISO, ymd;
/* データの挿入 */
INSERT INTO weather (id, city, temp_lo, temp_hi, prcp)
    VALUES (1, 'San Francisco', 46, 50, 0.25);
INSERT INTO weather (temp_lo, temp_hi, prcp, id, city)
    VALUES (43, 57, 0.0, 2, 'San Francisco');
INSERT INTO weather (id, city, temp_lo, temp_hi)
    VALUES (3, 'Hayward', 54, 37);
/* データの問い合わせ */
SELECT * from weather;
 id |     city      | temp_lo | temp_hi | prcp |  the_date  
----+---------------+---------+---------+------+------------
  1 | San Francisco |      46 |      50 | 0.25 | 2023-04-01
  2 | San Francisco |      43 |      57 |    0 | 2023-04-01
  3 | Hayward       |      54 |      37 |      | 2023-04-01
(3 rows)

/* データの更新 */
UPDATE weather
    SET temp_hi = temp_hi - 2,  temp_lo = temp_lo - 2
    WHERE city = 'Hayward';
select * from weather;
 id |     city      | temp_lo | temp_hi | prcp |  the_date  
----+---------------+---------+---------+------+------------
  1 | San Francisco |      46 |      50 | 0.25 | 2023-04-01
  2 | San Francisco |      43 |      57 |    0 | 2023-04-01
  3 | Hayward       |      52 |      35 |      | 2023-04-01
(3 rows)

/* データの削除 */
DELETE FROM weather WHERE city = 'Hayward';
select * from weather;
 id |     city      | temp_lo | temp_hi | prcp |  the_date  
----+---------------+---------+---------+------+------------
  1 | San Francisco |      46 |      50 | 0.25 | 2023-04-01
  2 | San Francisco |      43 |      57 |    0 | 2023-04-01
(2 rows)

/* データベースロールの作成 */
CREATE ROLE jonathan;
/* アクセス権の付与 */
GRANT SELECT ON weather TO jonathan;    -- Tsurugiテーブルにアクセス権を付与します
/* Tsurugiテーブルのアクセス制御 */
SET ROLE jonathan;          -- 確認のためカレントのデータベースロールを変更します
SELECT * from weather;      -- 問い合わせの操作は成功します
 id |     city      | temp_lo | temp_hi | prcp |  the_date  
----+---------------+---------+---------+------+------------
  1 | San Francisco |      46 |      50 | 0.25 | 2023-04-01
  2 | San Francisco |      43 |      57 |    0 | 2023-04-01
(2 rows)

DELETE FROM weather WHERE city = 'San Francisco'; -- 問い合わせ以外の操作は失敗します
ERROR:  permission denied for foreign table weather
RESET ROLE;                 -- 現在のデータベースロールを元に戻します
/* アクセス権の剥奪 */
REVOKE SELECT ON weather FROM jonathan;
/* データベースロールの削除 */
DROP ROLE jonathan;
/* 明示的にトランザクションブロックを開始する */
BEGIN;
INSERT INTO weather (id, city, temp_lo, temp_hi, prcp)  --  Tsurugiテーブルを操作する
    VALUES (4, 'Los Angeles', 64, 82, 0.0);
COMMIT;     --  トランザクション終了
SELECT * FROM weather ORDER BY id;  -- レグレッションテスト確認用
 id |     city      | temp_lo | temp_hi | prcp |  the_date  
----+---------------+---------+---------+------+------------
  1 | San Francisco |      46 |      50 | 0.25 | 2023-04-01
  2 | San Francisco |      43 |      57 |    0 | 2023-04-01
  4 | Los Angeles   |      64 |      82 |    0 | 2023-04-01
(3 rows)

BEGIN;
INSERT INTO weather (id, city, temp_lo, temp_hi, prcp)
    VALUES (5, 'Oakland', 48, 53, 0.5);
SELECT * FROM weather ORDER BY id;
 id |     city      | temp_lo | temp_hi | prcp |  the_date  
----+---------------+---------+---------+------+------------
  1 | San Francisco |      46 |      50 | 0.25 | 2023-04-01
  2 | San Francisco |      43 |      57 |    0 | 2023-04-01
  4 | Los Angeles   |      64 |      82 |    0 | 2023-04-01
  5 | Oakland       |      48 |      53 |  0.5 | 2023-04-01
(4 rows)

COMMIT;  -- トランザクション終了
BEGIN;
SELECT * FROM weather ORDER BY id;
 id |     city      | temp_lo | temp_hi | prcp |  the_date  
----+---------------+---------+---------+------+------------
  1 | San Francisco |      46 |      50 | 0.25 | 2023-04-01
  2 | San Francisco |      43 |      57 |    0 | 2023-04-01
  4 | Los Angeles   |      64 |      82 |    0 | 2023-04-01
  5 | Oakland       |      48 |      53 |  0.5 | 2023-04-01
(4 rows)

SELECT * FROM weather ORDER BY id;
 id |     city      | temp_lo | temp_hi | prcp |  the_date  
----+---------------+---------+---------+------+------------
  1 | San Francisco |      46 |      50 | 0.25 | 2023-04-01
  2 | San Francisco |      43 |      57 |    0 | 2023-04-01
  4 | Los Angeles   |      64 |      82 |    0 | 2023-04-01
  5 | Oakland       |      48 |      53 |  0.5 | 2023-04-01
(4 rows)

COMMIT;     --  トランザクション終了
BEGIN;
INSERT INTO weather (id, city, temp_lo, temp_hi, prcp)
    VALUES (6, 'San Jose', 46, 55, 0.0);
COMMIT;     --  トランザクション終了
SELECT * FROM weather ORDER BY id;  -- レグレッションテスト確認用
 id |     city      | temp_lo | temp_hi | prcp |  the_date  
----+---------------+---------+---------+------+------------
  1 | San Francisco |      46 |      50 | 0.25 | 2023-04-01
  2 | San Francisco |      43 |      57 |    0 | 2023-04-01
  4 | Los Angeles   |      64 |      82 |    0 | 2023-04-01
  5 | Oakland       |      48 |      53 |  0.5 | 2023-04-01
  6 | San Jose      |      46 |      55 |    0 | 2023-04-01
(5 rows)

/* 暗黙的にトランザクションを開始する */
INSERT INTO weather (id, city, temp_lo, temp_hi, prcp)
    VALUES (7, 'Sacramento', 48, 60, 0.25);  --  暗黙的にトランザクションが開始し、コミットされる（COMMIT文不要）
SELECT * FROM weather ORDER BY id;  -- レグレッションテスト確認用
 id |     city      | temp_lo | temp_hi | prcp |  the_date  
----+---------------+---------+---------+------+------------
  1 | San Francisco |      46 |      50 | 0.25 | 2023-04-01
  2 | San Francisco |      43 |      57 |    0 | 2023-04-01
  4 | Los Angeles   |      64 |      82 |    0 | 2023-04-01
  5 | Oakland       |      48 |      53 |  0.5 | 2023-04-01
  6 | San Jose      |      46 |      55 |    0 | 2023-04-01
  7 | Sacramento    |      48 |      60 | 0.25 | 2023-04-01
(6 rows)

BEGIN;
UPDATE weather
    SET temp_hi = temp_hi - 10 WHERE city = 'Sacramento';
SELECT * FROM weather ORDER BY id;  -- レグレッションテスト確認用
 id |     city      | temp_lo | temp_hi | prcp |  the_date  
----+---------------+---------+---------+------+------------
  1 | San Francisco |      46 |      50 | 0.25 | 2023-04-01
  2 | San Francisco |      43 |      57 |    0 | 2023-04-01
  4 | Los Angeles   |      64 |      82 |    0 | 2023-04-01
  5 | Oakland       |      48 |      53 |  0.5 | 2023-04-01
  6 | San Jose      |      46 |      55 |    0 | 2023-04-01
  7 | Sacramento    |      48 |      50 | 0.25 | 2023-04-01
(6 rows)

ROLLBACK;   --  UPDATE文の更新内容は破棄されるが、上記のINSERT文の更新内容は破棄されない
SELECT * FROM weather ORDER BY id;  -- レグレッションテスト確認用
 id |     city      | temp_lo | temp_hi | prcp |  the_date  
----+---------------+---------+---------+------+------------
  1 | San Francisco |      46 |      50 | 0.25 | 2023-04-01
  2 | San Francisco |      43 |      57 |    0 | 2023-04-01
  4 | Los Angeles   |      64 |      82 |    0 | 2023-04-01
  5 | Oakland       |      48 |      53 |  0.5 | 2023-04-01
  6 | San Jose      |      46 |      55 |    0 | 2023-04-01
  7 | Sacramento    |      48 |      60 | 0.25 | 2023-04-01
(6 rows)

BEGIN;
INSERT INTO weather (id, city, temp_lo, temp_hi)
    VALUES (3, 'Hayward', 37, 54);
UPDATE weather SET temp_hi = temp_hi + 5 WHERE city = 'Oakland';
DELETE FROM weather WHERE id = 2;
SELECT * FROM weather ORDER BY id;
 id |     city      | temp_lo | temp_hi | prcp |  the_date  
----+---------------+---------+---------+------+------------
  1 | San Francisco |      46 |      50 | 0.25 | 2023-04-01
  3 | Hayward       |      37 |      54 |      | 2023-04-01
  4 | Los Angeles   |      64 |      82 |    0 | 2023-04-01
  5 | Oakland       |      48 |      58 |  0.5 | 2023-04-01
  6 | San Jose      |      46 |      55 |    0 | 2023-04-01
  7 | Sacramento    |      48 |      60 | 0.25 | 2023-04-01
(6 rows)

COMMIT;             -- トランザクション終了
/* プリペアド文 */
PREPARE add_weather (int, varchar(80), int, int, real, date)
    AS INSERT INTO weather (id, city, temp_lo, temp_hi, prcp, the_date)
            VALUES ($1, $2, $3, $4, $5, $6);
EXECUTE add_weather (8, 'San Diego', 41, 57, 0.25, '2023-11-24'); -- 日付固定
SELECT * FROM weather ORDER BY id;  -- レグレッションテスト確認用
 id |     city      | temp_lo | temp_hi | prcp |  the_date  
----+---------------+---------+---------+------+------------
  1 | San Francisco |      46 |      50 | 0.25 | 2023-04-01
  3 | Hayward       |      37 |      54 |      | 2023-04-01
  4 | Los Angeles   |      64 |      82 |    0 | 2023-04-01
  5 | Oakland       |      48 |      58 |  0.5 | 2023-04-01
  6 | San Jose      |      46 |      55 |    0 | 2023-04-01
  7 | Sacramento    |      48 |      60 | 0.25 | 2023-04-01
  8 | San Diego     |      41 |      57 | 0.25 | 2023-11-24
(7 rows)

/* Test teardown: DDL of the PostgreSQL */
DROP FOREIGN TABLE weather;
/* Test teardown: DDL of the Tsurugi */
SELECT tg_execute_ddl('DROP TABLE weather', 'tsurugidb');
 tg_execute_ddl 
----------------
 DROP TABLE
(1 row)

