/* Test case: happy path - Case sensitivity (preparation) */
-- Test setup: DDL of the Tsurugi
SELECT tg_execute_ddl('
  CREATE TABLE fdw_case_table (
    col INT,
    Col INT
  )
', 'tsurugidb');
 tg_execute_ddl 
----------------
 CREATE TABLE
(1 row)

-- Test setup: DDL of the PostgreSQL
CREATE FOREIGN TABLE fdw_case_table (
  col integer,
  "Col" integer
) SERVER tsurugidb;
-- Test
PREPARE fdw_prepare_ins (integer, integer) AS
  INSERT INTO fdw_case_table VALUES ($1, $2);
EXECUTE fdw_prepare_ins (1000, 1);
DEALLOCATE fdw_prepare_ins;
PREPARE fdw_prepare_ins (integer, integer) AS
  INSERT INTO public.fdw_case_table (col, "Col") VALUES ($1, $2);
EXECUTE fdw_prepare_ins (2000, 2);
DEALLOCATE fdw_prepare_ins;
PREPARE fdw_prepare_ins (integer) AS
  INSERT INTO "public".fdw_case_table (col) VALUES ($1);
EXECUTE fdw_prepare_ins (3000);
DEALLOCATE fdw_prepare_ins;
PREPARE fdw_prepare_ins (integer) AS
  INSERT INTO "public"."fdw_case_table" (Col) VALUES ($1);
EXECUTE fdw_prepare_ins (4000);
DEALLOCATE fdw_prepare_ins;
PREPARE fdw_prepare_ins (integer) AS
  INSERT INTO Public.fdw_case_table ("col") VALUES ($1);
EXECUTE fdw_prepare_ins (5000);
DEALLOCATE fdw_prepare_ins;
PREPARE fdw_prepare_ins (integer) AS
  INSERT INTO PUBLIC.fdw_case_table ("Col") VALUES ($1);
EXECUTE fdw_prepare_ins (6);
DEALLOCATE fdw_prepare_ins;
PREPARE fdw_prepare_sel AS
  SELECT * FROM public.fdw_case_table ORDER BY col, Col DESC;
EXECUTE fdw_prepare_sel;
 col  | Col 
------+-----
      |   6
 1000 |   1
 2000 |   2
 3000 |    
 4000 |    
 5000 |    
(6 rows)

DEALLOCATE fdw_prepare_sel;
PREPARE fdw_prepare_upd (integer) AS
  UPDATE fdw_case_table SET col = col + $1;
EXECUTE fdw_prepare_upd (100);
DEALLOCATE fdw_prepare_upd;
PREPARE fdw_prepare_upd (integer) AS
  UPDATE public.fdw_case_table SET Col = Col + $1;
EXECUTE fdw_prepare_upd (10);
DEALLOCATE fdw_prepare_upd;
PREPARE fdw_prepare_upd (integer) AS
  UPDATE "public".fdw_case_table SET "col" = "col" + 100 WHERE col > $1;
EXECUTE fdw_prepare_upd (5000);
DEALLOCATE fdw_prepare_upd;
PREPARE fdw_prepare_upd (integer) AS
  UPDATE public."fdw_case_table" SET "Col" = "Col" + $1 WHERE "Col" < 10;
EXECUTE fdw_prepare_upd (10);
DEALLOCATE fdw_prepare_upd;
PREPARE fdw_prepare_upd (integer, integer) AS
  UPDATE "public"."fdw_case_table" SET "col" = col + $1 WHERE "col" > $2;
EXECUTE fdw_prepare_upd (100, 3000);
DEALLOCATE fdw_prepare_upd;
PREPARE fdw_prepare_upd AS
  UPDATE public.Fdw_Case_Table SET "col" = NULL WHERE "Col" = $1;
EXECUTE fdw_prepare_upd (16);
DEALLOCATE fdw_prepare_upd;
PREPARE fdw_prepare_upd AS
  UPDATE Public.fdw_case_table SET "col" = "Col" * 10 WHERE col IS NULL;
EXECUTE fdw_prepare_upd;
DEALLOCATE fdw_prepare_upd;
PREPARE fdw_prepare_upd (integer) AS
  UPDATE PUBLIC.fdw_case_table SET "Col" = Col / $1 WHERE "Col" IS NULL;
EXECUTE fdw_prepare_upd (100);
DEALLOCATE fdw_prepare_upd;
PREPARE fdw_prepare_sel AS SELECT * FROM fdw_case_table ORDER BY col;
EXECUTE fdw_prepare_sel;
 col  | Col 
------+-----
  160 |  16
 1110 |  11
 2110 |  12
 3210 |  32
 4210 |  42
 5310 |  53
(6 rows)

DEALLOCATE fdw_prepare_sel;
PREPARE fdw_prepare_sel AS SELECT * FROM Public.fdw_case_table ORDER BY Col;
EXECUTE fdw_prepare_sel;
 col  | Col 
------+-----
  160 |  16
 1110 |  11
 2110 |  12
 3210 |  32
 4210 |  42
 5310 |  53
(6 rows)

DEALLOCATE fdw_prepare_sel;
PREPARE fdw_prepare_del (integer) AS
  DELETE FROM fdw_case_table WHERE col = $1;
EXECUTE fdw_prepare_del (1110);
DEALLOCATE fdw_prepare_del;
PREPARE fdw_prepare_del (integer) AS
  DELETE FROM public.fdw_case_table WHERE "col" > $1;
EXECUTE fdw_prepare_del (5000);
DEALLOCATE fdw_prepare_del;
PREPARE fdw_prepare_del (integer) AS
  DELETE FROM "public".fdw_case_table WHERE Col <= $1;
EXECUTE fdw_prepare_del (160);
DEALLOCATE fdw_prepare_del;
PREPARE fdw_prepare_del (integer) AS
  DELETE FROM public."fdw_case_table" WHERE "col" >= $1;
EXECUTE fdw_prepare_del (4200);
DEALLOCATE fdw_prepare_del;
PREPARE fdw_prepare_del AS
  DELETE FROM "public"."fdw_case_table" WHERE "Col" > 30;
EXECUTE fdw_prepare_del;
DEALLOCATE fdw_prepare_del;
PREPARE fdw_prepare_del (integer) AS
  DELETE FROM Public.fdw_case_table WHERE col <> $1;
EXECUTE fdw_prepare_del (2110);
DEALLOCATE fdw_prepare_del;
PREPARE fdw_prepare_del (integer) AS
  DELETE FROM PUBLIC.fdw_case_table WHERE Col = $1;
EXECUTE fdw_prepare_del (12);
DEALLOCATE fdw_prepare_del;
PREPARE fdw_prepare_sel AS SELECT * FROM Public.fdw_case_table;
EXECUTE fdw_prepare_sel;
 col  | Col 
------+-----
 2110 |  12
(1 row)

DEALLOCATE fdw_prepare_sel;
-- Test teardown: DDL of the PostgreSQL
DROP FOREIGN TABLE fdw_case_table;
-- Test teardown: DDL of the Tsurugi
SELECT tg_execute_ddl('DROP TABLE fdw_case_table', 'tsurugidb');
 tg_execute_ddl 
----------------
 DROP TABLE
(1 row)

