--
-- Tests for common table expressions (WITH query, ... SELECT ...)
--
-- Basic WITH
WITH q1(x,y) AS (SELECT 1,2)
SELECT * FROM q1, q1 AS q2;
 x | y | x | y 
---+---+---+---
 1 | 2 | 1 | 2
(1 row)

-- Multiple uses are evaluated only once
SELECT count(*) FROM (
  WITH q1(x) AS (SELECT random() FROM generate_series(1, 5))
    SELECT * FROM q1
  UNION
    SELECT * FROM q1
) ss;
 count 
-------
     5
(1 row)

-- WITH RECURSIVE
-- sum of 1..100
WITH RECURSIVE t(n) AS (
    VALUES (1)
UNION ALL
    SELECT n+1 FROM t WHERE n < 100
)
SELECT sum(n) FROM t;
 sum  
------
 5050
(1 row)

WITH RECURSIVE t(n) AS (
    SELECT (VALUES(1))
UNION ALL
    SELECT n+1 FROM t WHERE n < 5
)
SELECT * FROM t;
 n 
---
 1
 2
 3
 4
 5
(5 rows)

-- UNION DISTINCT requires hashable type
WITH RECURSIVE t(n) AS (
    VALUES ('01'::varbit)
UNION
    SELECT n || '10'::varbit FROM t WHERE n < '100'::varbit
)
SELECT n FROM t;
ERROR:  could not implement recursive UNION
DETAIL:  All column datatypes must be hashable.
-- recursive view
CREATE RECURSIVE VIEW nums (n) AS
    VALUES (1)
UNION ALL
    SELECT n+1 FROM nums WHERE n < 5;
SELECT * FROM nums;
 n 
---
 1
 2
 3
 4
 5
(5 rows)

CREATE OR REPLACE RECURSIVE VIEW nums (n) AS
    VALUES (1)
UNION ALL
    SELECT n+1 FROM nums WHERE n < 6;
SELECT * FROM nums;
 n 
---
 1
 2
 3
 4
 5
 6
(6 rows)

-- This is an infinite loop with UNION ALL, but not with UNION
WITH RECURSIVE t(n) AS (
    SELECT 1
UNION
    SELECT 10-n FROM t)
SELECT * FROM t;
 n 
---
 1
 9
(2 rows)

-- This'd be an infinite loop, but outside query reads only as much as needed
WITH RECURSIVE t(n) AS (
    VALUES (1)
UNION ALL
    SELECT n+1 FROM t)
SELECT * FROM t LIMIT 10;
 n  
----
  1
  2
  3
  4
  5
  6
  7
  8
  9
 10
(10 rows)

-- UNION case should have same property
WITH RECURSIVE t(n) AS (
    SELECT 1
UNION
    SELECT n+1 FROM t)
SELECT * FROM t LIMIT 10;
 n  
----
  1
  2
  3
  4
  5
  6
  7
  8
  9
 10
(10 rows)

-- Test behavior with an unknown-type literal in the WITH
WITH q AS (SELECT 'foo' AS x)
SELECT x, pg_typeof(x) FROM q;
  x  | pg_typeof 
-----+-----------
 foo | text
(1 row)

WITH RECURSIVE t(n) AS (
    SELECT 'foo'
UNION ALL
    SELECT n || ' bar' FROM t WHERE length(n) < 20
)
SELECT n, pg_typeof(n) FROM t;
            n            | pg_typeof 
-------------------------+-----------
 foo                     | text
 foo bar                 | text
 foo bar bar             | text
 foo bar bar bar         | text
 foo bar bar bar bar     | text
 foo bar bar bar bar bar | text
(6 rows)

-- In a perfect world, this would work and resolve the literal as int ...
-- but for now, we have to be content with resolving to text too soon.
WITH RECURSIVE t(n) AS (
    SELECT '7'
UNION ALL
    SELECT n+1 FROM t WHERE n < 10
)
SELECT n, pg_typeof(n) FROM t;
ERROR:  operator does not exist: text + integer
LINE 4:     SELECT n+1 FROM t WHERE n < 10
                    ^
HINT:  No operator matches the given name and argument types. You might need to add explicit type casts.
-- Deeply nested WITH caused a list-munging problem in v13
-- Detection of cross-references and self-references
WITH RECURSIVE w1(c1) AS
 (WITH w2(c2) AS
  (WITH w3(c3) AS
   (WITH w4(c4) AS
    (WITH w5(c5) AS
     (WITH RECURSIVE w6(c6) AS
      (WITH w6(c6) AS
       (WITH w8(c8) AS
        (SELECT 1)
        SELECT * FROM w8)
       SELECT * FROM w6)
      SELECT * FROM w6)
     SELECT * FROM w5)
    SELECT * FROM w4)
   SELECT * FROM w3)
  SELECT * FROM w2)
SELECT * FROM w1;
 c1 
----
  1
(1 row)

-- Detection of invalid self-references
WITH RECURSIVE outermost(x) AS (
 SELECT 1
 UNION (WITH innermost1 AS (
  SELECT 2
  UNION (WITH innermost2 AS (
   SELECT 3
   UNION (WITH innermost3 AS (
    SELECT 4
    UNION (WITH innermost4 AS (
     SELECT 5
     UNION (WITH innermost5 AS (
      SELECT 6
      UNION (WITH innermost6 AS
       (SELECT 7)
       SELECT * FROM innermost6))
      SELECT * FROM innermost5))
     SELECT * FROM innermost4))
    SELECT * FROM innermost3))
   SELECT * FROM innermost2))
  SELECT * FROM outermost
  UNION SELECT * FROM innermost1)
 )
 SELECT * FROM outermost ORDER BY 1;
 x 
---
 1
 2
 3
 4
 5
 6
 7
(7 rows)

--
-- Some examples with a tree
--
-- department structure represented here is as follows:
--
-- ROOT-+->A-+->B-+->C
--      |         |
--      |         +->D-+->F
--      +->E-+->G
SELECT tg_execute_ddl('
    CREATE TABLE tsurugifdw_department(
        id INTEGER PRIMARY KEY,
        parent_department INTEGER,
        name VARCHAR
    )
', 'tsurugidb');
  tg_execute_ddl   
-------------------
 execute succeeded
(1 row)

CREATE FOREIGN TABLE tsurugifdw_department (
        id INTEGER,
        parent_department INTEGER,
        name TEXT
) SERVER tsurugidb;
INSERT INTO tsurugifdw_department VALUES (0, NULL, 'ROOT');
INSERT INTO tsurugifdw_department VALUES (1, 0, 'A');
INSERT INTO tsurugifdw_department VALUES (2, 1, 'B');
INSERT INTO tsurugifdw_department VALUES (3, 2, 'C');
INSERT INTO tsurugifdw_department VALUES (4, 2, 'D');
INSERT INTO tsurugifdw_department VALUES (5, 0, 'E');
INSERT INTO tsurugifdw_department VALUES (6, 4, 'F');
INSERT INTO tsurugifdw_department VALUES (7, 5, 'G');
SELECT tg_execute_ddl('
    CREATE TABLE tsurugifdw_int4_tbl (
        f1 int
    )
', 'tsurugidb');
  tg_execute_ddl   
-------------------
 execute succeeded
(1 row)

CREATE FOREIGN TABLE tsurugifdw_int4_tbl (
  f1 int4
) SERVER tsurugidb;
INSERT INTO tsurugifdw_int4_tbl(f1) VALUES
  ('   0  '),
  ('123456     '),
  ('    -123456'),
  ('2147483647'),  -- largest and smallest values
  ('-2147483647');
SELECT * FROM tsurugifdw_int4_tbl;
     f1      
-------------
           0
      123456
     -123456
  2147483647
 -2147483647
(5 rows)

SELECT tg_execute_ddl('
    CREATE TABLE tsurugifdw_int8_tbl (
        q1 bigint, q2 bigint
    )
', 'tsurugidb');
  tg_execute_ddl   
-------------------
 execute succeeded
(1 row)

CREATE FOREIGN TABLE tsurugifdw_int8_tbl (
  q1 int8, q2 int8
) SERVER tsurugidb;
INSERT INTO tsurugifdw_int8_tbl VALUES
  ('  123   ','  456'),
  ('123   ','4567890123456789'),
  ('4567890123456789','123'),
  (+4567890123456789,'4567890123456789'),
  ('+4567890123456789','-4567890123456789');
SELECT * FROM tsurugifdw_int8_tbl;
        q1        |        q2         
------------------+-------------------
              123 |               456
              123 |  4567890123456789
 4567890123456789 |               123
 4567890123456789 |  4567890123456789
 4567890123456789 | -4567890123456789
(5 rows)

-- extract all departments under 'A'. Result should be A, B, C, D and F
WITH RECURSIVE subdepartment AS
(
	-- non recursive term
	SELECT name as root_name, * FROM tsurugifdw_department WHERE name = 'A'
	UNION ALL
	-- recursive term
	SELECT sd.root_name, d.* FROM tsurugifdw_department AS d, subdepartment AS sd
		WHERE d.parent_department = sd.id
)
SELECT * FROM subdepartment ORDER BY name;
 root_name | id | parent_department | name 
-----------+----+-------------------+------
 A         |  1 |                 0 | A
 A         |  2 |                 1 | B
 A         |  3 |                 2 | C
 A         |  4 |                 2 | D
 A         |  6 |                 4 | F
(5 rows)

-- extract all departments under 'A' with "level" number
WITH RECURSIVE subdepartment(level, id, parent_department, name) AS
(
	-- non recursive term
	SELECT 1, * FROM tsurugifdw_department WHERE name = 'A'
	UNION ALL
	-- recursive term
	SELECT sd.level + 1, d.* FROM tsurugifdw_department AS d, subdepartment AS sd
		WHERE d.parent_department = sd.id
)
SELECT * FROM subdepartment ORDER BY name;
 level | id | parent_department | name 
-------+----+-------------------+------
     1 |  1 |                 0 | A
     2 |  2 |                 1 | B
     3 |  3 |                 2 | C
     3 |  4 |                 2 | D
     4 |  6 |                 4 | F
(5 rows)

-- extract all departments under 'A' with "level" number.
-- Only shows level 2 or more
WITH RECURSIVE subdepartment(level, id, parent_department, name) AS
(
	-- non recursive term
	SELECT 1, * FROM tsurugifdw_department WHERE name = 'A'
	UNION ALL
	-- recursive term
	SELECT sd.level + 1, d.* FROM tsurugifdw_department AS d, subdepartment AS sd
		WHERE d.parent_department = sd.id
)
SELECT * FROM subdepartment WHERE level >= 2 ORDER BY name;
 level | id | parent_department | name 
-------+----+-------------------+------
     2 |  2 |                 1 | B
     3 |  3 |                 2 | C
     3 |  4 |                 2 | D
     4 |  6 |                 4 | F
(4 rows)

-- "RECURSIVE" is ignored if the query has no self-reference
WITH RECURSIVE subdepartment AS
(
	-- note lack of recursive UNION structure
	SELECT * FROM tsurugifdw_department WHERE name = 'A'
)
SELECT * FROM subdepartment ORDER BY name;
 id | parent_department | name 
----+-------------------+------
  1 |                 0 | A
(1 row)

-- inside subqueries
SELECT count(*) FROM (
    WITH RECURSIVE t(n) AS (
        SELECT 1 UNION ALL SELECT n + 1 FROM t WHERE n < 500
    )
    SELECT * FROM t) AS t WHERE n < (
        SELECT count(*) FROM (
            WITH RECURSIVE t(n) AS (
                   SELECT 1 UNION ALL SELECT n + 1 FROM t WHERE n < 100
                )
            SELECT * FROM t WHERE n < 50000
         ) AS t WHERE n < 100);
 count 
-------
    98
(1 row)

-- via a VIEW
CREATE TEMPORARY VIEW vsubdepartment AS
	WITH RECURSIVE subdepartment AS
	(
		 -- non recursive term
		SELECT * FROM tsurugifdw_department WHERE name = 'A'
		UNION ALL
		-- recursive term
		SELECT d.* FROM tsurugifdw_department AS d, subdepartment AS sd
			WHERE d.parent_department = sd.id
	)
	SELECT * FROM subdepartment;
SELECT * FROM vsubdepartment ORDER BY name;
 id | parent_department | name 
----+-------------------+------
  1 |                 0 | A
  2 |                 1 | B
  3 |                 2 | C
  4 |                 2 | D
  6 |                 4 | F
(5 rows)

-- Check reverse listing
SELECT pg_get_viewdef('vsubdepartment'::regclass);
                      pg_get_viewdef                      
----------------------------------------------------------
  WITH RECURSIVE subdepartment AS (                      +
          SELECT tsurugifdw_department.id,               +
             tsurugifdw_department.parent_department,    +
             tsurugifdw_department.name                  +
            FROM tsurugifdw_department                   +
           WHERE (tsurugifdw_department.name = 'A'::text)+
         UNION ALL                                       +
          SELECT d.id,                                   +
             d.parent_department,                        +
             d.name                                      +
            FROM tsurugifdw_department d,                +
             subdepartment sd                            +
           WHERE (d.parent_department = sd.id)           +
         )                                               +
  SELECT id,                                             +
     parent_department,                                  +
     name                                                +
    FROM subdepartment;
(1 row)

SELECT pg_get_viewdef('vsubdepartment'::regclass, true);
                     pg_get_viewdef                     
--------------------------------------------------------
  WITH RECURSIVE subdepartment AS (                    +
          SELECT tsurugifdw_department.id,             +
             tsurugifdw_department.parent_department,  +
             tsurugifdw_department.name                +
            FROM tsurugifdw_department                 +
           WHERE tsurugifdw_department.name = 'A'::text+
         UNION ALL                                     +
          SELECT d.id,                                 +
             d.parent_department,                      +
             d.name                                    +
            FROM tsurugifdw_department d,              +
             subdepartment sd                          +
           WHERE d.parent_department = sd.id           +
         )                                             +
  SELECT id,                                           +
     parent_department,                                +
     name                                              +
    FROM subdepartment;
(1 row)

-- Another reverse-listing example
CREATE VIEW sums_1_100 AS
WITH RECURSIVE t(n) AS (
    VALUES (1)
UNION ALL
    SELECT n+1 FROM t WHERE n < 100
)
SELECT sum(n) FROM t;
\d+ sums_1_100
                         View "public.sums_1_100"
 Column |  Type  | Collation | Nullable | Default | Storage | Description 
--------+--------+-----------+----------+---------+---------+-------------
 sum    | bigint |           |          |         | plain   | 
View definition:
 WITH RECURSIVE t(n) AS (
         VALUES (1)
        UNION ALL
         SELECT t_1.n + 1
           FROM t t_1
          WHERE t_1.n < 100
        )
 SELECT sum(n) AS sum
   FROM t;

-- corner case in which sub-WITH gets initialized first
with recursive q as (
      select * from tsurugifdw_department
    union all
      (with x as (select * from q)
       select * from x)
    )
select * from q limit 24;
 id | parent_department | name 
----+-------------------+------
  0 |                   | ROOT
  1 |                 0 | A
  2 |                 1 | B
  3 |                 2 | C
  4 |                 2 | D
  5 |                 0 | E
  6 |                 4 | F
  7 |                 5 | G
  0 |                   | ROOT
  1 |                 0 | A
  2 |                 1 | B
  3 |                 2 | C
  4 |                 2 | D
  5 |                 0 | E
  6 |                 4 | F
  7 |                 5 | G
  0 |                   | ROOT
  1 |                 0 | A
  2 |                 1 | B
  3 |                 2 | C
  4 |                 2 | D
  5 |                 0 | E
  6 |                 4 | F
  7 |                 5 | G
(24 rows)

with recursive q as (
      select * from tsurugifdw_department
    union all
      (with recursive x as (
           select * from tsurugifdw_department
         union all
           (select * from q union all select * from x)
        )
       select * from x)
    )
select * from q limit 32;
 id | parent_department | name 
----+-------------------+------
  0 |                   | ROOT
  1 |                 0 | A
  2 |                 1 | B
  3 |                 2 | C
  4 |                 2 | D
  5 |                 0 | E
  6 |                 4 | F
  7 |                 5 | G
  0 |                   | ROOT
  1 |                 0 | A
  2 |                 1 | B
  3 |                 2 | C
  4 |                 2 | D
  5 |                 0 | E
  6 |                 4 | F
  7 |                 5 | G
  0 |                   | ROOT
  1 |                 0 | A
  2 |                 1 | B
  3 |                 2 | C
  4 |                 2 | D
  5 |                 0 | E
  6 |                 4 | F
  7 |                 5 | G
  0 |                   | ROOT
  1 |                 0 | A
  2 |                 1 | B
  3 |                 2 | C
  4 |                 2 | D
  5 |                 0 | E
  6 |                 4 | F
  7 |                 5 | G
(32 rows)

-- recursive term has sub-UNION
WITH RECURSIVE t(i,j) AS (
	VALUES (1,2)
	UNION ALL
	SELECT t2.i, t.j+1 FROM
		(SELECT 2 AS i UNION ALL SELECT 3 AS i) AS t2
		JOIN t ON (t2.i = t.i+1))
	SELECT * FROM t;
 i | j 
---+---
 1 | 2
 2 | 3
 3 | 4
(3 rows)

--
-- different tree example
--
SELECT tg_execute_ddl('
    CREATE TABLE tsurugifdw_tree(
        id INTEGER PRIMARY KEY,
        parent_id INTEGER
    )
', 'tsurugidb');
  tg_execute_ddl   
-------------------
 execute succeeded
(1 row)

CREATE FOREIGN TABLE tsurugifdw_tree (
    id INTEGER,
    parent_id INTEGER
) SERVER tsurugidb;
INSERT INTO tsurugifdw_tree
VALUES (1, NULL), (2, 1), (3,1), (4,2), (5,2), (6,2), (7,3), (8,3),
       (9,4), (10,4), (11,7), (12,7), (13,7), (14, 9), (15,11), (16,11);
--
-- get all paths from "second level" nodes to leaf nodes
--
WITH RECURSIVE t(id, path) AS (
    VALUES(1,ARRAY[]::integer[])
UNION ALL
    SELECT tsurugifdw_tree.id, t.path || tsurugifdw_tree.id
    FROM tsurugifdw_tree JOIN t ON (tsurugifdw_tree.parent_id = t.id)
)
SELECT t1.*, t2.* FROM t AS t1 JOIN t AS t2 ON
	(t1.path[1] = t2.path[1] AND
	array_upper(t1.path,1) = 1 AND
	array_upper(t2.path,1) > 1)
	ORDER BY t1.id, t2.id;
 id | path | id |    path     
----+------+----+-------------
  2 | {2}  |  4 | {2,4}
  2 | {2}  |  5 | {2,5}
  2 | {2}  |  6 | {2,6}
  2 | {2}  |  9 | {2,4,9}
  2 | {2}  | 10 | {2,4,10}
  2 | {2}  | 14 | {2,4,9,14}
  3 | {3}  |  7 | {3,7}
  3 | {3}  |  8 | {3,8}
  3 | {3}  | 11 | {3,7,11}
  3 | {3}  | 12 | {3,7,12}
  3 | {3}  | 13 | {3,7,13}
  3 | {3}  | 15 | {3,7,11,15}
  3 | {3}  | 16 | {3,7,11,16}
(13 rows)

-- just count 'em
WITH RECURSIVE t(id, path) AS (
    VALUES(1,ARRAY[]::integer[])
UNION ALL
    SELECT tsurugifdw_tree.id, t.path || tsurugifdw_tree.id
    FROM tsurugifdw_tree JOIN t ON (tsurugifdw_tree.parent_id = t.id)
)
SELECT t1.id, count(t2.*) FROM t AS t1 JOIN t AS t2 ON
	(t1.path[1] = t2.path[1] AND
	array_upper(t1.path,1) = 1 AND
	array_upper(t2.path,1) > 1)
	GROUP BY t1.id
	ORDER BY t1.id;
 id | count 
----+-------
  2 |     6
  3 |     7
(2 rows)

-- this variant tickled a whole-row-variable bug in 8.4devel
WITH RECURSIVE t(id, path) AS (
    VALUES(1,ARRAY[]::integer[])
UNION ALL
    SELECT tsurugifdw_tree.id, t.path || tsurugifdw_tree.id
    FROM tsurugifdw_tree JOIN t ON (tsurugifdw_tree.parent_id = t.id)
)
SELECT t1.id, t2.path, t2 FROM t AS t1 JOIN t AS t2 ON
(t1.id=t2.id);
 id |    path     |         t2         
----+-------------+--------------------
  1 | {}          | (1,{})
  2 | {2}         | (2,{2})
  3 | {3}         | (3,{3})
  4 | {2,4}       | (4,"{2,4}")
  5 | {2,5}       | (5,"{2,5}")
  6 | {2,6}       | (6,"{2,6}")
  7 | {3,7}       | (7,"{3,7}")
  8 | {3,8}       | (8,"{3,8}")
  9 | {2,4,9}     | (9,"{2,4,9}")
 10 | {2,4,10}    | (10,"{2,4,10}")
 11 | {3,7,11}    | (11,"{3,7,11}")
 12 | {3,7,12}    | (12,"{3,7,12}")
 13 | {3,7,13}    | (13,"{3,7,13}")
 14 | {2,4,9,14}  | (14,"{2,4,9,14}")
 15 | {3,7,11,15} | (15,"{3,7,11,15}")
 16 | {3,7,11,16} | (16,"{3,7,11,16}")
(16 rows)

SELECT tg_execute_ddl('CREATE TABLE tsurugifdw_duplicates (a INT NOT NULL)', 'tsurugidb');
  tg_execute_ddl   
-------------------
 execute succeeded
(1 row)

CREATE FOREIGN TABLE tsurugifdw_duplicates (a INT) SERVER tsurugidb;
INSERT INTO tsurugifdw_duplicates VALUES(1), (1);
-- Try out a recursive UNION case where the non-recursive part's table slot
-- uses TTSOpsBufferHeapTuple and contains duplicate rows.
WITH RECURSIVE cte (a) as (
	SELECT a FROM tsurugifdw_duplicates
	UNION
	SELECT a FROM cte
)
SELECT a FROM cte;
 a 
---
 1
(1 row)

-- SEARCH clause
SELECT tg_execute_ddl('CREATE TABLE tsurugifdw_graph0 ( f int, t int, label varchar )', 'tsurugidb');
  tg_execute_ddl   
-------------------
 execute succeeded
(1 row)

CREATE FOREIGN TABLE tsurugifdw_graph0 ( f int, t int, label text ) SERVER tsurugidb;
insert into tsurugifdw_graph0 values
	(1, 2, 'arc 1 -> 2'),
	(1, 3, 'arc 1 -> 3'),
	(2, 3, 'arc 2 -> 3'),
	(1, 4, 'arc 1 -> 4'),
	(4, 5, 'arc 4 -> 5');
with recursive search_graph(f, t, label) as (
	select * from tsurugifdw_graph0 g
	union all
	select g.*
	from tsurugifdw_graph0 g, search_graph sg
	where g.f = sg.t
) search depth first by f, t set seq
select * from search_graph order by seq;
 f | t |   label    |        seq        
---+---+------------+-------------------
 1 | 2 | arc 1 -> 2 | {"(1,2)"}
 2 | 3 | arc 2 -> 3 | {"(1,2)","(2,3)"}
 1 | 3 | arc 1 -> 3 | {"(1,3)"}
 1 | 4 | arc 1 -> 4 | {"(1,4)"}
 4 | 5 | arc 4 -> 5 | {"(1,4)","(4,5)"}
 2 | 3 | arc 2 -> 3 | {"(2,3)"}
 4 | 5 | arc 4 -> 5 | {"(4,5)"}
(7 rows)

with recursive search_graph(f, t, label) as (
	select * from tsurugifdw_graph0 g
	union distinct
	select g.*
	from tsurugifdw_graph0 g, search_graph sg
	where g.f = sg.t
) search depth first by f, t set seq
select * from search_graph order by seq;
 f | t |   label    |        seq        
---+---+------------+-------------------
 1 | 2 | arc 1 -> 2 | {"(1,2)"}
 2 | 3 | arc 2 -> 3 | {"(1,2)","(2,3)"}
 1 | 3 | arc 1 -> 3 | {"(1,3)"}
 1 | 4 | arc 1 -> 4 | {"(1,4)"}
 4 | 5 | arc 4 -> 5 | {"(1,4)","(4,5)"}
 2 | 3 | arc 2 -> 3 | {"(2,3)"}
 4 | 5 | arc 4 -> 5 | {"(4,5)"}
(7 rows)

with recursive search_graph(f, t, label) as (
	select * from tsurugifdw_graph0 g
	union all
	select g.*
	from tsurugifdw_graph0 g, search_graph sg
	where g.f = sg.t
) search breadth first by f, t set seq
select * from search_graph order by seq;
 f | t |   label    |   seq   
---+---+------------+---------
 1 | 2 | arc 1 -> 2 | (0,1,2)
 1 | 3 | arc 1 -> 3 | (0,1,3)
 1 | 4 | arc 1 -> 4 | (0,1,4)
 2 | 3 | arc 2 -> 3 | (0,2,3)
 4 | 5 | arc 4 -> 5 | (0,4,5)
 2 | 3 | arc 2 -> 3 | (1,2,3)
 4 | 5 | arc 4 -> 5 | (1,4,5)
(7 rows)

with recursive search_graph(f, t, label) as (
	select * from tsurugifdw_graph0 g
	union distinct
	select g.*
	from tsurugifdw_graph0 g, search_graph sg
	where g.f = sg.t
) search breadth first by f, t set seq
select * from search_graph order by seq;
 f | t |   label    |   seq   
---+---+------------+---------
 1 | 2 | arc 1 -> 2 | (0,1,2)
 1 | 3 | arc 1 -> 3 | (0,1,3)
 1 | 4 | arc 1 -> 4 | (0,1,4)
 2 | 3 | arc 2 -> 3 | (0,2,3)
 4 | 5 | arc 4 -> 5 | (0,4,5)
 2 | 3 | arc 2 -> 3 | (1,2,3)
 4 | 5 | arc 4 -> 5 | (1,4,5)
(7 rows)

with recursive test as (
  select 1 as x
  union all
  select x + 1
  from test
) search depth first by x set y
select * from test limit 5;
 x |           y           
---+-----------------------
 1 | {(1)}
 2 | {(1),(2)}
 3 | {(1),(2),(3)}
 4 | {(1),(2),(3),(4)}
 5 | {(1),(2),(3),(4),(5)}
(5 rows)

with recursive test as (
  select 1 as x
  union all
  select x + 1
  from test
) search breadth first by x set y
select * from test limit 5;
 x |   y   
---+-------
 1 | (0,1)
 2 | (1,2)
 3 | (2,3)
 4 | (3,4)
 5 | (4,5)
(5 rows)

-- various syntax errors
with recursive search_graph(f, t, label) as (
	select * from tsurugifdw_graph0 g
	union all
	select g.*
	from tsurugifdw_graph0 g, search_graph sg
	where g.f = sg.t
) search depth first by foo, tar set seq
select * from search_graph;
ERROR:  search column "foo" not in WITH query column list
LINE 7: ) search depth first by foo, tar set seq
          ^
with recursive search_graph(f, t, label) as (
	select * from tsurugifdw_graph0 g
	union all
	select g.*
	from tsurugifdw_graph0 g, search_graph sg
	where g.f = sg.t
) search depth first by f, t set label
select * from search_graph;
ERROR:  search sequence column name "label" already used in WITH query column list
LINE 7: ) search depth first by f, t set label
          ^
with recursive search_graph(f, t, label) as (
	select * from tsurugifdw_graph0 g
	union all
	select g.*
	from tsurugifdw_graph0 g, search_graph sg
	where g.f = sg.t
) search depth first by f, t, f set seq
select * from search_graph;
ERROR:  search column "f" specified more than once
LINE 7: ) search depth first by f, t, f set seq
          ^
with recursive search_graph(f, t, label) as (
	select * from tsurugifdw_graph0 g
	union all
	select * from tsurugifdw_graph0 g
	union all
	select g.*
	from tsurugifdw_graph0 g, search_graph sg
	where g.f = sg.t
) search depth first by f, t set seq
select * from search_graph order by seq;
ERROR:  with a SEARCH or CYCLE clause, the left side of the UNION must be a SELECT
with recursive search_graph(f, t, label) as (
	select * from tsurugifdw_graph0 g
	union all
	(select * from tsurugifdw_graph0 g
	union all
	select g.*
	from tsurugifdw_graph0 g, search_graph sg
	where g.f = sg.t)
) search depth first by f, t set seq
select * from search_graph order by seq;
ERROR:  with a SEARCH or CYCLE clause, the right side of the UNION must be a SELECT
-- check that we distinguish same CTE name used at different levels
-- (this case could be supported, perhaps, but it isn't today)
with recursive x(col) as (
	select 1
	union
	(with x as (select * from x)
	 select * from x)
) search depth first by col set seq
select * from x;
ERROR:  with a SEARCH or CYCLE clause, the recursive reference to WITH query "x" must be at the top level of its right-hand SELECT
-- test ruleutils and view expansion
create temp view v_search as
with recursive search_graph(f, t, label) as (
	select * from tsurugifdw_graph0 g
	union all
	select g.*
	from tsurugifdw_graph0 g, search_graph sg
	where g.f = sg.t
) search depth first by f, t set seq
select f, t, label from search_graph;
select pg_get_viewdef('v_search');
                 pg_get_viewdef                 
------------------------------------------------
  WITH RECURSIVE search_graph(f, t, label) AS (+
          SELECT g.f,                          +
             g.t,                              +
             g.label                           +
            FROM tsurugifdw_graph0 g           +
         UNION ALL                             +
          SELECT g.f,                          +
             g.t,                              +
             g.label                           +
            FROM tsurugifdw_graph0 g,          +
             search_graph sg                   +
           WHERE (g.f = sg.t)                  +
         ) SEARCH DEPTH FIRST BY f, t SET seq  +
  SELECT f,                                    +
     t,                                        +
     label                                     +
    FROM search_graph;
(1 row)

select * from v_search;
 f | t |   label    
---+---+------------
 1 | 2 | arc 1 -> 2
 1 | 3 | arc 1 -> 3
 2 | 3 | arc 2 -> 3
 1 | 4 | arc 1 -> 4
 4 | 5 | arc 4 -> 5
 2 | 3 | arc 2 -> 3
 4 | 5 | arc 4 -> 5
(7 rows)

--
-- test cycle detection
--
SELECT tg_execute_ddl('CREATE TABLE tsurugifdw_graph ( f int, t int, label varchar )', 'tsurugidb');
  tg_execute_ddl   
-------------------
 execute succeeded
(1 row)

CREATE FOREIGN TABLE tsurugifdw_graph ( f int, t int, label text ) SERVER tsurugidb;
insert into tsurugifdw_graph values
	(1, 2, 'arc 1 -> 2'),
	(1, 3, 'arc 1 -> 3'),
	(2, 3, 'arc 2 -> 3'),
	(1, 4, 'arc 1 -> 4'),
	(4, 5, 'arc 4 -> 5'),
	(5, 1, 'arc 5 -> 1');
with recursive search_graph(f, t, label, is_cycle, path) as (
	select *, false, array[row(g.f, g.t)] from tsurugifdw_graph g
	union all
	select g.*, row(g.f, g.t) = any(path), path || row(g.f, g.t)
	from tsurugifdw_graph g, search_graph sg
	where g.f = sg.t and not is_cycle
)
select * from search_graph ORDER BY f, t;
 f | t |   label    | is_cycle |                   path                    
---+---+------------+----------+-------------------------------------------
 1 | 2 | arc 1 -> 2 | f        | {"(4,5)","(5,1)","(1,2)"}
 1 | 2 | arc 1 -> 2 | f        | {"(1,2)"}
 1 | 2 | arc 1 -> 2 | f        | {"(1,4)","(4,5)","(5,1)","(1,2)"}
 1 | 2 | arc 1 -> 2 | f        | {"(5,1)","(1,2)"}
 1 | 3 | arc 1 -> 3 | f        | {"(5,1)","(1,3)"}
 1 | 3 | arc 1 -> 3 | f        | {"(1,3)"}
 1 | 3 | arc 1 -> 3 | f        | {"(4,5)","(5,1)","(1,3)"}
 1 | 3 | arc 1 -> 3 | f        | {"(1,4)","(4,5)","(5,1)","(1,3)"}
 1 | 4 | arc 1 -> 4 | f        | {"(1,4)"}
 1 | 4 | arc 1 -> 4 | t        | {"(1,4)","(4,5)","(5,1)","(1,4)"}
 1 | 4 | arc 1 -> 4 | f        | {"(4,5)","(5,1)","(1,4)"}
 1 | 4 | arc 1 -> 4 | f        | {"(5,1)","(1,4)"}
 2 | 3 | arc 2 -> 3 | f        | {"(1,4)","(4,5)","(5,1)","(1,2)","(2,3)"}
 2 | 3 | arc 2 -> 3 | f        | {"(2,3)"}
 2 | 3 | arc 2 -> 3 | f        | {"(1,2)","(2,3)"}
 2 | 3 | arc 2 -> 3 | f        | {"(5,1)","(1,2)","(2,3)"}
 2 | 3 | arc 2 -> 3 | f        | {"(4,5)","(5,1)","(1,2)","(2,3)"}
 4 | 5 | arc 4 -> 5 | f        | {"(5,1)","(1,4)","(4,5)"}
 4 | 5 | arc 4 -> 5 | f        | {"(1,4)","(4,5)"}
 4 | 5 | arc 4 -> 5 | t        | {"(4,5)","(5,1)","(1,4)","(4,5)"}
 4 | 5 | arc 4 -> 5 | f        | {"(4,5)"}
 5 | 1 | arc 5 -> 1 | f        | {"(1,4)","(4,5)","(5,1)"}
 5 | 1 | arc 5 -> 1 | f        | {"(4,5)","(5,1)"}
 5 | 1 | arc 5 -> 1 | t        | {"(5,1)","(1,4)","(4,5)","(5,1)"}
 5 | 1 | arc 5 -> 1 | f        | {"(5,1)"}
(25 rows)

-- UNION DISTINCT exercises row type hashing support
with recursive search_graph(f, t, label, is_cycle, path) as (
	select *, false, array[row(g.f, g.t)] from tsurugifdw_graph g
	union distinct
	select g.*, row(g.f, g.t) = any(path), path || row(g.f, g.t)
	from tsurugifdw_graph g, search_graph sg
	where g.f = sg.t and not is_cycle
)
select * from search_graph ORDER BY f, t;
 f | t |   label    | is_cycle |                   path                    
---+---+------------+----------+-------------------------------------------
 1 | 2 | arc 1 -> 2 | f        | {"(4,5)","(5,1)","(1,2)"}
 1 | 2 | arc 1 -> 2 | f        | {"(1,2)"}
 1 | 2 | arc 1 -> 2 | f        | {"(1,4)","(4,5)","(5,1)","(1,2)"}
 1 | 2 | arc 1 -> 2 | f        | {"(5,1)","(1,2)"}
 1 | 3 | arc 1 -> 3 | f        | {"(5,1)","(1,3)"}
 1 | 3 | arc 1 -> 3 | f        | {"(1,3)"}
 1 | 3 | arc 1 -> 3 | f        | {"(4,5)","(5,1)","(1,3)"}
 1 | 3 | arc 1 -> 3 | f        | {"(1,4)","(4,5)","(5,1)","(1,3)"}
 1 | 4 | arc 1 -> 4 | f        | {"(1,4)"}
 1 | 4 | arc 1 -> 4 | t        | {"(1,4)","(4,5)","(5,1)","(1,4)"}
 1 | 4 | arc 1 -> 4 | f        | {"(4,5)","(5,1)","(1,4)"}
 1 | 4 | arc 1 -> 4 | f        | {"(5,1)","(1,4)"}
 2 | 3 | arc 2 -> 3 | f        | {"(1,4)","(4,5)","(5,1)","(1,2)","(2,3)"}
 2 | 3 | arc 2 -> 3 | f        | {"(2,3)"}
 2 | 3 | arc 2 -> 3 | f        | {"(1,2)","(2,3)"}
 2 | 3 | arc 2 -> 3 | f        | {"(5,1)","(1,2)","(2,3)"}
 2 | 3 | arc 2 -> 3 | f        | {"(4,5)","(5,1)","(1,2)","(2,3)"}
 4 | 5 | arc 4 -> 5 | f        | {"(5,1)","(1,4)","(4,5)"}
 4 | 5 | arc 4 -> 5 | f        | {"(1,4)","(4,5)"}
 4 | 5 | arc 4 -> 5 | t        | {"(4,5)","(5,1)","(1,4)","(4,5)"}
 4 | 5 | arc 4 -> 5 | f        | {"(4,5)"}
 5 | 1 | arc 5 -> 1 | f        | {"(1,4)","(4,5)","(5,1)"}
 5 | 1 | arc 5 -> 1 | f        | {"(4,5)","(5,1)"}
 5 | 1 | arc 5 -> 1 | t        | {"(5,1)","(1,4)","(4,5)","(5,1)"}
 5 | 1 | arc 5 -> 1 | f        | {"(5,1)"}
(25 rows)

-- ordering by the path column has same effect as SEARCH DEPTH FIRST
with recursive search_graph(f, t, label, is_cycle, path) as (
	select *, false, array[row(g.f, g.t)] from tsurugifdw_graph g
	union all
	select g.*, row(g.f, g.t) = any(path), path || row(g.f, g.t)
	from tsurugifdw_graph g, search_graph sg
	where g.f = sg.t and not is_cycle
)
select * from search_graph order by path;
 f | t |   label    | is_cycle |                   path                    
---+---+------------+----------+-------------------------------------------
 1 | 2 | arc 1 -> 2 | f        | {"(1,2)"}
 2 | 3 | arc 2 -> 3 | f        | {"(1,2)","(2,3)"}
 1 | 3 | arc 1 -> 3 | f        | {"(1,3)"}
 1 | 4 | arc 1 -> 4 | f        | {"(1,4)"}
 4 | 5 | arc 4 -> 5 | f        | {"(1,4)","(4,5)"}
 5 | 1 | arc 5 -> 1 | f        | {"(1,4)","(4,5)","(5,1)"}
 1 | 2 | arc 1 -> 2 | f        | {"(1,4)","(4,5)","(5,1)","(1,2)"}
 2 | 3 | arc 2 -> 3 | f        | {"(1,4)","(4,5)","(5,1)","(1,2)","(2,3)"}
 1 | 3 | arc 1 -> 3 | f        | {"(1,4)","(4,5)","(5,1)","(1,3)"}
 1 | 4 | arc 1 -> 4 | t        | {"(1,4)","(4,5)","(5,1)","(1,4)"}
 2 | 3 | arc 2 -> 3 | f        | {"(2,3)"}
 4 | 5 | arc 4 -> 5 | f        | {"(4,5)"}
 5 | 1 | arc 5 -> 1 | f        | {"(4,5)","(5,1)"}
 1 | 2 | arc 1 -> 2 | f        | {"(4,5)","(5,1)","(1,2)"}
 2 | 3 | arc 2 -> 3 | f        | {"(4,5)","(5,1)","(1,2)","(2,3)"}
 1 | 3 | arc 1 -> 3 | f        | {"(4,5)","(5,1)","(1,3)"}
 1 | 4 | arc 1 -> 4 | f        | {"(4,5)","(5,1)","(1,4)"}
 4 | 5 | arc 4 -> 5 | t        | {"(4,5)","(5,1)","(1,4)","(4,5)"}
 5 | 1 | arc 5 -> 1 | f        | {"(5,1)"}
 1 | 2 | arc 1 -> 2 | f        | {"(5,1)","(1,2)"}
 2 | 3 | arc 2 -> 3 | f        | {"(5,1)","(1,2)","(2,3)"}
 1 | 3 | arc 1 -> 3 | f        | {"(5,1)","(1,3)"}
 1 | 4 | arc 1 -> 4 | f        | {"(5,1)","(1,4)"}
 4 | 5 | arc 4 -> 5 | f        | {"(5,1)","(1,4)","(4,5)"}
 5 | 1 | arc 5 -> 1 | t        | {"(5,1)","(1,4)","(4,5)","(5,1)"}
(25 rows)

-- CYCLE clause
with recursive search_graph(f, t, label) as (
	select * from tsurugifdw_graph g
	union all
	select g.*
	from tsurugifdw_graph g, search_graph sg
	where g.f = sg.t
) cycle f, t set is_cycle using path
select * from search_graph ORDER BY f, t;
 f | t |   label    | is_cycle |                   path                    
---+---+------------+----------+-------------------------------------------
 1 | 2 | arc 1 -> 2 | f        | {"(4,5)","(5,1)","(1,2)"}
 1 | 2 | arc 1 -> 2 | f        | {"(1,2)"}
 1 | 2 | arc 1 -> 2 | f        | {"(1,4)","(4,5)","(5,1)","(1,2)"}
 1 | 2 | arc 1 -> 2 | f        | {"(5,1)","(1,2)"}
 1 | 3 | arc 1 -> 3 | f        | {"(5,1)","(1,3)"}
 1 | 3 | arc 1 -> 3 | f        | {"(1,3)"}
 1 | 3 | arc 1 -> 3 | f        | {"(4,5)","(5,1)","(1,3)"}
 1 | 3 | arc 1 -> 3 | f        | {"(1,4)","(4,5)","(5,1)","(1,3)"}
 1 | 4 | arc 1 -> 4 | f        | {"(1,4)"}
 1 | 4 | arc 1 -> 4 | t        | {"(1,4)","(4,5)","(5,1)","(1,4)"}
 1 | 4 | arc 1 -> 4 | f        | {"(4,5)","(5,1)","(1,4)"}
 1 | 4 | arc 1 -> 4 | f        | {"(5,1)","(1,4)"}
 2 | 3 | arc 2 -> 3 | f        | {"(1,4)","(4,5)","(5,1)","(1,2)","(2,3)"}
 2 | 3 | arc 2 -> 3 | f        | {"(2,3)"}
 2 | 3 | arc 2 -> 3 | f        | {"(1,2)","(2,3)"}
 2 | 3 | arc 2 -> 3 | f        | {"(5,1)","(1,2)","(2,3)"}
 2 | 3 | arc 2 -> 3 | f        | {"(4,5)","(5,1)","(1,2)","(2,3)"}
 4 | 5 | arc 4 -> 5 | f        | {"(5,1)","(1,4)","(4,5)"}
 4 | 5 | arc 4 -> 5 | f        | {"(1,4)","(4,5)"}
 4 | 5 | arc 4 -> 5 | t        | {"(4,5)","(5,1)","(1,4)","(4,5)"}
 4 | 5 | arc 4 -> 5 | f        | {"(4,5)"}
 5 | 1 | arc 5 -> 1 | f        | {"(1,4)","(4,5)","(5,1)"}
 5 | 1 | arc 5 -> 1 | f        | {"(4,5)","(5,1)"}
 5 | 1 | arc 5 -> 1 | t        | {"(5,1)","(1,4)","(4,5)","(5,1)"}
 5 | 1 | arc 5 -> 1 | f        | {"(5,1)"}
(25 rows)

with recursive search_graph(f, t, label) as (
	select * from tsurugifdw_graph g
	union distinct
	select g.*
	from tsurugifdw_graph g, search_graph sg
	where g.f = sg.t
) cycle f, t set is_cycle to 'Y' default 'N' using path
select * from search_graph ORDER BY f, t;
 f | t |   label    | is_cycle |                   path                    
---+---+------------+----------+-------------------------------------------
 1 | 2 | arc 1 -> 2 | N        | {"(4,5)","(5,1)","(1,2)"}
 1 | 2 | arc 1 -> 2 | N        | {"(1,2)"}
 1 | 2 | arc 1 -> 2 | N        | {"(1,4)","(4,5)","(5,1)","(1,2)"}
 1 | 2 | arc 1 -> 2 | N        | {"(5,1)","(1,2)"}
 1 | 3 | arc 1 -> 3 | N        | {"(5,1)","(1,3)"}
 1 | 3 | arc 1 -> 3 | N        | {"(1,3)"}
 1 | 3 | arc 1 -> 3 | N        | {"(4,5)","(5,1)","(1,3)"}
 1 | 3 | arc 1 -> 3 | N        | {"(1,4)","(4,5)","(5,1)","(1,3)"}
 1 | 4 | arc 1 -> 4 | N        | {"(1,4)"}
 1 | 4 | arc 1 -> 4 | Y        | {"(1,4)","(4,5)","(5,1)","(1,4)"}
 1 | 4 | arc 1 -> 4 | N        | {"(4,5)","(5,1)","(1,4)"}
 1 | 4 | arc 1 -> 4 | N        | {"(5,1)","(1,4)"}
 2 | 3 | arc 2 -> 3 | N        | {"(1,4)","(4,5)","(5,1)","(1,2)","(2,3)"}
 2 | 3 | arc 2 -> 3 | N        | {"(2,3)"}
 2 | 3 | arc 2 -> 3 | N        | {"(1,2)","(2,3)"}
 2 | 3 | arc 2 -> 3 | N        | {"(5,1)","(1,2)","(2,3)"}
 2 | 3 | arc 2 -> 3 | N        | {"(4,5)","(5,1)","(1,2)","(2,3)"}
 4 | 5 | arc 4 -> 5 | N        | {"(5,1)","(1,4)","(4,5)"}
 4 | 5 | arc 4 -> 5 | N        | {"(1,4)","(4,5)"}
 4 | 5 | arc 4 -> 5 | Y        | {"(4,5)","(5,1)","(1,4)","(4,5)"}
 4 | 5 | arc 4 -> 5 | N        | {"(4,5)"}
 5 | 1 | arc 5 -> 1 | N        | {"(1,4)","(4,5)","(5,1)"}
 5 | 1 | arc 5 -> 1 | N        | {"(4,5)","(5,1)"}
 5 | 1 | arc 5 -> 1 | Y        | {"(5,1)","(1,4)","(4,5)","(5,1)"}
 5 | 1 | arc 5 -> 1 | N        | {"(5,1)"}
(25 rows)

with recursive test as (
  select 0 as x
  union all
  select (x + 1) % 10
  from test
) cycle x set is_cycle using path
select * from test;
 x | is_cycle |                     path                      
---+----------+-----------------------------------------------
 0 | f        | {(0)}
 1 | f        | {(0),(1)}
 2 | f        | {(0),(1),(2)}
 3 | f        | {(0),(1),(2),(3)}
 4 | f        | {(0),(1),(2),(3),(4)}
 5 | f        | {(0),(1),(2),(3),(4),(5)}
 6 | f        | {(0),(1),(2),(3),(4),(5),(6)}
 7 | f        | {(0),(1),(2),(3),(4),(5),(6),(7)}
 8 | f        | {(0),(1),(2),(3),(4),(5),(6),(7),(8)}
 9 | f        | {(0),(1),(2),(3),(4),(5),(6),(7),(8),(9)}
 0 | t        | {(0),(1),(2),(3),(4),(5),(6),(7),(8),(9),(0)}
(11 rows)

with recursive test as (
  select 0 as x
  union all
  select (x + 1) % 10
  from test
    where not is_cycle  -- redundant, but legal
) cycle x set is_cycle using path
select * from test;
 x | is_cycle |                     path                      
---+----------+-----------------------------------------------
 0 | f        | {(0)}
 1 | f        | {(0),(1)}
 2 | f        | {(0),(1),(2)}
 3 | f        | {(0),(1),(2),(3)}
 4 | f        | {(0),(1),(2),(3),(4)}
 5 | f        | {(0),(1),(2),(3),(4),(5)}
 6 | f        | {(0),(1),(2),(3),(4),(5),(6)}
 7 | f        | {(0),(1),(2),(3),(4),(5),(6),(7)}
 8 | f        | {(0),(1),(2),(3),(4),(5),(6),(7),(8)}
 9 | f        | {(0),(1),(2),(3),(4),(5),(6),(7),(8),(9)}
 0 | t        | {(0),(1),(2),(3),(4),(5),(6),(7),(8),(9),(0)}
(11 rows)

-- multiple CTEs
with recursive
graph(f, t, label) as (
  values (1, 2, 'arc 1 -> 2'),
         (1, 3, 'arc 1 -> 3'),
         (2, 3, 'arc 2 -> 3'),
         (1, 4, 'arc 1 -> 4'),
         (4, 5, 'arc 4 -> 5'),
         (5, 1, 'arc 5 -> 1')
),
search_graph(f, t, label) as (
        select * from tsurugifdw_graph g
        union all
        select g.*
        from tsurugifdw_graph g, search_graph sg
        where g.f = sg.t
) cycle f, t set is_cycle to true default false using path
select f, t, label from search_graph;
 f | t |   label    
---+---+------------
 1 | 2 | arc 1 -> 2
 1 | 3 | arc 1 -> 3
 2 | 3 | arc 2 -> 3
 1 | 4 | arc 1 -> 4
 4 | 5 | arc 4 -> 5
 5 | 1 | arc 5 -> 1
 2 | 3 | arc 2 -> 3
 4 | 5 | arc 4 -> 5
 5 | 1 | arc 5 -> 1
 1 | 4 | arc 1 -> 4
 1 | 3 | arc 1 -> 3
 1 | 2 | arc 1 -> 2
 5 | 1 | arc 5 -> 1
 1 | 4 | arc 1 -> 4
 1 | 3 | arc 1 -> 3
 1 | 2 | arc 1 -> 2
 4 | 5 | arc 4 -> 5
 2 | 3 | arc 2 -> 3
 1 | 4 | arc 1 -> 4
 1 | 3 | arc 1 -> 3
 1 | 2 | arc 1 -> 2
 4 | 5 | arc 4 -> 5
 2 | 3 | arc 2 -> 3
 5 | 1 | arc 5 -> 1
 2 | 3 | arc 2 -> 3
(25 rows)

-- star expansion
with recursive a as (
	select 1 as b
	union all
	select * from a
) cycle b set c using p
select * from a;
 b | c |     p     
---+---+-----------
 1 | f | {(1)}
 1 | t | {(1),(1)}
(2 rows)

-- search+cycle
with recursive search_graph(f, t, label) as (
	select * from tsurugifdw_graph g
	union all
	select g.*
	from tsurugifdw_graph g, search_graph sg
	where g.f = sg.t
) search depth first by f, t set seq
  cycle f, t set is_cycle using path
select * from search_graph ORDER BY f, t;
 f | t |   label    |                    seq                    | is_cycle |                   path                    
---+---+------------+-------------------------------------------+----------+-------------------------------------------
 1 | 2 | arc 1 -> 2 | {"(4,5)","(5,1)","(1,2)"}                 | f        | {"(4,5)","(5,1)","(1,2)"}
 1 | 2 | arc 1 -> 2 | {"(1,2)"}                                 | f        | {"(1,2)"}
 1 | 2 | arc 1 -> 2 | {"(1,4)","(4,5)","(5,1)","(1,2)"}         | f        | {"(1,4)","(4,5)","(5,1)","(1,2)"}
 1 | 2 | arc 1 -> 2 | {"(5,1)","(1,2)"}                         | f        | {"(5,1)","(1,2)"}
 1 | 3 | arc 1 -> 3 | {"(5,1)","(1,3)"}                         | f        | {"(5,1)","(1,3)"}
 1 | 3 | arc 1 -> 3 | {"(1,3)"}                                 | f        | {"(1,3)"}
 1 | 3 | arc 1 -> 3 | {"(4,5)","(5,1)","(1,3)"}                 | f        | {"(4,5)","(5,1)","(1,3)"}
 1 | 3 | arc 1 -> 3 | {"(1,4)","(4,5)","(5,1)","(1,3)"}         | f        | {"(1,4)","(4,5)","(5,1)","(1,3)"}
 1 | 4 | arc 1 -> 4 | {"(1,4)"}                                 | f        | {"(1,4)"}
 1 | 4 | arc 1 -> 4 | {"(1,4)","(4,5)","(5,1)","(1,4)"}         | t        | {"(1,4)","(4,5)","(5,1)","(1,4)"}
 1 | 4 | arc 1 -> 4 | {"(4,5)","(5,1)","(1,4)"}                 | f        | {"(4,5)","(5,1)","(1,4)"}
 1 | 4 | arc 1 -> 4 | {"(5,1)","(1,4)"}                         | f        | {"(5,1)","(1,4)"}
 2 | 3 | arc 2 -> 3 | {"(1,4)","(4,5)","(5,1)","(1,2)","(2,3)"} | f        | {"(1,4)","(4,5)","(5,1)","(1,2)","(2,3)"}
 2 | 3 | arc 2 -> 3 | {"(2,3)"}                                 | f        | {"(2,3)"}
 2 | 3 | arc 2 -> 3 | {"(1,2)","(2,3)"}                         | f        | {"(1,2)","(2,3)"}
 2 | 3 | arc 2 -> 3 | {"(5,1)","(1,2)","(2,3)"}                 | f        | {"(5,1)","(1,2)","(2,3)"}
 2 | 3 | arc 2 -> 3 | {"(4,5)","(5,1)","(1,2)","(2,3)"}         | f        | {"(4,5)","(5,1)","(1,2)","(2,3)"}
 4 | 5 | arc 4 -> 5 | {"(5,1)","(1,4)","(4,5)"}                 | f        | {"(5,1)","(1,4)","(4,5)"}
 4 | 5 | arc 4 -> 5 | {"(1,4)","(4,5)"}                         | f        | {"(1,4)","(4,5)"}
 4 | 5 | arc 4 -> 5 | {"(4,5)","(5,1)","(1,4)","(4,5)"}         | t        | {"(4,5)","(5,1)","(1,4)","(4,5)"}
 4 | 5 | arc 4 -> 5 | {"(4,5)"}                                 | f        | {"(4,5)"}
 5 | 1 | arc 5 -> 1 | {"(1,4)","(4,5)","(5,1)"}                 | f        | {"(1,4)","(4,5)","(5,1)"}
 5 | 1 | arc 5 -> 1 | {"(4,5)","(5,1)"}                         | f        | {"(4,5)","(5,1)"}
 5 | 1 | arc 5 -> 1 | {"(5,1)","(1,4)","(4,5)","(5,1)"}         | t        | {"(5,1)","(1,4)","(4,5)","(5,1)"}
 5 | 1 | arc 5 -> 1 | {"(5,1)"}                                 | f        | {"(5,1)"}
(25 rows)

with recursive search_graph(f, t, label) as (
	select * from tsurugifdw_graph g
	union all
	select g.*
	from tsurugifdw_graph g, search_graph sg
	where g.f = sg.t
) search breadth first by f, t set seq
  cycle f, t set is_cycle using path
select * from search_graph ORDER BY f, t;
 f | t |   label    |   seq   | is_cycle |                   path                    
---+---+------------+---------+----------+-------------------------------------------
 1 | 2 | arc 1 -> 2 | (2,1,2) | f        | {"(4,5)","(5,1)","(1,2)"}
 1 | 2 | arc 1 -> 2 | (0,1,2) | f        | {"(1,2)"}
 1 | 2 | arc 1 -> 2 | (3,1,2) | f        | {"(1,4)","(4,5)","(5,1)","(1,2)"}
 1 | 2 | arc 1 -> 2 | (1,1,2) | f        | {"(5,1)","(1,2)"}
 1 | 3 | arc 1 -> 3 | (1,1,3) | f        | {"(5,1)","(1,3)"}
 1 | 3 | arc 1 -> 3 | (0,1,3) | f        | {"(1,3)"}
 1 | 3 | arc 1 -> 3 | (2,1,3) | f        | {"(4,5)","(5,1)","(1,3)"}
 1 | 3 | arc 1 -> 3 | (3,1,3) | f        | {"(1,4)","(4,5)","(5,1)","(1,3)"}
 1 | 4 | arc 1 -> 4 | (0,1,4) | f        | {"(1,4)"}
 1 | 4 | arc 1 -> 4 | (3,1,4) | t        | {"(1,4)","(4,5)","(5,1)","(1,4)"}
 1 | 4 | arc 1 -> 4 | (2,1,4) | f        | {"(4,5)","(5,1)","(1,4)"}
 1 | 4 | arc 1 -> 4 | (1,1,4) | f        | {"(5,1)","(1,4)"}
 2 | 3 | arc 2 -> 3 | (4,2,3) | f        | {"(1,4)","(4,5)","(5,1)","(1,2)","(2,3)"}
 2 | 3 | arc 2 -> 3 | (0,2,3) | f        | {"(2,3)"}
 2 | 3 | arc 2 -> 3 | (1,2,3) | f        | {"(1,2)","(2,3)"}
 2 | 3 | arc 2 -> 3 | (2,2,3) | f        | {"(5,1)","(1,2)","(2,3)"}
 2 | 3 | arc 2 -> 3 | (3,2,3) | f        | {"(4,5)","(5,1)","(1,2)","(2,3)"}
 4 | 5 | arc 4 -> 5 | (2,4,5) | f        | {"(5,1)","(1,4)","(4,5)"}
 4 | 5 | arc 4 -> 5 | (1,4,5) | f        | {"(1,4)","(4,5)"}
 4 | 5 | arc 4 -> 5 | (3,4,5) | t        | {"(4,5)","(5,1)","(1,4)","(4,5)"}
 4 | 5 | arc 4 -> 5 | (0,4,5) | f        | {"(4,5)"}
 5 | 1 | arc 5 -> 1 | (2,5,1) | f        | {"(1,4)","(4,5)","(5,1)"}
 5 | 1 | arc 5 -> 1 | (1,5,1) | f        | {"(4,5)","(5,1)"}
 5 | 1 | arc 5 -> 1 | (3,5,1) | t        | {"(5,1)","(1,4)","(4,5)","(5,1)"}
 5 | 1 | arc 5 -> 1 | (0,5,1) | f        | {"(5,1)"}
(25 rows)

-- various syntax errors
with recursive search_graph(f, t, label) as (
	select * from tsurugifdw_graph g
	union all
	select g.*
	from tsurugifdw_graph g, search_graph sg
	where g.f = sg.t
) cycle foo, tar set is_cycle using path
select * from search_graph;
ERROR:  cycle column "foo" not in WITH query column list
LINE 7: ) cycle foo, tar set is_cycle using path
          ^
with recursive search_graph(f, t, label) as (
	select * from tsurugifdw_graph g
	union all
	select g.*
	from tsurugifdw_graph g, search_graph sg
	where g.f = sg.t
) cycle f, t set is_cycle to true default 55 using path
select * from search_graph;
ERROR:  CYCLE types boolean and integer cannot be matched
LINE 7: ) cycle f, t set is_cycle to true default 55 using path
                                                  ^
with recursive search_graph(f, t, label) as (
	select * from tsurugifdw_graph g
	union all
	select g.*
	from tsurugifdw_graph g, search_graph sg
	where g.f = sg.t
) cycle f, t set is_cycle to point '(1,1)' default point '(0,0)' using path
select * from search_graph;
ERROR:  could not identify an equality operator for type point
with recursive search_graph(f, t, label) as (
	select * from tsurugifdw_graph g
	union all
	select g.*
	from tsurugifdw_graph g, search_graph sg
	where g.f = sg.t
) cycle f, t set label to true default false using path
select * from search_graph;
ERROR:  cycle mark column name "label" already used in WITH query column list
LINE 7: ) cycle f, t set label to true default false using path
          ^
with recursive search_graph(f, t, label) as (
	select * from tsurugifdw_graph g
	union all
	select g.*
	from tsurugifdw_graph g, search_graph sg
	where g.f = sg.t
) cycle f, t set is_cycle to true default false using label
select * from search_graph;
ERROR:  cycle path column name "label" already used in WITH query column list
LINE 7: ) cycle f, t set is_cycle to true default false using label
          ^
with recursive search_graph(f, t, label) as (
	select * from tsurugifdw_graph g
	union all
	select g.*
	from tsurugifdw_graph g, search_graph sg
	where g.f = sg.t
) cycle f, t set foo to true default false using foo
select * from search_graph;
ERROR:  cycle mark column name and cycle path column name are the same
LINE 7: ) cycle f, t set foo to true default false using foo
          ^
with recursive search_graph(f, t, label) as (
	select * from tsurugifdw_graph g
	union all
	select g.*
	from tsurugifdw_graph g, search_graph sg
	where g.f = sg.t
) cycle f, t, f set is_cycle to true default false using path
select * from search_graph;
ERROR:  cycle column "f" specified more than once
LINE 7: ) cycle f, t, f set is_cycle to true default false using pat...
          ^
with recursive search_graph(f, t, label) as (
	select * from tsurugifdw_graph g
	union all
	select g.*
	from tsurugifdw_graph g, search_graph sg
	where g.f = sg.t
) search depth first by f, t set foo
  cycle f, t set foo to true default false using path
select * from search_graph;
ERROR:  search sequence column name and cycle mark column name are the same
LINE 7: ) search depth first by f, t set foo
          ^
with recursive search_graph(f, t, label) as (
	select * from tsurugifdw_graph g
	union all
	select g.*
	from tsurugifdw_graph g, search_graph sg
	where g.f = sg.t
) search depth first by f, t set foo
  cycle f, t set is_cycle to true default false using foo
select * from search_graph;
ERROR:  search sequence column name and cycle path column name are the same
LINE 7: ) search depth first by f, t set foo
          ^
-- test ruleutils and view expansion
create temp view v_cycle1 as
with recursive search_graph(f, t, label) as (
	select * from tsurugifdw_graph g
	union all
	select g.*
	from tsurugifdw_graph g, search_graph sg
	where g.f = sg.t
) cycle f, t set is_cycle using path
select f, t, label from search_graph;
create temp view v_cycle2 as
with recursive search_graph(f, t, label) as (
	select * from tsurugifdw_graph g
	union all
	select g.*
	from tsurugifdw_graph g, search_graph sg
	where g.f = sg.t
) cycle f, t set is_cycle to 'Y' default 'N' using path
select f, t, label from search_graph;
select pg_get_viewdef('v_cycle1');
                 pg_get_viewdef                 
------------------------------------------------
  WITH RECURSIVE search_graph(f, t, label) AS (+
          SELECT g.f,                          +
             g.t,                              +
             g.label                           +
            FROM tsurugifdw_graph g            +
         UNION ALL                             +
          SELECT g.f,                          +
             g.t,                              +
             g.label                           +
            FROM tsurugifdw_graph g,           +
             search_graph sg                   +
           WHERE (g.f = sg.t)                  +
         ) CYCLE f, t SET is_cycle USING path  +
  SELECT f,                                    +
     t,                                        +
     label                                     +
    FROM search_graph;
(1 row)

select pg_get_viewdef('v_cycle2');
                               pg_get_viewdef                                
-----------------------------------------------------------------------------
  WITH RECURSIVE search_graph(f, t, label) AS (                             +
          SELECT g.f,                                                       +
             g.t,                                                           +
             g.label                                                        +
            FROM tsurugifdw_graph g                                         +
         UNION ALL                                                          +
          SELECT g.f,                                                       +
             g.t,                                                           +
             g.label                                                        +
            FROM tsurugifdw_graph g,                                        +
             search_graph sg                                                +
           WHERE (g.f = sg.t)                                               +
         ) CYCLE f, t SET is_cycle TO 'Y'::text DEFAULT 'N'::text USING path+
  SELECT f,                                                                 +
     t,                                                                     +
     label                                                                  +
    FROM search_graph;
(1 row)

select * from v_cycle1 order by f, t;
 f | t |   label    
---+---+------------
 1 | 2 | arc 1 -> 2
 1 | 2 | arc 1 -> 2
 1 | 2 | arc 1 -> 2
 1 | 2 | arc 1 -> 2
 1 | 3 | arc 1 -> 3
 1 | 3 | arc 1 -> 3
 1 | 3 | arc 1 -> 3
 1 | 3 | arc 1 -> 3
 1 | 4 | arc 1 -> 4
 1 | 4 | arc 1 -> 4
 1 | 4 | arc 1 -> 4
 1 | 4 | arc 1 -> 4
 2 | 3 | arc 2 -> 3
 2 | 3 | arc 2 -> 3
 2 | 3 | arc 2 -> 3
 2 | 3 | arc 2 -> 3
 2 | 3 | arc 2 -> 3
 4 | 5 | arc 4 -> 5
 4 | 5 | arc 4 -> 5
 4 | 5 | arc 4 -> 5
 4 | 5 | arc 4 -> 5
 5 | 1 | arc 5 -> 1
 5 | 1 | arc 5 -> 1
 5 | 1 | arc 5 -> 1
 5 | 1 | arc 5 -> 1
(25 rows)

select * from v_cycle2 order by f, t;
 f | t |   label    
---+---+------------
 1 | 2 | arc 1 -> 2
 1 | 2 | arc 1 -> 2
 1 | 2 | arc 1 -> 2
 1 | 2 | arc 1 -> 2
 1 | 3 | arc 1 -> 3
 1 | 3 | arc 1 -> 3
 1 | 3 | arc 1 -> 3
 1 | 3 | arc 1 -> 3
 1 | 4 | arc 1 -> 4
 1 | 4 | arc 1 -> 4
 1 | 4 | arc 1 -> 4
 1 | 4 | arc 1 -> 4
 2 | 3 | arc 2 -> 3
 2 | 3 | arc 2 -> 3
 2 | 3 | arc 2 -> 3
 2 | 3 | arc 2 -> 3
 2 | 3 | arc 2 -> 3
 4 | 5 | arc 4 -> 5
 4 | 5 | arc 4 -> 5
 4 | 5 | arc 4 -> 5
 4 | 5 | arc 4 -> 5
 5 | 1 | arc 5 -> 1
 5 | 1 | arc 5 -> 1
 5 | 1 | arc 5 -> 1
 5 | 1 | arc 5 -> 1
(25 rows)

--
-- test multiple WITH queries
--
WITH RECURSIVE
  y (id) AS (VALUES (1)),
  x (id) AS (SELECT * FROM y UNION ALL SELECT id+1 FROM x WHERE id < 5)
SELECT * FROM x;
 id 
----
  1
  2
  3
  4
  5
(5 rows)

-- forward reference OK
WITH RECURSIVE
    x(id) AS (SELECT * FROM y UNION ALL SELECT id+1 FROM x WHERE id < 5),
    y(id) AS (values (1))
 SELECT * FROM x;
 id 
----
  1
  2
  3
  4
  5
(5 rows)

WITH RECURSIVE
   x(id) AS
     (VALUES (1) UNION ALL SELECT id+1 FROM x WHERE id < 5),
   y(id) AS
     (VALUES (1) UNION ALL SELECT id+1 FROM y WHERE id < 10)
 SELECT y.*, x.* FROM y LEFT JOIN x USING (id);
 id | id 
----+----
  1 |  1
  2 |  2
  3 |  3
  4 |  4
  5 |  5
  6 |   
  7 |   
  8 |   
  9 |   
 10 |   
(10 rows)

WITH RECURSIVE
   x(id) AS
     (VALUES (1) UNION ALL SELECT id+1 FROM x WHERE id < 5),
   y(id) AS
     (VALUES (1) UNION ALL SELECT id+1 FROM x WHERE id < 10)
 SELECT y.*, x.* FROM y LEFT JOIN x USING (id);
 id | id 
----+----
  1 |  1
  2 |  2
  3 |  3
  4 |  4
  5 |  5
  6 |   
(6 rows)

WITH RECURSIVE
   x(id) AS
     (SELECT 1 UNION ALL SELECT id+1 FROM x WHERE id < 3 ),
   y(id) AS
     (SELECT * FROM x UNION ALL SELECT * FROM x),
   z(id) AS
     (SELECT * FROM x UNION ALL SELECT id+1 FROM z WHERE id < 10)
 SELECT * FROM z;
 id 
----
  1
  2
  3
  2
  3
  4
  3
  4
  5
  4
  5
  6
  5
  6
  7
  6
  7
  8
  7
  8
  9
  8
  9
 10
  9
 10
 10
(27 rows)

WITH RECURSIVE
   x(id) AS
     (SELECT 1 UNION ALL SELECT id+1 FROM x WHERE id < 3 ),
   y(id) AS
     (SELECT * FROM x UNION ALL SELECT * FROM x),
   z(id) AS
     (SELECT * FROM y UNION ALL SELECT id+1 FROM z WHERE id < 10)
 SELECT * FROM z;
 id 
----
  1
  2
  3
  1
  2
  3
  2
  3
  4
  2
  3
  4
  3
  4
  5
  3
  4
  5
  4
  5
  6
  4
  5
  6
  5
  6
  7
  5
  6
  7
  6
  7
  8
  6
  7
  8
  7
  8
  9
  7
  8
  9
  8
  9
 10
  8
  9
 10
  9
 10
  9
 10
 10
 10
(54 rows)

--
-- Test WITH attached to a data-modifying statement
--
SELECT tg_execute_ddl('CREATE TABLE tsurugifdw_y( a INTEGER )', 'tsurugidb');
  tg_execute_ddl   
-------------------
 execute succeeded
(1 row)

CREATE FOREIGN TABLE tsurugifdw_y ( a INTEGER ) SERVER tsurugidb;
ALTER FOREIGN TABLE tsurugifdw_y ALTER COLUMN a OPTIONS (key 'true');
INSERT INTO tsurugifdw_y SELECT generate_series(1, 10);
WITH t AS (
	SELECT a FROM tsurugifdw_y
)
INSERT INTO tsurugifdw_y
SELECT a+20 FROM t;
SELECT * FROM tsurugifdw_y;
 a  
----
  1
  2
  3
  4
  5
  6
  7
  8
  9
 10
 21
 22
 23
 24
 25
 26
 27
 28
 29
 30
(20 rows)

WITH t AS (
	SELECT a FROM tsurugifdw_y
)
UPDATE tsurugifdw_y SET a = tsurugifdw_y.a-10 FROM t WHERE tsurugifdw_y.a > 20 AND t.a = tsurugifdw_y.a;
SELECT * FROM tsurugifdw_y;
 a  
----
  1
  2
  3
  4
  5
  6
  7
  8
  9
 10
 11
 12
 13
 14
 15
 16
 17
 18
 19
 20
(20 rows)

WITH RECURSIVE t(a) AS (
	SELECT 11
	UNION ALL
	SELECT a+1 FROM t WHERE a < 50
)
DELETE FROM tsurugifdw_y USING t WHERE t.a = tsurugifdw_y.a;
SELECT * FROM tsurugifdw_y;
 a  
----
  1
  2
  3
  4
  5
  6
  7
  8
  9
 10
(10 rows)

SELECT tg_execute_ddl('DROP TABLE tsurugifdw_y', 'tsurugidb');
  tg_execute_ddl   
-------------------
 execute succeeded
(1 row)

DROP FOREIGN TABLE tsurugifdw_y;
--
-- error cases
--
WITH x(n, b) AS (SELECT 1)
SELECT * FROM tsurugifdw_x;
ERROR:  WITH query "x" has 1 columns available but 2 columns specified
LINE 1: WITH x(n, b) AS (SELECT 1)
             ^
-- INTERSECT
WITH RECURSIVE tsurugifdw_x(n) AS (SELECT 1 INTERSECT SELECT n+1 FROM tsurugifdw_x)
	SELECT * FROM tsurugifdw_x;
ERROR:  recursive query "tsurugifdw_x" does not have the form non-recursive-term UNION [ALL] recursive-term
LINE 1: WITH RECURSIVE tsurugifdw_x(n) AS (SELECT 1 INTERSECT SELECT...
                       ^
WITH RECURSIVE tsurugifdw_x(n) AS (SELECT 1 INTERSECT ALL SELECT n+1 FROM tsurugifdw_x)
	SELECT * FROM tsurugifdw_x;
ERROR:  recursive query "tsurugifdw_x" does not have the form non-recursive-term UNION [ALL] recursive-term
LINE 1: WITH RECURSIVE tsurugifdw_x(n) AS (SELECT 1 INTERSECT ALL SE...
                       ^
-- EXCEPT
WITH RECURSIVE tsurugifdw_x(n) AS (SELECT 1 EXCEPT SELECT n+1 FROM tsurugifdw_x)
	SELECT * FROM tsurugifdw_x;
ERROR:  recursive query "tsurugifdw_x" does not have the form non-recursive-term UNION [ALL] recursive-term
LINE 1: WITH RECURSIVE tsurugifdw_x(n) AS (SELECT 1 EXCEPT SELECT n+...
                       ^
WITH RECURSIVE tsurugifdw_x(n) AS (SELECT 1 EXCEPT ALL SELECT n+1 FROM tsurugifdw_x)
	SELECT * FROM tsurugifdw_x;
ERROR:  recursive query "tsurugifdw_x" does not have the form non-recursive-term UNION [ALL] recursive-term
LINE 1: WITH RECURSIVE tsurugifdw_x(n) AS (SELECT 1 EXCEPT ALL SELEC...
                       ^
-- no non-recursive term
WITH RECURSIVE tsurugifdw_x(n) AS (SELECT n FROM tsurugifdw_x)
	SELECT * FROM tsurugifdw_x;
ERROR:  recursive query "tsurugifdw_x" does not have the form non-recursive-term UNION [ALL] recursive-term
LINE 1: WITH RECURSIVE tsurugifdw_x(n) AS (SELECT n FROM tsurugifdw_...
                       ^
-- recursive term in the left hand side (strictly speaking, should allow this)
WITH RECURSIVE tsurugifdw_x(n) AS (SELECT n FROM tsurugifdw_x UNION ALL SELECT 1)
	SELECT * FROM tsurugifdw_x;
ERROR:  recursive reference to query "tsurugifdw_x" must not appear within its non-recursive term
LINE 1: WITH RECURSIVE tsurugifdw_x(n) AS (SELECT n FROM tsurugifdw_...
                                                         ^
-- allow this, because we historically have
WITH RECURSIVE tsurugifdw_x(n) AS (
  WITH x1 AS (SELECT 1 AS n)
    SELECT 0
    UNION
    SELECT * FROM x1)
	SELECT * FROM tsurugifdw_x;
 n 
---
 0
 1
(2 rows)

-- but this should be rejected
WITH RECURSIVE tsurugifdw_x(n) AS (
  WITH x1 AS (SELECT 1 FROM tsurugifdw_x)
    SELECT 0
    UNION
    SELECT * FROM x1)
	SELECT * FROM tsurugifdw_x;
ERROR:  recursive reference to query "tsurugifdw_x" must not appear within a subquery
LINE 2:   WITH x1 AS (SELECT 1 FROM tsurugifdw_x)
                                    ^
-- and this too
WITH RECURSIVE tsurugifdw_x(n) AS (
  (WITH x1 AS (SELECT 1 FROM tsurugifdw_x) SELECT * FROM x1)
  UNION
  SELECT 0)
	SELECT * FROM tsurugifdw_x;
ERROR:  recursive reference to query "tsurugifdw_x" must not appear within its non-recursive term
LINE 2:   (WITH x1 AS (SELECT 1 FROM tsurugifdw_x) SELECT * FROM x1)
                                     ^
-- and this
WITH RECURSIVE tsurugifdw_x(n) AS (
  SELECT 0 UNION SELECT 1
  ORDER BY (SELECT n FROM tsurugifdw_x))
	SELECT * FROM tsurugifdw_x;
ERROR:  ORDER BY in a recursive query is not implemented
LINE 3:   ORDER BY (SELECT n FROM tsurugifdw_x))
                   ^
-- and this
WITH RECURSIVE tsurugifdw_x(n) AS (
  WITH sub_cte AS (SELECT * FROM tsurugifdw_x)
  DELETE FROM tsurugifdw_graph RETURNING f)
	SELECT * FROM tsurugifdw_x;
ERROR:  recursive query "tsurugifdw_x" must not contain data-modifying statements
LINE 1: WITH RECURSIVE tsurugifdw_x(n) AS (
                       ^
SELECT tg_execute_ddl('CREATE TABLE tsurugifdw_y( a INTEGER )', 'tsurugidb');
  tg_execute_ddl   
-------------------
 execute succeeded
(1 row)

CREATE FOREIGN TABLE tsurugifdw_y ( a INTEGER ) SERVER tsurugidb;
INSERT INTO tsurugifdw_y SELECT generate_series(1, 10);
-- LEFT JOIN
WITH RECURSIVE tsurugifdw_x(n) AS (SELECT a FROM tsurugifdw_y WHERE a = 1
	UNION ALL
	SELECT x.n+1 FROM tsurugifdw_y LEFT JOIN tsurugifdw_x ON tsurugifdw_x.n = tsurugifdw_y.a WHERE n < 10)
SELECT * FROM tsurugifdw_x;
ERROR:  recursive reference to query "tsurugifdw_x" must not appear within an outer join
LINE 3:  SELECT x.n+1 FROM tsurugifdw_y LEFT JOIN tsurugifdw_x ON ts...
                                                  ^
-- RIGHT JOIN
WITH RECURSIVE tsurugifdw_x(n) AS (SELECT a FROM y WHERE a = 1
	UNION ALL
	SELECT tsurugifdw_x.n+1 FROM tsurugifdw_x RIGHT JOIN tsurugifdw_y ON tsurugifdw_x.n = tsurugifdw_y.a WHERE n < 10)
SELECT * FROM tsurugifdw_x;
ERROR:  recursive reference to query "tsurugifdw_x" must not appear within an outer join
LINE 3:  SELECT tsurugifdw_x.n+1 FROM tsurugifdw_x RIGHT JOIN tsurug...
                                      ^
-- FULL JOIN
WITH RECURSIVE tsurugifdw_x(n) AS (SELECT a FROM y WHERE a = 1
	UNION ALL
	SELECT tsurugifdw_x.n+1 FROM tsurugifdw_x FULL JOIN tsurugifdw_y ON tsurugifdw_x.n = tsurugifdw_y.a WHERE n < 10)
SELECT * FROM tsurugifdw_x;
ERROR:  recursive reference to query "tsurugifdw_x" must not appear within an outer join
LINE 3:  SELECT tsurugifdw_x.n+1 FROM tsurugifdw_x FULL JOIN tsurugi...
                                      ^
-- subquery
WITH RECURSIVE tsurugifdw_x(n) AS (SELECT 1 UNION ALL SELECT n+1 FROM tsurugifdw_x
                          WHERE n IN (SELECT * FROM tsurugifdw_x))
  SELECT * FROM tsurugifdw_x;
ERROR:  recursive reference to query "tsurugifdw_x" must not appear within a subquery
LINE 2: ...                        WHERE n IN (SELECT * FROM tsurugifdw...
                                                             ^
-- aggregate functions
WITH RECURSIVE tsurugifdw_x(n) AS (SELECT 1 UNION ALL SELECT count(*) FROM tsurugifdw_x)
  SELECT * FROM tsurugifdw_x;
ERROR:  aggregate functions are not allowed in a recursive query's recursive term
LINE 1: ...IVE tsurugifdw_x(n) AS (SELECT 1 UNION ALL SELECT count(*) F...
                                                             ^
WITH RECURSIVE tsurugifdw_x(n) AS (SELECT 1 UNION ALL SELECT sum(n) FROM tsurugifdw_x)
  SELECT * FROM tsurugifdw_x;
ERROR:  aggregate functions are not allowed in a recursive query's recursive term
LINE 1: ...IVE tsurugifdw_x(n) AS (SELECT 1 UNION ALL SELECT sum(n) FRO...
                                                             ^
-- ORDER BY
WITH RECURSIVE tsurugifdw_x(n) AS (SELECT 1 UNION ALL SELECT n+1 FROM tsurugifdw_x ORDER BY 1)
  SELECT * FROM tsurugifdw_x;
ERROR:  ORDER BY in a recursive query is not implemented
LINE 1: ...(SELECT 1 UNION ALL SELECT n+1 FROM tsurugifdw_x ORDER BY 1)
                                                                     ^
-- LIMIT/OFFSET
WITH RECURSIVE tsurugifdw_x(n) AS (SELECT 1 UNION ALL SELECT n+1 FROM tsurugifdw_x LIMIT 10 OFFSET 1)
  SELECT * FROM tsurugifdw_x;
ERROR:  OFFSET in a recursive query is not implemented
LINE 1: ... 1 UNION ALL SELECT n+1 FROM tsurugifdw_x LIMIT 10 OFFSET 1)
                                                                     ^
-- FOR UPDATE
WITH RECURSIVE tsurugifdw_x(n) AS (SELECT 1 UNION ALL SELECT n+1 FROM tsurugifdw_x FOR UPDATE)
  SELECT * FROM tsurugifdw_x;
ERROR:  FOR UPDATE/SHARE in a recursive query is not implemented
-- target list has a recursive query name
WITH RECURSIVE tsurugifdw_x(id) AS (values (1)
    UNION ALL
    SELECT (SELECT * FROM tsurugifdw_x) FROM tsurugifdw_x WHERE id < 5
) SELECT * FROM tsurugifdw_x;
ERROR:  recursive reference to query "tsurugifdw_x" must not appear within a subquery
LINE 3:     SELECT (SELECT * FROM tsurugifdw_x) FROM tsurugifdw_x WH...
                                  ^
-- mutual recursive query (not implemented)
WITH RECURSIVE
  tsurugifdw_x (id) AS (SELECT 1 UNION ALL SELECT id+1 FROM tsurugifdw_y WHERE id < 5),
  tsurugifdw_y (id) AS (SELECT 1 UNION ALL SELECT id+1 FROM tsurugifdw_x WHERE id < 5)
SELECT * FROM tsurugifdw_x;
ERROR:  mutual recursion between WITH items is not implemented
LINE 2:   tsurugifdw_x (id) AS (SELECT 1 UNION ALL SELECT id+1 FROM ...
          ^
-- non-linear recursion is not allowed
WITH RECURSIVE tsurugifdw_foo(i) AS
    (values (1)
    UNION ALL
       (SELECT i+1 FROM tsurugifdw_foo WHERE i < 10
          UNION ALL
       SELECT i+1 FROM tsurugifdw_foo WHERE i < 5)
) SELECT * FROM tsurugifdw_foo;
ERROR:  recursive reference to query "tsurugifdw_foo" must not appear more than once
LINE 6:        SELECT i+1 FROM tsurugifdw_foo WHERE i < 5)
                               ^
WITH RECURSIVE tsurugifdw_foo(i) AS
    (values (1)
    UNION ALL
	   SELECT * FROM
       (SELECT i+1 FROM tsurugifdw_foo WHERE i < 10
          UNION ALL
       SELECT i+1 FROM tsurugifdw_foo WHERE i < 5) AS t
) SELECT * FROM tsurugifdw_foo;
ERROR:  recursive reference to query "tsurugifdw_foo" must not appear more than once
LINE 7:        SELECT i+1 FROM tsurugifdw_foo WHERE i < 5) AS t
                               ^
WITH RECURSIVE tsurugifdw_foo(i) AS
    (values (1)
    UNION ALL
       (SELECT i+1 FROM tsurugifdw_foo WHERE i < 10
          EXCEPT
       SELECT i+1 FROM tsurugifdw_foo WHERE i < 5)
) SELECT * FROM tsurugifdw_foo;
ERROR:  recursive reference to query "tsurugifdw_foo" must not appear within EXCEPT
LINE 6:        SELECT i+1 FROM tsurugifdw_foo WHERE i < 5)
                               ^
WITH RECURSIVE tsurugifdw_foo(i) AS
    (values (1)
    UNION ALL
       (SELECT i+1 FROM tsurugifdw_foo WHERE i < 10
          INTERSECT
       SELECT i+1 FROM tsurugifdw_foo WHERE i < 5)
) SELECT * FROM tsurugifdw_foo;
ERROR:  recursive reference to query "tsurugifdw_foo" must not appear more than once
LINE 6:        SELECT i+1 FROM tsurugifdw_foo WHERE i < 5)
                               ^
-- Wrong type induced from non-recursive term
WITH RECURSIVE tsurugifdw_foo(i) AS
   (SELECT i FROM (VALUES(1),(2)) t(i)
   UNION ALL
   SELECT (i+1)::numeric(10,0) FROM tsurugifdw_foo WHERE i < 10)
SELECT * FROM tsurugifdw_foo;
ERROR:  recursive query "tsurugifdw_foo" column 1 has type integer in non-recursive term but type numeric overall
LINE 2:    (SELECT i FROM (VALUES(1),(2)) t(i)
                   ^
HINT:  Cast the output of the non-recursive term to the correct type.
-- rejects different typmod, too (should we allow this?)
WITH RECURSIVE tsurugifdw_foo(i) AS
   (SELECT i::numeric(3,0) FROM (VALUES(1),(2)) t(i)
   UNION ALL
   SELECT (i+1)::numeric(10,0) FROM tsurugifdw_foo WHERE i < 10)
SELECT * FROM tsurugifdw_foo;
ERROR:  recursive query "tsurugifdw_foo" column 1 has type numeric(3,0) in non-recursive term but type numeric overall
LINE 2:    (SELECT i::numeric(3,0) FROM (VALUES(1),(2)) t(i)
                   ^
HINT:  Cast the output of the non-recursive term to the correct type.
-- disallow OLD/NEW reference in CTE
SELECT tg_execute_ddl('CREATE TABLE tsurugifdw_x (n integer)', 'tsurugidb');
  tg_execute_ddl   
-------------------
 execute succeeded
(1 row)

CREATE FOREIGN TABLE tsurugifdw_x (n integer) SERVER tsurugidb;
CREATE RULE r2 AS ON UPDATE TO tsurugifdw_x DO INSTEAD
    WITH t AS (SELECT OLD.*) UPDATE tsurugifdw_y SET a = t.n FROM t;
ERROR:  cannot refer to OLD within WITH query
--
-- test for bug #4902
--
with cte(tsurugifdw_foo) as ( values(42) ) values((select tsurugifdw_foo from cte));
 column1 
---------
      42
(1 row)

with cte(tsurugifdw_foo) as ( select 42 ) select * from ((select tsurugifdw_foo from cte)) q;
 tsurugifdw_foo 
----------------
             42
(1 row)

-- test CTE referencing an outer-level variable (to see that changed-parameter
-- signaling still works properly after fixing this bug)
select ( with cte(tsurugifdw_foo) as ( values(f1) )
         select (select tsurugifdw_foo from cte) )
from tsurugifdw_int4_tbl;
 tsurugifdw_foo 
----------------
              0
         123456
        -123456
     2147483647
    -2147483647
(5 rows)

select ( with cte(tsurugifdw_foo) as ( values(f1) )
          values((select tsurugifdw_foo from cte)) )
from tsurugifdw_int4_tbl;
   column1   
-------------
           0
      123456
     -123456
  2147483647
 -2147483647
(5 rows)

--
-- test for bug #19055: interaction of WITH with aggregates
--
-- For now, we just throw an error if there's a use of a CTE below the
-- semantic level that the SQL standard assigns to the aggregate.
-- It's not entirely clear what we could do instead that doesn't risk
-- breaking more things than it fixes.
select f1, (with cte1(x,y) as (select 1,2)
            select count((select i4.f1 from cte1))) as ss
from tsurugifdw_int4_tbl i4;
ERROR:  outer-level aggregate cannot use a nested CTE
LINE 2:             select count((select i4.f1 from cte1))) as ss
                           ^
DETAIL:  CTE "cte1" is below the aggregate's semantic level.
--
-- test for bug #19106: interaction of WITH with aggregates
--
-- the initial fix for #19055 was too aggressive and broke this case
with a as ( select id from (values (1), (2)) as v(id) ),
     b as ( select max((select sum(id) from a)) as agg )
select agg from b;
 agg 
-----
   3
(1 row)

--
-- test for nested-recursive-WITH bug
--
WITH RECURSIVE t(j) AS (
    WITH RECURSIVE s(i) AS (
        VALUES (1)
        UNION ALL
        SELECT i+1 FROM s WHERE i < 10
    )
    SELECT i FROM s
    UNION ALL
    SELECT j+1 FROM t WHERE j < 10
)
SELECT * FROM t;
 j  
----
  1
  2
  3
  4
  5
  6
  7
  8
  9
 10
  2
  3
  4
  5
  6
  7
  8
  9
 10
  3
  4
  5
  6
  7
  8
  9
 10
  4
  5
  6
  7
  8
  9
 10
  5
  6
  7
  8
  9
 10
  6
  7
  8
  9
 10
  7
  8
  9
 10
  8
  9
 10
  9
 10
 10
(55 rows)

--
-- test WITH attached to intermediate-level set operation
--
WITH outermost(x) AS (
  SELECT 1
  UNION (WITH innermost as (SELECT 2)
         SELECT * FROM innermost
         UNION SELECT 3)
)
SELECT * FROM outermost ORDER BY 1;
 x 
---
 1
 2
 3
(3 rows)

WITH outermost(x) AS (
  SELECT 1
  UNION (WITH innermost as (SELECT 2)
         SELECT * FROM outermost  -- fail
         UNION SELECT * FROM innermost)
)
SELECT * FROM outermost ORDER BY 1;
ERROR:  relation "outermost" does not exist
LINE 4:          SELECT * FROM outermost  -- fail
                               ^
DETAIL:  There is a WITH item named "outermost", but it cannot be referenced from this part of the query.
HINT:  Use WITH RECURSIVE, or re-order the WITH items to remove forward references.
WITH RECURSIVE outermost(x) AS (
  SELECT 1
  UNION (WITH innermost as (SELECT 2)
         SELECT * FROM outermost
         UNION SELECT * FROM innermost)
)
SELECT * FROM outermost ORDER BY 1;
 x 
---
 1
 2
(2 rows)

WITH RECURSIVE outermost(x) AS (
  WITH innermost as (SELECT 2 FROM outermost) -- fail
    SELECT * FROM innermost
    UNION SELECT * from outermost
)
SELECT * FROM outermost ORDER BY 1;
ERROR:  recursive reference to query "outermost" must not appear within a subquery
LINE 2:   WITH innermost as (SELECT 2 FROM outermost) -- fail
                                           ^
--
-- This test will fail with the old implementation of PARAM_EXEC parameter
-- assignment, because the "q1" Var passed down to A's targetlist subselect
-- looks exactly like the "A.id" Var passed down to C's subselect, causing
-- the old code to give them the same runtime PARAM_EXEC slot.  But the
-- lifespans of the two parameters overlap, thanks to B also reading A.
--
with
A as ( select q2 as id, (select q1) as x from tsurugifdw_int8_tbl ),
B as ( select id, row_number() over (partition by id) as r from A ),
C as ( select A.id, array(select B.id from B where B.id = A.id) from A )
select * from C;
        id         |                array                
-------------------+-------------------------------------
               456 | {456}
  4567890123456789 | {4567890123456789,4567890123456789}
               123 | {123}
  4567890123456789 | {4567890123456789,4567890123456789}
 -4567890123456789 | {-4567890123456789}
(5 rows)

--
-- Test CTEs read in non-initialization orders
--
WITH RECURSIVE
  tab(id_key,link) AS (VALUES (1,17), (2,17), (3,17), (4,17), (6,17), (5,17)),
  iter (id_key, row_type, link) AS (
      SELECT 0, 'base', 17
    UNION ALL (
      WITH remaining(id_key, row_type, link, min) AS (
        SELECT tab.id_key, 'true'::text, iter.link, MIN(tab.id_key) OVER ()
        FROM tab INNER JOIN iter USING (link)
        WHERE tab.id_key > iter.id_key
      ),
      first_remaining AS (
        SELECT id_key, row_type, link
        FROM remaining
        WHERE id_key=min
      ),
      effect AS (
        SELECT tab.id_key, 'new'::text, tab.link
        FROM first_remaining e INNER JOIN tab ON e.id_key=tab.id_key
        WHERE e.row_type = 'false'
      )
      SELECT * FROM first_remaining
      UNION ALL SELECT * FROM effect
    )
  )
SELECT * FROM iter;
 id_key | row_type | link 
--------+----------+------
      0 | base     |   17
      1 | true     |   17
      2 | true     |   17
      3 | true     |   17
      4 | true     |   17
      5 | true     |   17
      6 | true     |   17
(7 rows)

WITH RECURSIVE
  tab(id_key,link) AS (VALUES (1,17), (2,17), (3,17), (4,17), (6,17), (5,17)),
  iter (id_key, row_type, link) AS (
      SELECT 0, 'base', 17
    UNION (
      WITH remaining(id_key, row_type, link, min) AS (
        SELECT tab.id_key, 'true'::text, iter.link, MIN(tab.id_key) OVER ()
        FROM tab INNER JOIN iter USING (link)
        WHERE tab.id_key > iter.id_key
      ),
      first_remaining AS (
        SELECT id_key, row_type, link
        FROM remaining
        WHERE id_key=min
      ),
      effect AS (
        SELECT tab.id_key, 'new'::text, tab.link
        FROM first_remaining e INNER JOIN tab ON e.id_key=tab.id_key
        WHERE e.row_type = 'false'
      )
      SELECT * FROM first_remaining
      UNION ALL SELECT * FROM effect
    )
  )
SELECT * FROM iter;
 id_key | row_type | link 
--------+----------+------
      0 | base     |   17
      1 | true     |   17
      2 | true     |   17
      3 | true     |   17
      4 | true     |   17
      5 | true     |   17
      6 | true     |   17
(7 rows)

--
-- Data-modifying statements in WITH
--
-- INSERT ... RETURNING
WITH t AS (
    INSERT INTO tsurugifdw_y
    VALUES
        (11),
        (12),
        (13),
        (14),
        (15),
        (16),
        (17),
        (18),
        (19),
        (20)
    RETURNING *
)
SELECT * FROM t;
ERROR:  RETURNING clause is not supported
SELECT * FROM tsurugifdw_y;
 a  
----
  1
  2
  3
  4
  5
  6
  7
  8
  9
 10
(10 rows)

-- UPDATE ... RETURNING
WITH t AS (
    UPDATE tsurugifdw_y
    SET a=a+1
    RETURNING *
)
SELECT * FROM t;
ERROR:  RETURNING clause is not supported
SELECT * FROM tsurugifdw_y;
 a  
----
  1
  2
  3
  4
  5
  6
  7
  8
  9
 10
(10 rows)

-- DELETE ... RETURNING
WITH t AS (
    DELETE FROM tsurugifdw_y
    WHERE a <= 10
    RETURNING *
)
SELECT * FROM t;
ERROR:  RETURNING clause is not supported
SELECT * FROM tsurugifdw_y;
 a  
----
  1
  2
  3
  4
  5
  6
  7
  8
  9
 10
(10 rows)

-- forward reference
WITH RECURSIVE t AS (
	INSERT INTO tsurugifdw_y
		SELECT a+5 FROM t2 WHERE a > 5
	RETURNING *
), t2 AS (
	UPDATE tsurugifdw_y SET a=a-11 RETURNING *
)
SELECT * FROM t
UNION ALL
SELECT * FROM t2;
ERROR:  RETURNING clause is not supported
SELECT * FROM tsurugifdw_y;
 a  
----
  1
  2
  3
  4
  5
  6
  7
  8
  9
 10
(10 rows)

-- check merging of outer CTE with CTE in a rule action
SELECT tg_execute_ddl('CREATE TABLE tsurugifdw_bug6051 (i int)', 'tsurugidb');
  tg_execute_ddl   
-------------------
 execute succeeded
(1 row)

CREATE FOREIGN TABLE tsurugifdw_bug6051 (i int) SERVER tsurugidb;
INSERT INTO tsurugifdw_bug6051
  SELECT i FROM generate_series(1,3) AS t(i);
SELECT * FROM tsurugifdw_bug6051;
 i 
---
 1
 2
 3
(3 rows)

WITH t1 AS ( DELETE FROM tsurugifdw_bug6051 RETURNING * )
INSERT INTO tsurugifdw_bug6051 SELECT * FROM t1;
ERROR:  RETURNING clause is not supported
SELECT * FROM tsurugifdw_bug6051;
 i 
---
 1
 2
 3
(3 rows)

SELECT tg_execute_ddl('CREATE TABLE tsurugifdw_bug6051_2 (i int)', 'tsurugidb');
  tg_execute_ddl   
-------------------
 execute succeeded
(1 row)

CREATE FOREIGN TABLE tsurugifdw_bug6051_2 (i int) SERVER tsurugidb;
CREATE RULE bug6051_ins AS ON INSERT TO tsurugifdw_bug6051 DO INSTEAD
 INSERT INTO tsurugifdw_bug6051_2
 VALUES(NEW.i);
ERROR:  relation "tsurugifdw_bug6051" cannot have rules
DETAIL:  This operation is not supported for foreign tables.
WITH t1 AS ( DELETE FROM tsurugifdw_bug6051 RETURNING * )
INSERT INTO tsurugifdw_bug6051 SELECT * FROM t1;
ERROR:  RETURNING clause is not supported
SELECT * FROM tsurugifdw_bug6051;
 i 
---
 1
 2
 3
(3 rows)

SELECT * FROM tsurugifdw_bug6051_2;
 i 
---
(0 rows)

-- check INSERT ... SELECT rule actions are disallowed on commands
-- that have modifyingCTEs
CREATE OR REPLACE RULE bug6051_ins AS ON INSERT TO tsurugifdw_bug6051 DO INSTEAD
 INSERT INTO tsurugifdw_bug6051_2
 SELECT NEW.i;
ERROR:  relation "tsurugifdw_bug6051" cannot have rules
DETAIL:  This operation is not supported for foreign tables.
WITH t1 AS ( DELETE FROM tsurugifdw_bug6051 RETURNING * )
INSERT INTO tsurugifdw_bug6051 SELECT * FROM t1;
ERROR:  RETURNING clause is not supported
-- silly example to verify that hasModifyingCTE flag is propagated
SELECT tg_execute_ddl('CREATE TABLE tsurugifdw_bug6051_3 (a int)', 'tsurugidb');
  tg_execute_ddl   
-------------------
 execute succeeded
(1 row)

CREATE FOREIGN TABLE tsurugifdw_bug6051_3 (a int) SERVER tsurugidb;
INSERT INTO tsurugifdw_bug6051_3
  SELECT a FROM generate_series(11,13) AS a;
CREATE RULE bug6051_3_ins AS ON INSERT TO tsurugifdw_bug6051_3 DO INSTEAD
  SELECT i FROM tsurugifdw_bug6051_2;
ERROR:  relation "tsurugifdw_bug6051_3" cannot have rules
DETAIL:  This operation is not supported for foreign tables.
BEGIN; SET LOCAL debug_parallel_query = on;
WITH t1 AS ( DELETE FROM tsurugifdw_bug6051_3 RETURNING * )
  INSERT INTO tsurugifdw_bug6051_3 SELECT * FROM t1;
ERROR:  RETURNING clause is not supported
COMMIT;
SELECT * FROM tsurugifdw_bug6051_3;
 a  
----
 11
 12
 13
(3 rows)

SELECT tg_execute_ddl('DROP TABLE tsurugifdw_bug6051', 'tsurugidb');
  tg_execute_ddl   
-------------------
 execute succeeded
(1 row)

DROP FOREIGN TABLE tsurugifdw_bug6051;
SELECT tg_execute_ddl('DROP TABLE tsurugifdw_bug6051_2', 'tsurugidb');
  tg_execute_ddl   
-------------------
 execute succeeded
(1 row)

DROP FOREIGN TABLE tsurugifdw_bug6051_2;
SELECT tg_execute_ddl('DROP TABLE tsurugifdw_bug6051_3', 'tsurugidb');
  tg_execute_ddl   
-------------------
 execute succeeded
(1 row)

DROP FOREIGN TABLE tsurugifdw_bug6051_3;
-- check that recursive CTE processing doesn't rewrite a CTE more than once
-- (must not try to expand GENERATED ALWAYS IDENTITY columns more than once)
SELECT tg_execute_ddl('CREATE TABLE tsurugifdw_id_alw1 (i int GENERATED ALWAYS AS IDENTITY)', 'tsurugidb');
  tg_execute_ddl   
-------------------
 execute succeeded
(1 row)

CREATE FOREIGN TABLE tsurugifdw_id_alw1 (i int) SERVER tsurugidb;
SELECT tg_execute_ddl('CREATE TABLE tsurugifdw_id_alw2 (i int GENERATED ALWAYS AS IDENTITY)', 'tsurugidb');
  tg_execute_ddl   
-------------------
 execute succeeded
(1 row)

CREATE FOREIGN TABLE tsurugifdw_id_alw2 (i int) SERVER tsurugidb;
CREATE TEMP VIEW id_alw2_view AS SELECT * FROM tsurugifdw_id_alw2;
SELECT tg_execute_ddl('CREATE TABLE tsurugifdw_id_alw3 (i int GENERATED ALWAYS AS IDENTITY)', 'tsurugidb');
  tg_execute_ddl   
-------------------
 execute succeeded
(1 row)

CREATE FOREIGN TABLE tsurugifdw_id_alw3 (i int) SERVER tsurugidb;
CREATE RULE id_alw3_ins AS ON INSERT TO tsurugifdw_id_alw3 DO INSTEAD
  WITH t1 AS (INSERT INTO tsurugifdw_id_alw1 DEFAULT VALUES RETURNING i)
    INSERT INTO id_alw2_view DEFAULT VALUES RETURNING i;
ERROR:  relation "tsurugifdw_id_alw3" cannot have rules
DETAIL:  This operation is not supported for foreign tables.
CREATE TEMP VIEW id_alw3_view AS SELECT * FROM tsurugifdw_id_alw3;
SELECT tg_execute_ddl('CREATE TABLE tsurugifdw_id_alw4 (i int GENERATED ALWAYS AS IDENTITY)', 'tsurugidb');
  tg_execute_ddl   
-------------------
 execute succeeded
(1 row)

CREATE FOREIGN TABLE tsurugifdw_id_alw4 (i int) SERVER tsurugidb;
WITH t4 AS (INSERT INTO tsurugifdw_id_alw4 DEFAULT VALUES RETURNING i)
  INSERT INTO id_alw3_view DEFAULT VALUES RETURNING i;
ERROR:  RETURNING clause is not supported
SELECT * from tsurugifdw_id_alw1;
 i 
---
(0 rows)

SELECT * from tsurugifdw_id_alw2;
 i 
---
(0 rows)

SELECT * from tsurugifdw_id_alw3;
 i 
---
(0 rows)

SELECT * from tsurugifdw_id_alw4;
 i 
---
(0 rows)

DROP VIEW id_alw2_view;
DROP VIEW id_alw3_view;
SELECT tg_execute_ddl('DROP TABLE tsurugifdw_id_alw1', 'tsurugidb');
  tg_execute_ddl   
-------------------
 execute succeeded
(1 row)

DROP FOREIGN TABLE tsurugifdw_id_alw1;
SELECT tg_execute_ddl('DROP TABLE tsurugifdw_id_alw2', 'tsurugidb');
  tg_execute_ddl   
-------------------
 execute succeeded
(1 row)

DROP FOREIGN TABLE tsurugifdw_id_alw2;
SELECT tg_execute_ddl('DROP TABLE tsurugifdw_id_alw3', 'tsurugidb');
  tg_execute_ddl   
-------------------
 execute succeeded
(1 row)

DROP FOREIGN TABLE tsurugifdw_id_alw3;
SELECT tg_execute_ddl('DROP TABLE tsurugifdw_id_alw4', 'tsurugidb');
  tg_execute_ddl   
-------------------
 execute succeeded
(1 row)

DROP FOREIGN TABLE tsurugifdw_id_alw4;
-- check case where CTE reference is removed due to optimization
SELECT q1 FROM
(
  WITH t_cte AS (SELECT * FROM tsurugifdw_int8_tbl t)
  SELECT q1, (SELECT q2 FROM t_cte WHERE t_cte.q1 = i8.q1) AS t_sub
  FROM tsurugifdw_int8_tbl i8
) ss;
        q1        
------------------
              123
              123
 4567890123456789
 4567890123456789
 4567890123456789
(5 rows)

SELECT q1 FROM
(
  WITH t_cte AS MATERIALIZED (SELECT * FROM tsurugifdw_int8_tbl t)
  SELECT q1, (SELECT q2 FROM t_cte WHERE t_cte.q1 = i8.q1) AS t_sub
  FROM tsurugifdw_int8_tbl i8
) ss;
        q1        
------------------
              123
              123
 4567890123456789
 4567890123456789
 4567890123456789
(5 rows)

-- a truly recursive CTE in the same list
WITH RECURSIVE t(a) AS (
	SELECT 0
		UNION ALL
	SELECT a+1 FROM t WHERE a+1 < 5
), t2 as (
	INSERT INTO tsurugifdw_y
		SELECT * FROM t RETURNING *
)
SELECT * FROM t2 JOIN tsurugifdw_y USING (a) ORDER BY a;
ERROR:  RETURNING clause is not supported
SELECT * FROM tsurugifdw_y;
 a  
----
  1
  2
  3
  4
  5
  6
  7
  8
  9
 10
(10 rows)

-- data-modifying WITH in a modifying statement
WITH t AS (
    DELETE FROM tsurugifdw_y
    WHERE a <= 10
    RETURNING *
)
INSERT INTO tsurugifdw_y SELECT -a FROM t RETURNING *;
ERROR:  RETURNING clause is not supported
SELECT * FROM tsurugifdw_y;
 a  
----
  1
  2
  3
  4
  5
  6
  7
  8
  9
 10
(10 rows)

-- check that WITH query is run to completion even if outer query isn't
WITH t AS (
    UPDATE tsurugifdw_y SET a = a * 100 RETURNING *
)
SELECT * FROM t LIMIT 10;
ERROR:  RETURNING clause is not supported
SELECT * FROM tsurugifdw_y;
 a  
----
  1
  2
  3
  4
  5
  6
  7
  8
  9
 10
(10 rows)

-- data-modifying WITH containing INSERT...ON CONFLICT DO UPDATE
SELECT tg_execute_ddl(
  'CREATE TABLE tsurugifdw_withz ( k INTEGER PRIMARY KEY, v VARCHAR )',
  'tsurugidb'
);
  tg_execute_ddl   
-------------------
 execute succeeded
(1 row)

CREATE FOREIGN TABLE tsurugifdw_withz ( k INTEGER, v TEXT ) SERVER tsurugidb;
INSERT INTO tsurugifdw_withz
SELECT i AS k, (i || ' v')::text AS v
FROM generate_series(1, 16, 3) i;
WITH t AS (
    INSERT INTO tsurugifdw_withz SELECT i, 'insert'
    FROM generate_series(0, 16) i
    ON CONFLICT (k) DO UPDATE SET v = tsurugifdw_withz.v || ', now update'
    RETURNING *
)
SELECT * FROM t JOIN tsurugifdw_y ON t.k = tsurugifdw_y.a ORDER BY a, k;
ERROR:  there is no unique or exclusion constraint matching the ON CONFLICT specification
-- Test EXCLUDED.* reference within CTE
WITH aa AS (
    INSERT INTO tsurugifdw_withz VALUES(1, 5) ON CONFLICT (k) DO UPDATE SET v = EXCLUDED.v
    WHERE tsurugifdw_withz.k != EXCLUDED.k
    RETURNING *
)
SELECT * FROM aa;
ERROR:  there is no unique or exclusion constraint matching the ON CONFLICT specification
-- New query/snapshot demonstrates side-effects of previous query.
SELECT * FROM tsurugifdw_withz ORDER BY k;
 k  |  v   
----+------
  1 | 1 v
  4 | 4 v
  7 | 7 v
 10 | 10 v
 13 | 13 v
 16 | 16 v
(6 rows)

--
-- Ensure subqueries within the update clause work, even if they
-- reference outside values
--
WITH aa AS (SELECT 1 a, 2 b)
INSERT INTO tsurugifdw_withz VALUES(1, 'insert')
ON CONFLICT (k) DO UPDATE SET v = (SELECT b || ' update' FROM aa WHERE a = 1 LIMIT 1);
ERROR:  there is no unique or exclusion constraint matching the ON CONFLICT specification
WITH aa AS (SELECT 1 a, 2 b)
INSERT INTO tsurugifdw_withz VALUES(1, 'insert')
ON CONFLICT (k) DO UPDATE SET v = ' update' WHERE tsurugifdw_withz.k = (SELECT a FROM aa);
ERROR:  there is no unique or exclusion constraint matching the ON CONFLICT specification
WITH aa AS (SELECT 1 a, 2 b)
INSERT INTO tsurugifdw_withz VALUES(1, 'insert')
ON CONFLICT (k) DO UPDATE SET v = (SELECT b || ' update' FROM aa WHERE a = 1 LIMIT 1);
ERROR:  there is no unique or exclusion constraint matching the ON CONFLICT specification
WITH aa AS (SELECT 'a' a, 'b' b UNION ALL SELECT 'a' a, 'b' b)
INSERT INTO tsurugifdw_withz VALUES(1, 'insert')
ON CONFLICT (k) DO UPDATE SET v = (SELECT b || ' update' FROM aa WHERE a = 'a' LIMIT 1);
ERROR:  there is no unique or exclusion constraint matching the ON CONFLICT specification
WITH aa AS (SELECT 1 a, 2 b)
INSERT INTO tsurugifdw_withz VALUES(1, (SELECT b || ' insert' FROM aa WHERE a = 1 ))
ON CONFLICT (k) DO UPDATE SET v = (SELECT b || ' update' FROM aa WHERE a = 1 LIMIT 1);
ERROR:  there is no unique or exclusion constraint matching the ON CONFLICT specification
-- Update a row more than once, in different parts of a wCTE. That is
-- an allowed, presumably very rare, edge case, but since it was
-- broken in the past, having a test seems worthwhile.
WITH simpletup AS (
  SELECT 2 k, 'Green' v),
upsert_cte AS (
  INSERT INTO tsurugifdw_withz VALUES(2, 'Blue') ON CONFLICT (k) DO
    UPDATE SET (k, v) = (SELECT k, v FROM simpletup WHERE simpletup.k = tsurugifdw_withz.k)
    RETURNING k, v)
INSERT INTO tsurugifdw_withz VALUES(2, 'Red') ON CONFLICT (k) DO
UPDATE SET (k, v) = (SELECT k, v FROM upsert_cte WHERE upsert_cte.k = tsurugifdw_withz.k)
RETURNING k, v;
ERROR:  there is no unique or exclusion constraint matching the ON CONFLICT specification
SELECT tg_execute_ddl('DROP TABLE tsurugifdw_withz', 'tsurugidb');
  tg_execute_ddl   
-------------------
 execute succeeded
(1 row)

DROP FOREIGN TABLE tsurugifdw_withz;
-- WITH referenced by MERGE statement
SELECT tg_execute_ddl('CREATE TABLE tsurugifdw_m ( k INTEGER PRIMARY KEY, v VARCHAR )', 'tsurugidb');
  tg_execute_ddl   
-------------------
 execute succeeded
(1 row)

CREATE FOREIGN TABLE tsurugifdw_m ( k INTEGER, v TEXT ) SERVER tsurugidb;
INSERT INTO tsurugifdw_m
SELECT i AS k, (i || ' v')::text AS v
FROM generate_series(1, 16, 3) i;
WITH RECURSIVE cte_basic AS (SELECT 1 a, 'cte_basic val' b)
MERGE INTO tsurugifdw_m USING (select 0 k, 'merge source SubPlan' v) o ON tsurugifdw_m.k=o.k
WHEN MATCHED THEN UPDATE SET v = (SELECT b || ' merge update' FROM cte_basic WHERE cte_basic.a = tsurugifdw_m.k LIMIT 1)
WHEN NOT MATCHED THEN INSERT VALUES(o.k, o.v);
ERROR:  WITH RECURSIVE is not supported for MERGE statement
-- Basic:
WITH cte_basic AS MATERIALIZED (SELECT 1 a, 'cte_basic val' b)
MERGE INTO tsurugifdw_m USING (select 0 k, 'merge source SubPlan' v offset 0) o ON tsurugifdw_m.k=o.k
WHEN MATCHED THEN UPDATE SET v = (SELECT b || ' merge update' FROM cte_basic WHERE cte_basic.a = tsurugifdw_m.k LIMIT 1)
WHEN NOT MATCHED THEN INSERT VALUES(o.k, o.v);
ERROR:  cannot execute MERGE on relation "tsurugifdw_m"
DETAIL:  This operation is not supported for foreign tables.
-- Examine
SELECT * FROM tsurugifdw_m where k = 0;
 k | v 
---+---
(0 rows)

-- InitPlan
WITH cte_init AS MATERIALIZED (SELECT 1 a, 'cte_init val' b)
MERGE INTO tsurugifdw_m USING (select 1 k, 'merge source InitPlan' v offset 0) o ON tsurugifdw_m.k=o.k
WHEN MATCHED THEN UPDATE SET v = (SELECT b || ' merge update' FROM cte_init WHERE a = 1 LIMIT 1)
WHEN NOT MATCHED THEN INSERT VALUES(o.k, o.v);
ERROR:  cannot execute MERGE on relation "tsurugifdw_m"
DETAIL:  This operation is not supported for foreign tables.
-- Examine
SELECT * FROM tsurugifdw_m where k = 1;
 k |  v  
---+-----
 1 | 1 v
(1 row)

-- MERGE source comes from CTE:
WITH merge_source_cte AS MATERIALIZED (SELECT 15 a, 'merge_source_cte val' b)
MERGE INTO tsurugifdw_m USING (select * from merge_source_cte) o ON tsurugifdw_m.k=o.a
WHEN MATCHED THEN UPDATE SET v = (SELECT b || merge_source_cte.*::text || ' merge update' FROM merge_source_cte WHERE a = 15)
WHEN NOT MATCHED THEN INSERT VALUES(o.a, o.b || (SELECT merge_source_cte.*::text || ' merge insert' FROM merge_source_cte));
ERROR:  cannot execute MERGE on relation "tsurugifdw_m"
DETAIL:  This operation is not supported for foreign tables.
-- Examine
SELECT * FROM tsurugifdw_m where k = 15;
 k | v 
---+---
(0 rows)

SELECT tg_execute_ddl('DROP TABLE tsurugifdw_m', 'tsurugidb');
  tg_execute_ddl   
-------------------
 execute succeeded
(1 row)

DROP FOREIGN TABLE tsurugifdw_m;
-- check that run to completion happens in proper ordering
DELETE FROM tsurugifdw_y;
INSERT INTO tsurugifdw_y SELECT generate_series(1, 3);
SELECT tg_execute_ddl('CREATE TABLE tsurugifdw_yy ( a INTEGER )', 'tsurugidb');
  tg_execute_ddl   
-------------------
 execute succeeded
(1 row)

CREATE FOREIGN TABLE tsurugifdw_yy ( a INTEGER ) SERVER tsurugidb;
WITH RECURSIVE t1 AS (
  INSERT INTO tsurugifdw_y SELECT * FROM tsurugifdw_y RETURNING *
), t2 AS (
  INSERT INTO tsurugifdw_yy SELECT * FROM t1 RETURNING *
)
SELECT 1;
ERROR:  RETURNING clause is not supported
SELECT * FROM tsurugifdw_y;
 a 
---
 1
 2
 3
(3 rows)

SELECT * FROM tsurugifdw_yy;
 a 
---
(0 rows)

WITH RECURSIVE t1 AS (
  INSERT INTO tsurugifdw_yy SELECT * FROM t2 RETURNING *
), t2 AS (
  INSERT INTO tsurugifdw_y SELECT * FROM tsurugifdw_y RETURNING *
)
SELECT 1;
ERROR:  RETURNING clause is not supported
SELECT * FROM tsurugifdw_y;
 a 
---
 1
 2
 3
(3 rows)

SELECT * FROM tsurugifdw_yy;
 a 
---
(0 rows)

-- triggers
DELETE FROM tsurugifdw_y;
INSERT INTO tsurugifdw_y SELECT generate_series(1, 10);
CREATE FUNCTION y_trigger() RETURNS trigger AS $$
begin
  raise notice 'y_trigger: a = %', new.a;
  return new;
end;
$$ LANGUAGE plpgsql;
CREATE TRIGGER y_trig BEFORE INSERT ON tsurugifdw_y FOR EACH ROW
    EXECUTE PROCEDURE y_trigger();
WITH t AS (
    INSERT INTO tsurugifdw_y
    VALUES
        (21),
        (22),
        (23)
    RETURNING *
)
SELECT * FROM t;
ERROR:  RETURNING clause is not supported
SELECT * FROM tsurugifdw_y;
 a  
----
  1
  2
  3
  4
  5
  6
  7
  8
  9
 10
(10 rows)

DROP TRIGGER y_trig ON tsurugifdw_y;
CREATE TRIGGER y_trig AFTER INSERT ON tsurugifdw_y FOR EACH ROW
    EXECUTE PROCEDURE y_trigger();
WITH t AS (
    INSERT INTO tsurugifdw_y
    VALUES
        (31),
        (32),
        (33)
    RETURNING *
)
SELECT * FROM t LIMIT 1;
ERROR:  RETURNING clause is not supported
SELECT * FROM tsurugifdw_y;
 a  
----
  1
  2
  3
  4
  5
  6
  7
  8
  9
 10
(10 rows)

DROP TRIGGER y_trig ON tsurugifdw_y;
CREATE OR REPLACE FUNCTION y_trigger() RETURNS trigger AS $$
begin
  raise notice 'y_trigger';
  return null;
end;
$$ LANGUAGE plpgsql;
CREATE TRIGGER y_trig AFTER INSERT ON tsurugifdw_y FOR EACH STATEMENT
    EXECUTE PROCEDURE y_trigger();
WITH t AS (
    INSERT INTO tsurugifdw_y
    VALUES
        (41),
        (42),
        (43)
    RETURNING *
)
SELECT * FROM t;
ERROR:  RETURNING clause is not supported
SELECT * FROM tsurugifdw_y;
 a  
----
  1
  2
  3
  4
  5
  6
  7
  8
  9
 10
(10 rows)

DROP TRIGGER y_trig ON tsurugifdw_y;
DROP FUNCTION y_trigger();
-- error cases
-- data-modifying WITH tries to use its own output
WITH RECURSIVE t AS (
	INSERT INTO tsurugifdw_y
		SELECT * FROM t
)
VALUES(FALSE);
ERROR:  recursive query "t" must not contain data-modifying statements
LINE 1: WITH RECURSIVE t AS (
                       ^
-- no RETURNING in a referenced data-modifying WITH
WITH t AS (
	INSERT INTO tsurugifdw_y VALUES(0)
)
SELECT * FROM t;
ERROR:  WITH query "t" does not have a RETURNING clause
LINE 4: SELECT * FROM t;
                      ^
-- RETURNING tries to return its own output
WITH RECURSIVE t(action, a) AS (
	MERGE INTO tsurugifdw_y USING (VALUES (11)) v(a) ON tsurugifdw_y.a = v.a
		WHEN NOT MATCHED THEN INSERT VALUES (v.a)
		RETURNING merge_action(), (SELECT a FROM t)
)
SELECT * FROM t;
ERROR:  recursive query "t" must not contain data-modifying statements
LINE 1: WITH RECURSIVE t(action, a) AS (
                       ^
-- data-modifying WITH allowed only at the top level
SELECT * FROM (
	WITH t AS (UPDATE tsurugifdw_y SET a=a+1 RETURNING *)
	SELECT * FROM t
) ss;
ERROR:  WITH clause containing a data-modifying statement must be at the top level
LINE 2:  WITH t AS (UPDATE tsurugifdw_y SET a=a+1 RETURNING *)
              ^
-- most variants of rules aren't allowed
CREATE RULE y_rule AS ON INSERT TO tsurugifdw_y WHERE a=0 DO INSTEAD DELETE FROM tsurugifdw_y;
ERROR:  relation "tsurugifdw_y" cannot have rules
DETAIL:  This operation is not supported for foreign tables.
WITH t AS (
	INSERT INTO tsurugifdw_y VALUES(0)
)
VALUES(FALSE);
 column1 
---------
 f
(1 row)

CREATE OR REPLACE RULE y_rule AS ON INSERT TO tsurugifdw_y DO INSTEAD NOTHING;
ERROR:  relation "tsurugifdw_y" cannot have rules
DETAIL:  This operation is not supported for foreign tables.
WITH t AS (
	INSERT INTO tsurugifdw_y VALUES(0)
)
VALUES(FALSE);
 column1 
---------
 f
(1 row)

CREATE OR REPLACE RULE y_rule AS ON INSERT TO tsurugifdw_y DO INSTEAD NOTIFY foo;
ERROR:  relation "tsurugifdw_y" cannot have rules
DETAIL:  This operation is not supported for foreign tables.
WITH t AS (
	INSERT INTO tsurugifdw_y VALUES(0)
)
VALUES(FALSE);
 column1 
---------
 f
(1 row)

CREATE OR REPLACE RULE y_rule AS ON INSERT TO tsurugifdw_y DO ALSO NOTIFY foo;
ERROR:  relation "tsurugifdw_y" cannot have rules
DETAIL:  This operation is not supported for foreign tables.
WITH t AS (
	INSERT INTO tsurugifdw_y VALUES(0)
)
VALUES(FALSE);
 column1 
---------
 f
(1 row)

CREATE OR REPLACE RULE y_rule AS ON INSERT TO tsurugifdw_y
  DO INSTEAD (NOTIFY foo; NOTIFY bar);
ERROR:  relation "tsurugifdw_y" cannot have rules
DETAIL:  This operation is not supported for foreign tables.
WITH t AS (
	INSERT INTO tsurugifdw_y VALUES(0)
)
VALUES(FALSE);
 column1 
---------
 f
(1 row)

-- check that parser lookahead for WITH doesn't cause any odd behavior
create table tsurugifdw_foo (with baz);  -- fail, WITH is a reserved word
ERROR:  syntax error at or near "with"
LINE 1: create table tsurugifdw_foo (with baz);
                                     ^
create table tsurugifdw_foo (with ordinality);  -- fail, WITH is a reserved word
ERROR:  syntax error at or near "with"
LINE 1: create table tsurugifdw_foo (with ordinality);
                                     ^
with ordinality as (select 1 as x) select * from ordinality;
 x 
---
 1
(1 row)

-- check sane response to attempt to modify CTE relation
WITH with_test AS (SELECT 42) INSERT INTO with_test VALUES (1);
ERROR:  relation "with_test" does not exist
LINE 1: WITH with_test AS (SELECT 42) INSERT INTO with_test VALUES (...
                                                  ^
-- check response to attempt to modify table with same name as a CTE (perhaps
-- surprisingly it works, because CTEs don't hide tables from data-modifying
-- statements)
SELECT tg_execute_ddl('CREATE TABLE tsurugifdw_with_test (i int)', 'tsurugidb');
  tg_execute_ddl   
-------------------
 execute succeeded
(1 row)

CREATE FOREIGN TABLE tsurugifdw_with_test (i int) SERVER tsurugidb;
with tsurugifdw_with_test as (select 42) insert into tsurugifdw_with_test select * from tsurugifdw_with_test;
select * from tsurugifdw_with_test;
 i  
----
 42
(1 row)

SELECT tg_execute_ddl('DROP TABLE tsurugifdw_with_test', 'tsurugidb');
  tg_execute_ddl   
-------------------
 execute succeeded
(1 row)

DROP FOREIGN TABLE tsurugifdw_with_test;
SELECT tg_execute_ddl('DROP TABLE tsurugifdw_department', 'tsurugidb');
  tg_execute_ddl   
-------------------
 execute succeeded
(1 row)

DROP FOREIGN TABLE tsurugifdw_department;
ERROR:  cannot drop foreign table tsurugifdw_department because other objects depend on it
DETAIL:  view vsubdepartment depends on foreign table tsurugifdw_department
HINT:  Use DROP ... CASCADE to drop the dependent objects too.
SELECT tg_execute_ddl('DROP TABLE tsurugifdw_tree', 'tsurugidb');
  tg_execute_ddl   
-------------------
 execute succeeded
(1 row)

DROP FOREIGN TABLE tsurugifdw_tree;
SELECT tg_execute_ddl('DROP TABLE tsurugifdw_duplicates', 'tsurugidb');
  tg_execute_ddl   
-------------------
 execute succeeded
(1 row)

DROP FOREIGN TABLE tsurugifdw_duplicates;
SELECT tg_execute_ddl('DROP TABLE tsurugifdw_graph0', 'tsurugidb');
  tg_execute_ddl   
-------------------
 execute succeeded
(1 row)

DROP FOREIGN TABLE tsurugifdw_graph0;
ERROR:  cannot drop foreign table tsurugifdw_graph0 because other objects depend on it
DETAIL:  view v_search depends on foreign table tsurugifdw_graph0
HINT:  Use DROP ... CASCADE to drop the dependent objects too.
SELECT tg_execute_ddl('DROP TABLE tsurugifdw_graph', 'tsurugidb');
  tg_execute_ddl   
-------------------
 execute succeeded
(1 row)

DROP FOREIGN TABLE tsurugifdw_graph;
ERROR:  cannot drop foreign table tsurugifdw_graph because other objects depend on it
DETAIL:  view v_cycle1 depends on foreign table tsurugifdw_graph
view v_cycle2 depends on foreign table tsurugifdw_graph
HINT:  Use DROP ... CASCADE to drop the dependent objects too.
SELECT tg_execute_ddl('DROP TABLE tsurugifdw_y', 'tsurugidb');
  tg_execute_ddl   
-------------------
 execute succeeded
(1 row)

DROP FOREIGN TABLE tsurugifdw_y;
SELECT tg_execute_ddl('DROP TABLE tsurugifdw_x', 'tsurugidb');
  tg_execute_ddl   
-------------------
 execute succeeded
(1 row)

DROP FOREIGN TABLE tsurugifdw_x;
SELECT tg_execute_ddl('DROP TABLE tsurugifdw_yy', 'tsurugidb');
  tg_execute_ddl   
-------------------
 execute succeeded
(1 row)

DROP FOREIGN TABLE tsurugifdw_yy;
SELECT tg_execute_ddl('DROP TABLE tsurugifdw_int4_tbl', 'tsurugidb');
  tg_execute_ddl   
-------------------
 execute succeeded
(1 row)

DROP FOREIGN TABLE tsurugifdw_int4_tbl;
SELECT tg_execute_ddl('DROP TABLE tsurugifdw_int8_tbl', 'tsurugidb');
  tg_execute_ddl   
-------------------
 execute succeeded
(1 row)

DROP FOREIGN TABLE tsurugifdw_int8_tbl;
